Title,Authors,Journal
Scale-free modulation of resting-state neuronal oscillations reflects prolonged brain maturation in humans,"Smit, Dirk J. A; de Geus, Eco J. C; van de Nieuwenhuijzen, Marieke E; van Beijsterveldt, Catharina E. M; van Baal, G. Caroline M; et al.","The Journal of Neuroscience Vol. 31, Iss. 37,  (Sep 14, 2011): 13128-13136."
Oscillations and hippocampal–prefrontal synchrony,"Colgin, Laura Lee.","Current Opinion in Neurobiology Vol. 21, Iss. 3,  (Jun 2011): 467-474."
A wavelet-based method for measuring the oscillatory dynamics of resting-state functional connectivity in MEG,"Ghuman, Avniel Singh; McDaniel, Jonathan R; Martin, Alex.","NeuroImage; Amsterdam Vol. 56, Iss. 1,  (May 1, 2011): 69-77."
Attentional modulation of alpha oscillations in macaque inferotemporal cortex,"Mo, Jue; Schroeder, Charles E; Ding, Mingzhou.","The Journal of Neuroscience Vol. 31, Iss. 3,  (Jan 19, 2011): 878-882."
Spectral–temporal analysis of cortical oscillations during lexical processing,"Tavabi, Kambiz; Embick, David; Roberts, Timothy P. L.","NeuroReport: For Rapid Communication of Neuroscience Research Vol. 22, Iss. 10,  (Jul 13, 2011): 474-478."
Steady-State Visual Evoked Potentials Can Be Explained by Temporal Superposition of Transient Event-Related Responses,"Capilla, Almudena; Pazo-Alvarez, Paula; Darriba, Alvaro; Campo, Pablo; Gross, Joachim.","PLoS One; San Francisco Vol. 6, Iss. 1,  (Jan 2011): e14543."
Gamma-oscillations modulated by picture naming and word reading: Intracranial recording in epileptic patients,"Wu, Helen C; Nagasawa, Tetsuro; Brown, Erik C; Juhasz, Csaba; Rothermel, Robert; et al.","Clinical Neurophysiology Vol. 122, Iss. 10,  (Oct 2011): 1929-1942."
Power spectral analysis in infants with seizures: Relationship to development,"Kulandaivel, Kandan; Holmes, Gregory L.","Epilepsy & Behavior Vol. 20, Iss. 4,  (Apr 2011): 700-705."
Oscillations in the prefrontal cortex: A gateway to memory and attention,"Benchenane, Karim; Tiesinga, Paul H; Battaglia, Francesco P.","Current Opinion in Neurobiology Vol. 21, Iss. 3,  (Jun 2011): 475-485."
Long-range synchrony of gamma oscillations and auditory hallucination symptoms in schizophrenia,"Mulert, C; Kirsch, V; Pascual-Marqui, Roberto; McCarley, Robert W; Spencer, Kevin M.","International Journal of Psychophysiology Vol. 79, Iss. 1,  (Jan 2011): 55-63."
