Title,Authors,Journal
The neurophysiological basis of developmental changes during sequential cognitive flexibility between adolescents and adults,"Giller, Franziska; Zhang, Rui; Roessner, Veit; Beste, Christian.","Human Brain Mapping Vol. 40, Iss. 2,  (Feb 1, 2019): 552-565."
Disrupted information flow in resting-state in adolescents with sports related concussion,"Hristopulos, Dionissios T; Babul, Arif; Babul, Shazia'Ayn; Brucar, Leyla R; Virji-Babul, Naznin.","Frontiers in Human Neuroscience Vol. 13,  (Dec 12, 2019)."
Atypical temporal dynamics of resting state shapes stimulus-evoked activity in depression—An EEG study on rest–stimulus interaction,"Wolff, Annemnarie; de la Salle, Sara; Sorgini, Alana; Lynn, Emma; Blier, Pierre; et al.","Frontiers in Psychiatry Vol. 10,  (Oct 15, 2019)."
Discrete electrocortical predictors of anxiety and anxiety-related treatment response in youth with autism spectrum disorder,"Kang, Erin; Clarkson, Tessa; Keifer, Cara M; Rosen, Tamara E; Lerner, Matthew D.","Biological Psychology Vol. 146,  (Sep 2019)."
Cerebral cortical networking for mental workload assessment under various demands during dual-task walking,"Shaw, Emma P; Rietschel, Jeremy C; Shuggi, Isabelle M; Xu, Yishi; Chen, Shuo; et al.","Experimental Brain Research Vol. 237, Iss. 9,  (Sep 1, 2019): 2279-2295."
Effects of active and observational experience on EEG activity during early childhood,"Bryant, Lauren J; Cuevas, Kimberly.","Psychophysiology Vol. 56, Iss. 7,  (Jul 2019): 1-13."
Resting frontal EEG asymmetry and emotion regulation in older adults: The midlife in the United States (MIDUS) study,"Kelley, Nicholas J; Hughes, Matthew L.","Psychology and Aging Vol. 34, Iss. 3,  (May 2019): 341-347."
Threat‐conditioned contexts modulate the late positive potential to faces—A mobile EEG/virtual reality study,"Stolz, Christopher; Endres, Dominik; Mueller, Erik M.","Psychophysiology Vol. 56, Iss. 4,  (Apr 2019): 15."
Interest as a proxy of engagement in news reading: Spectral and entropy analyses of EEG activity patterns,"Arapakis, Ioannis; Barreda-Ángeles, Miguel; Pereda-Baños, Alexandre.","IEEE Transactions on Affective Computing Vol. 10, Iss. 1,  (Jan 2019 - Mar 2019): 100-114."
Childhood trauma and dissociative symptoms predict frontal EEG asymmetry in borderline personality disorder,"Popkirov, Stoyan; Flasbeck, Vera; Schlegel, Uwe; Juckel, Georg; Brüne, Martin.","Journal of Trauma & Dissociation Vol. 20, Iss. 1,  (Jan 2019 - Feb 2019): 32-47."
Levodopa may affect cortical excitability in Parkinson's disease patients with cognitive deficits as revealed by reduced activity of cortical sources of resting state electroencephalographic rhythms,"Babiloni, Claudio; Del Percio, Claudio; Lizio, Roberta; Noce, Giuseppe; Lopez, Susanna; et al.","Neurobiology of Aging Vol. 73,  (Jan 2019): 9-20."
Socioeconomic status related differences in resting state EEG activity correspond to differences in vocabulary and working memory in grade school,"Maguire, Mandy J; Schneider, Julie M.","Brain and Cognition Vol. 137,  (Dec 2019)."
Hierarchical organization of melodic sequences is encoded by cortical entrainment,"Baltzell, Lucas S; Srinivasan, Ramesh; Richards, Virginia.","NeuroImage Vol. 200,  (Oct 15, 2019): 490-500."
"Correlation of EEG spectra, connectivity, and information theoretical biomarkers with psychological states in the epilepsy monitoring unit — A pilot study","Höller, Yvonne; Trinka, Eugen; Kalss, Gudrun; Schiepek, Günter; Michaelis, Rosa.","Epilepsy & Behavior Vol. 99,  (Oct 2019)."
Frequency-dependent changes in resting state electroencephalogram functional networks after traumatic brain injury in piglets,"Atlan, Lorre S; Margulies, Susan S.","Journal of Neurotrauma Vol. 36, Iss. 17,  (Sep 1, 2019): 2558-2578."
Encoding pleasant and unpleasant expression of the architectural window shapes: An ERP study,"Naghibi Rad, Parastou; Shahroudi, Abbas Ali; Shabani, Hamed; Ajami, Sahar; Lashgari, Reza.","Frontiers in Behavioral Neuroscience Vol. 13,  (Aug 16, 2019)."
Post-natal development of EEG responses to noxious stimulation in pigs ( Sus scrofa) aged 1–15 days,"Kells, N. J; Beausoleil, N. J; Sutherland, M. A; Johnson, C. B.","Animal Welfare Vol. 28, Iss. 3,  (Aug 2019): 317-329."
Evidence for we-representations during joint action planning,"Kourtis, Dimitrios; Woźniak, Mateusz; Sebanz, Natalie; Knoblich, Günther.","Neuropsychologia Vol. 131,  (Aug 2019): 73-83."
Differential deployment of visual attention during interactive approach and avoidance behavior,"Renton, Angela I; Painter, David R; Mattingley, Jason B.","Cerebral Cortex Vol. 29, Iss. 6,  (Jun 2019): 2366-2383."
Sleep deprivation compromises resting‐state emotional regulatory processes: An EEG study,"Zhang, Jinxiao; Lau, Esther Yuet Ying; Hsiao, Janet H.","Journal of Sleep Research Vol. 28, Iss. 3,  (Jun 2019)."
Interaction of EEG rhythms in a set to a facial expression,"Yakovenko, I. A; Petrenko, N. E; Cheremushkin, E. A; Kozlov, M. K.","Neuroscience and Behavioral Physiology Vol. 49, Iss. 4,  (May 15, 2019): 508-513."
An EEG investigation of the attention-related impact of mindfulness training in youth with ADHD: Outcomes and methodological considerations,"Sibalis, Annabel; Milligan, Karen; Pun, Carson; McKeough, Trish; Schmidt, Louis A; et al.","Journal of Attention Disorders Vol. 23, Iss. 7,  (May 2019): 733-743."
The influence of microgravity on cerebral blood flow and electrocortical activity,"Klein, Timo; Wollseiffen, Petra; Sanders, Marit; Claassen, Jurgen; Carnahan, Heather; et al.","Experimental Brain Research Vol. 237, Iss. 4,  (Apr 8, 2019): 1057-1062."
"Neurodevelopmental differences to social exclusion: An event-related neural oscillation study of children, adolescents, and adults","Tang, Alva; Lahat, Ayelet; Crowley, Michael J; Wu, Jia; Schmidt, Louis A.","Emotion Vol. 19, Iss. 3,  (Apr 2019): 520-532."
Unmixing oscillatory brain activity by EEG source localization and empirical mode decomposition,"Hansen, Sofie Therese; Hemakom, Apit; Safeldt, Mads Gylling; Krohne, Lærke Karen; Madsen, Kristoffer Hougaard; et al.","Computational Intelligence and Neuroscience Vol. 2019,  (Mar 14, 2019)."
Challenges of P300 modulation using transcranial alternating current stimulation (tACS),"Popp, Fabian; Dallmer-Zerbe, Isa; Philipsen, Alexandra; Herrmann, Christoph S.","Frontiers in Psychology Vol. 10,  (Mar 5, 2019)."
The electrophysiology of subjectively perceived memory confidence in relation to recollection and familiarity,"Wynn, Syanah C; Daselaar, Sander M; Kessels, Roy P. C; Schutter, Dennis J. L. G.","Brain and Cognition Vol. 130,  (Mar 2019): 20-27."
Brain-to-brain synchrony and learning outcomes vary by student–teacher dynamics: Evidence from a real-world classroom electroencephalography study,"Bevilacqua, Dana; Davidesco, Ido; Wan, Lu; Chaloner, Kim; Rowland, Jess; et al.","Journal of Cognitive Neuroscience Vol. 31, Iss. 3,  (Mar 2019): 401-411."
Tonic thermonociceptive stimulation selectively modulates ongoing neural oscillations in the human posterior insula: Evidence from intracerebral EEG,"Liberati, Giulia; Algoet, Maxime; Santos, Susana Ferrao; Ribeiro-Vaz, Jose Geraldo; Raftopoulos, Christian; et al.","NeuroImage Vol. 188,  (Mar 1, 2019): 70-83."
Management of psychogenic non‐epileptic seizures: A multidisciplinary approach,"Gasparini, S; Beghi, E; Ferlazzo, E; Beghi, M; Belcastro, V; et al.","European Journal of Neurology Vol. 26, Iss. 2,  (Feb 2019): 205-213."
A randomized controlled trial comparing a “bottom-up” and “top-down” approach to cognitive training in schizophrenia,"Jahshan, Carol; Vinogradov, Sophia; Wynn, Jonathan K; Hellemann, Gerhard; Green, Michael F.","Journal of Psychiatric Research Vol. 109,  (Feb 2019): 118-125."
Preterm birth changes networks of newborn cortical activity,"Tokariev, Anton; Stjerna, Susanna; Lano, Aulikki; Metsäranta, Marjo; Palva, J. Matias; et al.","Cerebral Cortex Vol. 29, Iss. 2,  (Feb 2019): 814-826."
Breakthrough percepts of famous faces,"Alsufyani, Abdulmajeed; Hajilou, Omid; Zoumpoulaki, Alexia; Filetti, Marco; Alsufyani, Hamed; et al.","Psychophysiology Vol. 56, Iss. 1,  (Jan 2019): 20."
A high‐density EGG study of differentiation between two speeds and directions of simulated optic flow in adults and infants,"Vilhelmsen, Kenneth; Agyei, Seth B; van der Weel, F. R. (Ruud); van der Meer, Audrey L. H.","Psychophysiology Vol. 56, Iss. 1,  (Jan 2019): 15."
"Wearing a bike helmet leads to less cognitive control, revealed by lower frontal midline theta power and risk indifference","Schmidt, Barbara; Kessler, Luisa; Holroyd, Clay B; Miltner, Wolfgang H. R.","Psychophysiology Vol. 56, Iss. 12,  (Dec 2019)."
Hyperconnectivity during screen-based stories listening is associated with lower narrative comprehension in preschool children exposed to screens vs dialogic reading: An EEG study,"Farah, Rola; Meri, Raya; Kadis, Darren S; Hutton, John; DeWitt, Thomas; et al.","PLoS ONE Vol. 14, Iss. 11,  (Nov 22, 2019)."
Sleep architecture changes in the APP23 mouse model manifest at onset of cognitive deficits,"Van Erum, Jan; Van Dam, Debby; Sheorajpanday, Rishi; De Deyn, Peter Paul.","Behavioural Brain Research Vol. 373,  (Nov 5, 2019)."
Revisiting mental rotation with stereoscopic disparity: A new spin for a classic paradigm,"Burles, Ford; Lu, James; Slone, Edward; Cortese, Filomeno; Iaria, Giuseppe; et al.","Brain and Cognition Vol. 136,  (Nov 2019)."
Clarifying the relationship between trait empathy and action-based resonance indexed by EEG mu-rhythm suppression,"DiGirolamo, Marissa A; Simon, Jeremy C; Hubley, Kristiana M; Kopulsky, Alek; Gutsell, Jennifer N.","Neuropsychologia Vol. 133,  (Oct 2019)."
Neural oscillatory dynamics of inhibitory control in young adult binge drinkers,"Holcomb, Lee A; Huang, Siyuan; Cruz, Stephen M; Marinkovic, Ksenija.","Biological Psychology Vol. 146,  (Sep 2019)."
Sensorimotor brain dynamics reflect architectural affordances,"Djebbara, Zakaria; Fich, Lars Brorson; Petrini, Laura; Gramann, Klaus.","PNAS Proceedings of the National Academy of Sciences of the United States of America Vol. 116, Iss. 29,  (Jul 16, 2019): 14769-14778."
Cortical beta oscillations are associated with motor performance following visuomotor learning,"Espenhahn, Svenja; van Wijk, Bernadette C. M; Rossiter, Holly E; de Berker, Archy O; Redman, Nell D; et al.","NeuroImage Vol. 195,  (Jul 15, 2019): 340-353."
Enhancing the usability of brain-computer interface systems,"Baek, Hyun Jae; Chang, Min Hye; Heo, Jeong; Park, Kwang Suk.","Computational Intelligence and Neuroscience Vol. 2019,  (Jun 16, 2019)."
"Sleep EEG functional connectivity varies with age and sex, but not general intelligence","Ujma, Péter P; Konrad, Boris N; Simor, Péter; Gombos, Ferenc; Körmendi, János; et al.","Neurobiology of Aging Vol. 78,  (Jun 2019): 87-97."
Progressive reduction of auditory evoked gamma in first episode schizophrenia but not clinical high risk individuals,"Oribe, Naoya; Hirano, Yoji; del Re, Elisabetta; Seidman, Larry J; Mesholam-Gately, Raquelle I; et al.","Schizophrenia Research Vol. 208,  (Jun 2019): 145-152."
Investigating the fit between phonological feature systems and brain responses to speech using EEG,"McCloy, Daniel R; Lee, Adrian K. C.","Language, Cognition and Neuroscience Vol. 34, Iss. 5,  (Jun 2019): 662-676."
Rapid extraction of emotion regularities from complex scenes in the human brain,"Schettino, Antonio; Gundlach, Christopher; Müller, Matthias M.","Collabra Psychology Vol. 5, Iss. 1,  (May 7, 2019)."
The functional consequences of social attention for memory-guided attention orienting and anticipatory neural dynamics,"Doherty, Brianna Ruth; van Ede, Freek; Fraser, Alexander; Patai, Eva Zita; Nobre, Anna Christina; et al.","Journal of Cognitive Neuroscience Vol. 31, Iss. 5,  (May 2019): 686-698."
Longitudinal Analysis of Stroke Patients’ Brain Rhythms during an Intervention with a Brain-Computer Interface,"Carino-Escobar, Ruben I; Carrillo-Mora, Paul; Valdés-Cristerna, Raquel; Rodriguez-Barragan, Marlene A; Hernandez-Arenas, Claudia; et al.","Neural Plasticity Vol. 2019,  (Apr 14, 2019)."
The effects of oral nicotine administration and abstinence on sleep in male C57BL/6J mice,"Mathews, Hunter L; Stitzel, Jerry A.","Psychopharmacology Vol. 236, Iss. 4,  (Apr 1, 2019): 1335-1347."
An improved refined composite multivariate multiscale fuzzy entropy method for MI-EEG feature extraction,"Li, Mingai; Wang, Ruotu; Yang, Jinfu; Duan, Lijuan.","Computational Intelligence and Neuroscience Vol. 2019,  (Mar 28, 2019)."
Frequency of helping friends and helping strangers is explained by different neural signatures,"Saulin, Anne; Baumgartner, Thomas; Gianotti, Lorena R. R; Hofmann, Wilhelm; Knoch, Daria.","Cognitive, Affective & Behavioral Neuroscience Vol. 19, Iss. 1,  (Feb 15, 2019): 177-186."
"Testing the influence of musical expertise on novel word learning across the lifespan using a cross-sectional approach in children, young adults and older adults","Dittinger, Eva; Scherer, Johanna; Jäncke, Lutz; Besson, Mireille; Elmer, Stefan.","Brain and Language Vol. 198,  (Nov 2019)."
The multipole approach for EEG forward modeling using the finite element method,"Vorwerk, Johannes; Hanrath, Anne; Wolters, Carsten H; Grasedyck, Lars.","NeuroImage Vol. 201,  (Nov 1, 2019)."
A comparison of mental workload in individuals with transtibial and transfemoral lower limb loss during dual-task walking under varying demand,"Shaw, Emma P; Rietschel, Jeremy C; Hendershot, Brad D; Pruziner, Alison L; Wolf, Erik J; et al.","Journal of the International Neuropsychological Society Vol. 25, Iss. 9,  (Oct 2019): 985-997."
Spatially specific attention mechanisms are sensitive to competition during visual search,"Yeh, Lu-Chun; Yeh, Yei-Yu; Kuo, Bo-Cheng.","Journal of Cognitive Neuroscience Vol. 31, Iss. 8,  (Aug 2019): 1248-1259."
Waking qEEG to assess psychophysiological stress and alertness during simulated on-call conditions,"Perrin, S. L; Jay, S. M; Vincent, G. E; Sprajcer, M; Lack, L; et al.","International Journal of Psychophysiology Vol. 141,  (Jul 2019): 93-100."
Can brain waves really tell if a product will be purchased? Inferring consumer preferences from single-item brain potentials,"Goto, Nobuhiko; Lim, Xue Li; Shee, Dexter; Hatano, Aya; Khong, Kok Wei; et al.","Frontiers in Integrative Neuroscience Vol. 13,  (Jun 28, 2019)."
Layers of latent effects in cognitive control: An EEG investigation,"Erb, Christopher D; Cavanagh, James F.","Acta Psychologica Vol. 195,  (Apr 2019): 1-11."
Use of prosocial word enhances the processing of language: Frequency domain analysis of human EEG,"Tarai, Shashikanta; Mukherjee, Rupsha; Qurratul, Quais Ain; Singh, Bikesh Kumar; Bit, Arindam.","Journal of Psycholinguistic Research Vol. 48, Iss. 1,  (Feb 15, 2019): 145-161."
Effects of longer vs. Shorter timed movement sequences on alpha motor inhibition when combining contractions and relaxations,"Flüthmann, Nils; Kato, Kouki; Bloch, Oliver; Kanosue, Kazyuki; Vogt, Tobias.","Experimental Brain Research Vol. 237, Iss. 1,  (Jan 31, 2019): 101-109."
Cognitive dysfunctions in a minimally verbal (MV) patient with Autism Spectrum Disorder (ASD),"Markiewicz, Katarzyna; Kaczmarek, Bożydar L. J; Kropotov, Juri D; MacQueen, Weronika D; MacQueen, Bruce D; et al.","Acta Neuropsychologica Vol. 17, Iss. 3,  (2019): 301-310."
Neural mechanisms of training an auditory event‐related potential task in a brain–computer interface context,"Halder, Sebastian; Leinfelder, Teresa; Schulz, Stefan M; Kübler, Andrea.","Human Brain Mapping Vol. 40, Iss. 8,  (Jun 1, 2019): 2399-2412."
Effects of baby schema and mere exposure on explicit and implicit face processing,"Venturoso, Leonardo; Gabrieli, Giulio; Truzzi, Anna; Azhari, Atiqah; Setoh, Peipei; et al.","Frontiers in Psychology Vol. 10,  (Nov 29, 2019)."
Behavioral and electrophysiological evidence for parent training in young children with autism symptoms and excessive screen-time,"sadeghi, Saeid; Pouretemad, Hamidreza; Khosrowabadi, Reza; Fathabadi, Jalil; Nikbakht, Sedighe.","Asian Journal of Psychiatry Vol. 45,  (Oct 2019): 7-12."
Cortical processes underlying the effects of static sound timing on perceived visual speed,"Kaya, Utku; Kafaligonul, Hulusi.","NeuroImage Vol. 199,  (Oct 1, 2019): 194-205."
Preterm modulation of connectivity by endogenous generators: The theta temporal activities in coalescence with slow waves,"Adebimpe, Azeez; Routier, Laura; Wallois, Fabrice.","Brain Topography Vol. 32, Iss. 5,  (Sep 2019): 762-772."
Creativity is associated with a characteristic U-shaped function of alpha power changes accompanied by an early increase in functional coupling,"Rominger, Christian; Papousek, Ilona; Perchtold, Corinna M; Benedek, Mathias; Weiss, Elisabeth M; et al.","Cognitive, Affective & Behavioral Neuroscience Vol. 19, Iss. 4,  (Aug 2019): 1012-1021."
TMS-EEG approach unveils brain mechanisms underlying conscious and unconscious face perception,"Mattavelli, Giulia; Pisoni, Alberto; Romero Lauro, Leonor J; Marino, Barbara F; Bonomi, Martina; et al.","Brain Stimulation Vol. 12, Iss. 4,  (Jul 2019 - Aug 2019): 1010-1019."
Texting while walking: An expensive switch cost,"Courtemanche, Francois; Labonté-LeMoyne, Elise; Léger, Pierre-Majorique; Fredette, Marc; Senecal, Sylvain; et al.","Accident Analysis and Prevention Vol. 127,  (Jun 2019): 1-8."
Transition of brain networks from an interictal to a preictal state preceding a seizure revealed by scalp EEG network analysis,"Li, Fali; Liang, Yi; Zhang, Luyan; Yi, Chanlin; Liao, Yuanyuan; et al.","Cognitive Neurodynamics Vol. 13, Iss. 2,  (Apr 15, 2019): 175-181."
Regional delta waves in human rapid eye movement sleep,"Bernardi, Giulio; Betta, Monica; Ricciardi, Emiliano; Pietrini, Pietro; Tononi, Giulio; et al.","The Journal of Neuroscience Vol. 39, Iss. 14,  (Apr 3, 2019): 2686-2697."
Single-trial EEG dissociates motivation and conflict processes during decision-making under risk,"Pornpattananangkul, Narun; Grogans, Shannon; Yu, Rongjun; Nusslock, Robin.","NeuroImage Vol. 188,  (Mar 1, 2019): 483-501."
Beneficial effects of acute high-intensity exercise on electrophysiological indices of attention processes in young adult men,"Du Rietz, Ebba; Barker, Alan R; Michelini, Giorgia; Rommel, Anna-Sophie; Vainieri, Isabella; et al.","Behavioural Brain Research Vol. 359,  (Feb 1, 2019): 474-484."
The role of emotion arousal in the retrieval practice effect,"Jia, Xi; Gao, Chuanji; Cui, Lixia; Guo, Chunyan.","Experimental Brain Research Vol. 237, Iss. 12,  (Dec 2019): 3241-3252."
"EEG-based brain functional connectivity in first-episode schizophrenia patients, ultra-high-risk individuals, and healthy controls during P50 suppression","Chang, Qi; Liu, Meijun; Tian, Qing; Wang, Hua; Luo, Yu; et al.","Frontiers in Human Neuroscience Vol. 13,  (Nov 14, 2019)."
Electrophysiological correlates of action observation treatment in children with cerebral palsy: A pilot study,"Quadrelli, Ermanno; Anzani, Anna; Ferri, Matteo; Bolognini, Nadia; Maravita, Angelo; et al.","Developmental Neurobiology Vol. 79, Iss. 11-12,  (Nov 2019 - Dec 2019): 934-948."
Impairment in recognition of emotional facial expressions in Alzheimer's disease is represented by EEG theta and alpha responses,"Güntekin, Bahar; Hanoğlu, Lütfü; Aktürk, Tuba; Fide, Ezgi; Emek‐Savaş, Derya Durusu; et al.","Psychophysiology Vol. 56, Iss. 11,  (Nov 2019)."
Correlation-based channel selection and regularized feature optimization for MI-based BCI,"Jin, Jing; Miao, Yangyang; Daly, Ian; Zuo, Cili; Hu, Dewen; et al.","Neural Networks Vol. 118,  (Oct 2019): 262-270."
"Combined cognitive, psychomotor and electrophysiological biomarkers in major depressive disorder","Koo, Ping Chai; Berger, Christoph; Kronenberg, Golo; Bartz, Julia; Wybitul, Peter; et al.","European Archives of Psychiatry and Clinical Neuroscience Vol. 269, Iss. 7,  (Oct 2019): 823-832."
Individualized pattern recognition for detecting mind wandering from EEG during live lectures,"Dhindsa, Kiret; Acai, Anita; Wagner, Natalie; Bosynak, Dan; Kelly, Stephen; et al.","PLoS ONE Vol. 14, Iss. 9,  (Sep 12, 2019)."
Lexical prediction in the aging brain: The effects of predictiveness and congruency on the N400 ERP component,"Cheimariou, Spyridoula; Farmer, Thomas A; Gordon, Jean K.","Aging, Neuropsychology, and Cognition Vol. 26, Iss. 5,  (Sep 2019): 781-806."
Influence of etiology on treatment choices for neonatal seizures: A survey among pediatric neurologists,"Dilena, Robertino; De Liso, Paola; Di Capua, Matteo; Consonni, Dario; Capovilla, Giuseppe; et al.","Brain & Development Vol. 41, Iss. 7,  (Aug 2019): 595-599."
Acute non-convulsive status epilepticus after experimental traumatic brain injury in rats,"Andrade, Pedro; Banuelos-Cabrera, Ivette; Lapinlampi, Niina; Paananen, Tomi; Ciszek, Robert; et al.","Journal of Neurotrauma Vol. 36, Iss. 11,  (Jun 2019): 1890-1907."
Lost in music: Neural signature of pleasure and its role in modulating attentional resources,"Nemati, Samaneh; Akrami, Haleh; Salehi, Sina; Esteky, Hossein; Moghimi, Sahar.","Brain Research Vol. 1711,  (May 15, 2019): 7-15."
Negation and the N400: Investigating temporal aspects of negation integration using semantic and world-knowledge violations,"Dudschig, Carolin; Mackenzie, Ian Grant; Maienborn, Claudia; Kaup, Barbara; Leuthold, Hartmut.","Language, Cognition and Neuroscience Vol. 34, Iss. 3,  (Apr 2019): 309-319."
The temporal signature of self: Temporal measures of resting‐state EEG predict self‐consciousness,"Wolff, Annemarie; Di Giovanni, Daniel A; Gómez‐Pilar, Javier; Nakao, Takashi; Huang, Zirui; et al.","Human Brain Mapping Vol. 40, Iss. 3,  (Feb 15, 2019): 789-803."
The role of meaning in visual memory: Face-selective brain activity predicts memory for ambiguous face stimuli,"Brady, Timothy F; Alvarez, George A; Störmer, Viola S.","The Journal of Neuroscience Vol. 39, Iss. 6,  (Feb 6, 2019): 1100-1108."
Predicting the fate of basketball throws: An EEG study on expert action prediction in wheelchair basketball players,"Özkan, D. G; Pezzetta, R; Moreau, Q; Abreu, A. M; Aglioti, S. M.","Experimental Brain Research Vol. 237, Iss. 12,  (Dec 2019): 3363-3373."
Distinct functional connectivity patterns are associated with social and cognitive lifestyle factors: Pathways to cognitive reserve,"Fleck, Jessica I; Arnold, Molly; Dykstra, Benjamin; Casario, Katharine; Douglas, Elizabeth; et al.","Frontiers in Aging Neuroscience Vol. 11,  (Nov 13, 2019)."
Does hypnotic assessment predict the functional equivalence between motor imagery and action?,"Ruggirello, Simona; Campioni, Lisa; Piermanni, Samuele; Sebastiani, Laura; Santarcangelo, Enrica L.","Brain and Cognition Vol. 136,  (Nov 2019)."
Resting EEG in alpha and beta bands predicts individual differences in attentional breadth,"Pitchford, Brent; Arnell, Karen M.","Consciousness and Cognition: An International Journal Vol. 75,  (Oct 2019)."
From self-induced to perceived errors—A generalized over-monitoring activity in obsessive–compulsive disorder,"Carmi, L; Alyagon, U; Barnea-Ygael, N; Zohar, J; Zangen, A; et al.","European Neuropsychopharmacology Vol. 29, Iss. 10,  (Oct 2019): 1083-1091."
Estimating EEG source dipole orientation based on singular-value decomposition for connectivity analysis,"Rubega, M; Carboni, M; Seeber, M; Pascucci, D; Tourbier, S; et al.","Brain Topography Vol. 32, Iss. 4,  (Jul 30, 2019): 704-719."
Contributions of non-primary cortical sources to auditory temporal processing,"Farahani, Ehsan Darestani; Wouters, Jan; van Wieringen, Astrid.","NeuroImage Vol. 191,  (May 1, 2019): 303-314."
Altered transcranial magnetic stimulation–electroencephalographic markers of inhibition and excitation in the dorsolateral prefrontal cortex in major depressive disorder,"Voineskos, Daphne; Blumberger, Daniel M; Zomorrodi, Reza; Rogasch, Nigel C; Farzan, Faranak; et al.","Biological Psychiatry Vol. 85, Iss. 6,  (Mar 15, 2019): 477-486."
Estimating coupling strength between multivariate neural series with multivariate permutation conditional mutual information,"Wen, Dong; Jia, Peilei; Hsu, Sheng-Hsiou; Zhou, Yanhong; Lan, Xifa; et al.","Neural Networks Vol. 110,  (Feb 2019): 159-169."
Electrophysiological assessment methodology of sensory processing dysfunction in schizophrenia and dementia of the Alzheimer type,"Danjou, P; Viardot, G; Maurice, D; Garcés, P; Wams, E. J; et al.","Neuroscience and Biobehavioral Reviews Vol. 97,  (Feb 2019): 70-84."
The infant motor system predicts actions based on visual statistical learning,"Monroy, Claire D; Meyer, Marlene; Schröer, Lisanne; Gerson, Sarah A; Hunnius, Sabine.","NeuroImage Vol. 185,  (Jan 15, 2019): 947-954."
GRIN2A-related disorders: Genotype and functional consequence predict phenotype,"Strehlow, Vincent; Heyne, Henrike O; Vlaskamp, Danique R. M; Marwick, Katie F. M; Rudolf, Gabrielle; et al.","Brain: A Journal of Neurology Vol. 142, Iss. 1,  (Jan 2019): 80-92."
High-intensity interval exercise impairs neuroelectric indices of reinforcement-learning,"Walsh, Jeremy J; Colino, Francisco L; Krigolson, Olave E; Luehr, Stephen; Gurd, Brendon J; et al.","Physiology & Behavior Vol. 198,  (Jan 1, 2019): 18-26."
Effective connectivity of beta oscillations in endometriosis-related chronic pain during rest and pain-related mental imagery,"Ferdek, Magdalena A; Oosterman, Joukje M; Adamczyk, Agnieszka K; van Aken, Mieke; Woudsma, Kelly J; et al.","The Journal of Pain Vol. 20, Iss. 12,  (Dec 2019): 1446-1458."
Racial differences in adult-onset MRI-negative temporal lobe epilepsy,"Allen, Samantha E; Limdi, Nita A; Westrick, Ashly C; Ver Hoef, Lawrence W; Szaflarski, Jerzy P; et al.","Epilepsy & Behavior Vol. 100, Iss. Part A,  (Nov 2019)."
