Title,Authors,Journal
Exploratory study of the effect of binaural beat stimulation on the EEG activity pattern in resting state using artificial neural networks,"da Silva Junior, Maurício; de Freitas, Rafaela Covello; dos Santos, Wellington Pinheiro; da Silva, Washington Wagner Azevedo; Rodrigues, Marcelo Cairrão Araújo; et al.","Cognitive Systems Research Vol. 54,  (May 2019): 1-20."
Clinical and electroencephalographic correlates of psychiatric features in children with frontal lobe epilepsy,"Ticci, Chiara; Luongo, Teresa; Valvo, Giulia; Ferrari, Anna Rita; Brovedani, Paola; et al.","Epilepsy & Behavior Vol. 92,  (Mar 2019): 283-289."
Machine‐learning‐derived sleep–wake staging from around‐the‐ear electroencephalogram outperforms manual scoring and actigraphy,"Mikkelsen, Kaare B; Ebajemito, James K; Bonmati‐Carrion, Maria A; Santhi, Nayantara; Revell, Victoria L; et al.","Journal of Sleep Research Vol. 28, Iss. 2,  (Apr 2019): 1-13."
Electroencephalography in primary progressive aphasia and apraxia of speech,"Utianski, Rene L; Caviness, John N; Worrell, Gregory A; Duffy, Joseph R; Clark, Heather M; et al.","Aphasiology Vol. 33, Iss. 11,  (Nov 2019): 1410-1417."
BOLD mapping of human epileptic spikes recorded during simultaneous intracranial EEG-fMRI: The impact of automated spike classification,"Sharma, Niraj K; Pedreira, Carlos; Chaudhary, Umair J; Centeno, Maria; Carmichael, David W; et al.","NeuroImage Vol. 184,  (Jan 1, 2019): 981-992."
Atypical EEG in autism spectrum disorder: Comparing a dimensional and a categorical approach,"Milne, Elizabeth; Gomez, Rosanna; Giannadou, Aikaterini; Jones, Myles.","Journal of Abnormal Psychology Vol. 128, Iss. 5,  (Jul 2019): 442-452."
Exploration of event-related dynamics of brain oscillations in ice hockey shooting,"Christie, Sommer; Werthner, Penny; Bertollo, Maurizio.","Sport, Exercise, and Performance Psychology Vol. 8, Iss. 1,  (Feb 2019): 38-52."
Theta resting EEG in the right TPJ is associated with individual differences in implicit intergroup bias,"Schiller, Bastian; Gianotti, Lorena R. R; Baumgartner, Thomas; Knoch, Daria.","Social Cognitive and Affective Neuroscience Vol. 14, Iss. 3,  (Mar 2019): 281-289."
Anticipatory alpha oscillation predicts attentional selection and hemodynamic response,"Zhao, Chenguang; Guo, Jialiang; Li, Dongwei; Tao, Ye; Ding, Yulong; et al.","Human Brain Mapping Vol. 40, Iss. 12,  (Aug 15, 2019): 3606-3619."
Mathematical mindsets increase student motivation: Evidence from the EEG,"Daly, Ian; Bourgaize, Jake; Vernitski, Alexei.","Trends in Neuroscience and Education Vol. 15,  (Jun 2019): 18-28."
Altered dynamic electroencephalography connectome phase-space features of emotion regulation in social anxiety,"Xing, Mengqi; Lee, Hyekyoung; Morrissey, Zachery; Chung, Moo K; Phan, K. Luan; et al.","NeuroImage Vol. 186,  (Feb 1, 2019): 338-349."
Human amygdala response to unisensory and multisensory emotion input: No evidence for superadditivity from intracranial recordings,"Domínguez-Borràs, Judith; Guex, Raphaël; Méndez-Bértolo, Constantino; Legendre, Guillaume; Spinelli, Laurent; et al.","Neuropsychologia Vol. 131,  (Aug 2019): 9-24."
Exploring the relative efficacy of motion artefact correction techniques for EEG data acquired during simultaneous fMRI,"Daniel, Alexander J; Smith, James A; Spencer, Glyn S; Jorge, João; Bowtell, Richard; et al.","Human Brain Mapping Vol. 40, Iss. 2,  (Feb 1, 2019): 578-596."
Consumers’ implicit motivation of purchasing luxury brands: An EEG study,"Zhang, Wuke; Jin, Jia; Wang, Ailian; Ma, Qingguo; Yu, Haihong.","Psychology Research and Behavior Management Vol. 12,  (Sep 25, 2019)."
Individual differences in math ability determine neurocognitive processing of arithmetic complexity: A combined fNIRS-EEG study,"Artemenko, Christina; Soltanlou, Mojtaba; Bieck, Silke M; Ehlis, Ann-Christine; Dresler, Thomas; et al.","Frontiers in Human Neuroscience Vol. 13,  (Jul 3, 2019)."
Electrophysiological phenotype in Angelman syndrome differs between genotypes,"Frohlich, Joel; Miller, Meghan T; Bird, Lynne M; Garces, Pilar; Purtell, Hannah; et al.","Biological Psychiatry Vol. 85, Iss. 9,  (May 1, 2019): 752-759."
Altered individual behavioral and EEG parameters are related to the EDSS score in relapsing-remitting multiple sclerosis patients,"Vázquez-Marrufo, Manuel; Galvao-Carmona, Alejandro; Caballero-Díaz, Rocio; Borges, Monica; Paramo, Maria Dolores; et al.","PLoS ONE Vol. 14, Iss. 7,  (Jul 15, 2019)."
Electroencephalographic and epilepsy findings in mecp2 duplication syndrome. A family study,"Lotti, Federica; Geronzi, Ursula; Grosso, Salvatore.","Brain & Development Vol. 41, Iss. 5,  (May 2019): 456-459."
Investigating the influence of distance between cars on the driver psychophysiology during braking using EEG: A case study on driving in Indonesia,"Sugiono, Sugiono; Widhayanuriyawan, Denny; Andriani, Debrina P; Prasetya, Renaldi P.","Acta Neuropsychologica Vol. 17, Iss. 3,  (2019): 329-339."
The paradox of rapid eye movement sleep in the light of oscillatory activity and cortical synchronization during phasic and tonic microstates,"Simor, Péter; van Der Wijk, Gwen; Gombos, Ferenc; Kovács, Ilona.","NeuroImage Vol. 202,  (Nov 15, 2019)."
Functional MRI and EEG index complementary attentional modulations,"Itthipuripat, Sirawaj; Sprague, Thomas C; Serences, John T.","The Journal of Neuroscience Vol. 39, Iss. 31,  (Jul 31, 2019): 6162-6179."
Classical conditioning in oddball paradigm: A comparison between aversive and name conditioning,"Pavlov, Yuri G; Kotchoubey, Boris.","Psychophysiology Vol. 56, Iss. 7,  (Jul 2019): 1-12."
Differential patterns of visual sensory alteration underlying face emotion recognition impairment and motion perception deficits in schizophrenia and autism spectrum disorder,"Martínez, Antígona; Tobe, Russell; Dias, Elisa C; Ardekani, Babak A; Veenstra-VanderWeele, Jeremy; et al.","Biological Psychiatry Vol. 86, Iss. 7,  (Oct 1, 2019): 557-567."
Identifying stable patterns over time for emotion recognition from EEG,"Zheng, Wei-Long; Zhu, Jia-Yi; Lu, Bao-Liang.","IEEE Transactions on Affective Computing Vol. 10, Iss. 3,  (Jul 2019 - Sep 2019): 417-429."
"SEEG-guided radiofrequency thermocoagulation of epileptic foci in the paediatric population: Feasibility, safety and efficacy","Chipaux, Mathilde; Taussig, Delphine; Dorfmuller, Georg; Dorison, Nathalie; Tisdall, Martin M; et al.","Seizure Vol. 70,  (Aug 2019): 63-70."
The functional role of beta‐oscillations in the supplementary motor area during reaching and grasping after stroke: A question of structural damage to the corticospinal tract,"Quandt, Fanny; Bönstrup, Marlene; Schulz, Robert; Timmermann, Jan E; Mund, Maike; et al.","Human Brain Mapping Vol. 40, Iss. 10,  (Jul 2019): 3091-3101."
Evaluation of self-generated behavior: Untangling metacognitive readout and error detection,"Kononowicz, Tadeusz W; van Wassenhove, Virginie.","Journal of Cognitive Neuroscience Vol. 31, Iss. 11,  (Nov 2019): 1641-1657."
The peripheral preview effect with faces: Combined EEG and eye-tracking suggests multiple stages of trans-saccadic predictive and non-predictive processing,"Huber-Huber, Christoph; Buonocore, Antimo; Dimigen, Olaf; Hickey, Clayton; Melcher, David.","NeuroImage Vol. 200,  (Oct 15, 2019): 344-362."
Preparing for hard times: Scalp and intracranial physiological signatures of proactive cognitive control,"De Loof, Esther; Vassena, Eliana; Janssens, Clio; De Taeye, Leen; Meurs, Alfred; et al.","Psychophysiology Vol. 56, Iss. 10,  (Oct 2019)."
Oscillatory gamma activity mediates the pathway from socioeconomic status to language acquisition in infancy,"Cantiani, Chiara; Piazza, Caterina; Mornati, Giulia; Molteni, Massimo; Riva, Valentina.","Infant Behavior & Development Vol. 57,  (Nov 2019)."
Diurnal changes in human brain glutamate + glutamine levels in the course of development and their relationship to sleep,"Volk, Carina; Jaramillo, Valeria; Studler, Mirjam; Furrer, Melanie; O'Gorman Tuura, Ruth L; et al.","NeuroImage Vol. 196,  (Aug 1, 2019): 269-275."
Spatio–temporal patterns of cognitive control revealed with simultaneous electroencephalography and functional magnetic resonance imaging,"Hinault, Thomas; Larcher, Kevin; Zazubovits, Natalja; Gotman, Jean; Dagher, Alain.","Human Brain Mapping Vol. 40, Iss. 1,  (Jan 2019): 80-97."
Dynamic functional connectivity states characterize NREM sleep and wakefulness,"Zhou, Shuqin; Zou, Guangyuan; Xu, Jing; Su, Zihui; Zhu, Huaiqiu; et al.","Human Brain Mapping Vol. 40, Iss. 18,  (Dec 15, 2019): 5256-5268."
"The effect of stimulation type, head modeling, and combined EEG and MEG on the source reconstruction of the somatosensory P20/N20 component","Antonakakis, Marios; Schrader, Sophie; Wollbrink, Andreas; Oostenveld, Robert; Rampp, Stefan; et al.","Human Brain Mapping Vol. 40, Iss. 17,  (Dec 1, 2019): 5011-5028."
Investigating the variability of cardiac pulse artifacts across heartbeats in simultaneous EEG-fMRI recordings: A 7T study,"Jorge, João; Bouloc, Charlotte; Bréchet, Lucie; Michel, Christoph M; Gruetter, Rolf.","NeuroImage Vol. 191,  (May 1, 2019): 21-35."
Mental simulation of facial expressions: Mu suppression to the viewing of dynamic neutral face videos,"Karakale, Ozge; Moore, Matthew R; Kirk, Ian J.","Frontiers in Human Neuroscience Vol. 13,  (Feb 8, 2019)."
Continuity in the neural system supporting children’s theory of mind development: Longitudinal links between task-independent EEG and task-dependent fMRI,"Bowman, Lindsay C; Dodell-Feder, David; Saxe, Rebecca; Sabbagh, Mark A.","Developmental Cognitive Neuroscience Vol. 40,  (Dec 2019)."
"How are visual words represented? Insights from EEG-based visual word decoding, feature derivation and image reconstruction","Ling, Shouyu; Lee, Andy C. H; Armstrong, Blair C; Nestor, Adrian.","Human Brain Mapping Vol. 40, Iss. 17,  (Dec 1, 2019): 5056-5068."
Trial-by-trial source-resolved EEG responses to gait task challenges predict subsequent step adaptation,"Wagner, Johanna; Martínez-Cancino, Ramón; Makeig, Scott.","NeuroImage Vol. 199,  (Oct 1, 2019): 691-703."
Theta oscillations index frontal decision-making and mediate reciprocal frontal–parietal interactions in willed attention,"Rajan, Abhijit; Siegel, Scott N; Liu, Yuelu; Bengson, Jesse; Mangun, George R; et al.","Cerebral Cortex Vol. 29, Iss. 7,  (Jul 2019): 2832-2843."
Unsuccessful reduction of high‐frequency alpha activity during cognitive activation in schizophrenia,"Jang, Kuk‐In; Oh, Jihoon; Jung, Wookyoung; Lee, Sangmin; Kim, Sungkean; et al.","Psychiatry and Clinical Neurosciences Vol. 73, Iss. 3,  (Mar 2019): 132-139."
Coarse-to-fine information integration in human vision,"Petras, Kirsten; ten Oever, Sanne; Jacobs, Christianne; Goffaux, Valerie.","NeuroImage Vol. 186,  (Feb 1, 2019): 103-112."
The effect of Mozart’s music in severe epilepsy: Functional and morphological features,"Bedetti, Chiara; Principi, Massimo; Di Renzo, Antonio; Muti, Marco; Frondizi, Domenico; et al.","Psychiatria Danubina Vol. 31, Iss. Suppl 3,  (2019): 467-474."
A simple sleep EEG marker in childhood predicts brain myelin 3.5 years later,"LeBourgeois, Monique K; Dean, Douglas C; Deoni, Sean C. L; Kohler, Malcolm; Kurth, Salome.","NeuroImage Vol. 199,  (Oct 1, 2019): 342-350."
Music improvisation is characterized by increase EEG spectral power in prefrontal and perceptual motor cortical sources and can be reliably classified from non-improvisatory performance,"Sasaki, Masaru; Iversen, John; Callan, Daniel E.","Frontiers in Human Neuroscience Vol. 13,  (Dec 10, 2019)."
Toward understanding the neurophysiological basis of peripersonal space: An EEG study on healthy individuals,"Naro, Antonino; Calabrò, Rocco Salvatore; La Rosa, Gianluca; Andronaco, Veronica Agata; Billeri, Luana; et al.","PLoS ONE Vol. 14, Iss. 6,  (Jun 24, 2019)."
Physical intensity of stimuli modulates motor inhibition by affecting response selection processes in right inferior frontal regions,"Friedrich, Julia; Mückschel, Moritz; Beste, Christian.","Behavioural Brain Research Vol. 359,  (Feb 1, 2019): 597-608."
Long-term seizure outcome in frontal lobe epilepsy surgery,"Morace, Roberta; Casciato, Sara; Quarato, Pier Paolo; Mascia, Addolorata; D'Aniello, Alfredo; et al.","Epilepsy & Behavior Vol. 90,  (Jan 2019): 93-98."
Patterned functional network disruption in amyotrophic lateral sclerosis,"Dukic, Stefan; McMackin, Roisin; Buxo, Teresa; Fasano, Antonio; Chipika, Rangariroyashe; et al.","Human Brain Mapping Vol. 40, Iss. 16,  (Nov 1, 2019): 4827-4842."
On the relevance of EEG resting theta activity for the neurophysiological dynamics underlying motor inhibitory control,"Pscherer, Charlotte; Mückschel, Moritz; Summerer, Lena; Bluschke, Annet; Beste, Christian.","Human Brain Mapping Vol. 40, Iss. 14,  (Oct 1, 2019): 4253-4265."
Trial-by-trial surprise-decoding model for visual and auditory binary oddball tasks,"Modirshanechi, Alireza; Kiani, Mohammad Mahdi; Aghajan, Hamid.","NeuroImage Vol. 196,  (Aug 1, 2019): 302-317."
Cross-frequency coupling in developmental perspective,"Knyazev, Gennady G; Savostyanov, Alexander N; Bocharov, Andrey V; Tamozhnikov, Sergey S; Kozlova, Elena A; et al.","Frontiers in Human Neuroscience Vol. 13,  (May 14, 2019)."
Postnatal maternal symptoms of depression and child emotion dysregulation: The mediation role of infant EEG alpha asymmetry,"Marino, Cecilia; Riva, Valentina; Mornati, Giulia; Piazza, Caterina; del Giudice, Renata; et al.","Infant Behavior & Development Vol. 57,  (Nov 2019)."
Prediction error connectivity: A new method for EEG state analysis,"Principe, Alessandro; Ley, Miguel; Conesa, Gerardo; Rocamora, Rodrigo.","NeuroImage Vol. 188,  (Mar 1, 2019): 261-273."
Does fractional anisotropy predict motor imagery neurofeedback performance in healthy older adults?,"Meekes, Joost; Debener, Stefan; Zich, Catharina; Bleichner, Martin G; Kranczioch, Cornelia.","Frontiers in Human Neuroscience Vol. 13,  (Feb 28, 2019)."
Indication of dynamic neurovascular coupling from inconsistency between EEG and fMRI indices across sleep–wake states,"Wu, Changwei W; Tsai, Pei-Jung; Chen, Sharon Chia-Ju; Li, Chia-Wei; Hsu, Ai-Ling; et al.","Sleep and Biological Rhythms Vol. 17, Iss. 4,  (Oct 2019): 423-431."
How to analyse electrophysiological responses to naturalistic language with time-resolved multiple regression,"Sassenhagen, Jona.","Language, Cognition and Neuroscience Vol. 34, Iss. 4,  (May 2019): 474-490."
Exploration of event-related dynamics of brain oscillations in ice hockey shooting,"Christie, Sommer; Werthner, Penny; Bertollo, Maurizio.","Sport, Exercise, and Performance Psychology Vol. 8, Iss. 1,  (Feb 2019): 38-52. [Duplicate]"
Changes in functional connectivity predict outcome of repetitive transcranial magnetic stimulation treatment of major depressive disorder,"Corlier, Juliana; Wilson, Andrew; Hunter, Aimee M; Vince-Cruz, Nikita; Krantz, David; et al.","Cerebral Cortex Vol. 29, Iss. 12,  (Dec 2019): 4958-4967."
CT perfusion and EEG patterns in patients with acute isolated aphasia in seizure-related stroke mimics,"Manganotti, Paolo; Furlanis, Giovanni; Ajčević, Miloš; Polverino, Paola; Caruso, Paola; et al.","Seizure Vol. 71,  (Oct 2019): 110-115."
Chronological dynamic changes in cortico-subcortical imbalance of cerebral blood flow in a boy with CAPOS syndrome,"Hashimoto, Aya; Kuki, Ichiro; Fukuoka, Masataka; Kim, Kiyohiro; Inoue, Takeshi; et al.","Brain & Development Vol. 41, Iss. 7,  (Aug 2019): 625-629."
Pre-trial and pre-response EEG microstates in schizophrenia: An endophenotypic marker,"Soni, Sunaina; Muthukrishnan, Suriya Prakash; Samanchi, Rupesh; Sood, Mamta; Kaur, Simran; et al.","Behavioural Brain Research Vol. 371,  (Oct 3, 2019)."
Altered low-frequency EEG connectivity in mild cognitive impairment as a sign of clinical progression,"Musaeus, Christian Sandøe; Nielsen, Malene Schjønning; Høgh, Peter.","Journal of Alzheimer's Disease Vol. 68, Iss. 3,  (2019): 947-960."
Distinct neuronal entrainment to beat and meter: Revealed by simultaneous EEG-fMRI,"Li, Qiang; Liu, Guangyuan; Wei, Dongtao; Liu, Ying; Yuan, Guangjie; et al.","NeuroImage Vol. 194,  (Jul 1, 2019): 128-135."
"Capturing the spatiotemporal dynamics of self-generated, task-initiated thoughts with EEG and fMRI","Bréchet, Lucie; Brunet, Denis; Birot, Gwénaël; Gruetter, Rolf; Michel, Christoph M; et al.","NeuroImage Vol. 194,  (Jul 1, 2019): 82-92."
"The influence of reward sensitivity, heart rate dynamics and EEG-delta activity on placebo analgesia","De Pascalis, V; Scacchia, P.","Behavioural Brain Research Vol. 359,  (Feb 1, 2019): 320-332."
Impact of branding social responsibility on the memory of consumers using brain waves analysis,"Sadeh, Davoud; Saeednia, Hamidreza; Steidl, Peter; Heidarzadeh, Kambiz.","Advances in Cognitive Science Vol. 21, Iss. 2,  (Jul 2019 - Sep 2019): 74-82."
Detection of arithmetic violations during sleep,"Strauss, Mélanie; Dehaene, Stanislas.","Sleep: Journal of Sleep and Sleep Disorders Research Vol. 42, Iss. 3,  (Mar 2019): 1-12."
Long-range temporal correlations in resting state beta oscillations are reduced in schizophrenia,"Moran, James K; Michail, Georgios; Heinz, Andreas; Keil, Julian; Senkowski, Daniel.","Frontiers in Psychiatry Vol. 10,  (Jul 19, 2019)."
Lingering sound: Event-related phase-amplitude coupling and phase-locking in fronto-temporo-parietal functional networks during memory retrieval of music melodies,"Tseng, Yi-Li; Liu, Hong-Hsiang; Liou, Michelle; Tsai, Arthur C; Chien, Vincent S. C; et al.","Frontiers in Human Neuroscience Vol. 13,  (May 22, 2019)."
Exploring early human brain development with structural and physiological neuroimaging,"Vasung, Lana; Abaci Turk, Esra; Ferradal, Silvina L; Sutin, Jason; Stout, Jeffrey N; et al.","NeuroImage Vol. 187,  (Feb 15, 2019): 226-254."
Temporal dynamics of the pharmacological MRI response to subanaesthetic ketamine in healthy volunteers: A simultaneous EEG/fMRI study,"McMillan, Rebecca; Forsyth, Anna; Campbell, Doug; Malpas, Gemma; Maxwell, Elizabeth; et al.","Journal of Psychopharmacology Vol. 33, Iss. 2,  (Feb 2019): 219-229."
"Classification of focal and non focal EEG signals using empirical mode decomposition (EMD), phase space reconstruction (PSR) and neural networks","Zeng, Wei; Li, Mengqing; Yuan, Chengzhi; Wang, Qinghui; Liu, Fenglin; et al.","Artificial Intelligence Review Vol. 52, Iss. 1,  (Jun 1, 2019): 625-647."
Building the arrow of time… over time: A sequence of brain activity mapping imagined events in time and space,"Gauthier, Baptiste; Pestke, Karin; van Wassenhove, Virginie.","Cerebral Cortex Vol. 29, Iss. 10,  (Oct 2019): 4398-4414."
Lateral prefrontal anodal transcranial direct current stimulation augments resolution of auditory perceptual-attentional conflicts,"Adelhöfer, Nico; Gohil, Krutika; Passow, Susanne; Beste, Christian; Li, Shu-Chen.","NeuroImage Vol. 199,  (Oct 1, 2019): 217-227."
Pretreatment rostral anterior cingulate cortex connectivity with salience network predicts depression recovery: Findings from the EMBARC randomized clinical trial,"Whitton, Alexis E; Webb, Christian A; Dillon, Daniel G; Kayser, Jürgen; Rutherford, Ashleigh; et al.","Biological Psychiatry Vol. 85, Iss. 10,  (May 15, 2019): 872-880."
Epileptic seizure detection in EEG signals using sparse multiscale radial basis function networks and the Fisher vector approach,"Li, Yang; Cui, Wei-Gang; Huang, Hui; Guo, Yu-Zhu; Li, Ke; et al.","Knowledge-Based Systems Vol. 164,  (Jan 15, 2019): 96-106."
Search asymmetry in a serial auditory task: Neural source analyses of EEG implicate attention strategies,"Blundon, Elizabeth G; Ward, Lawrence M.","Neuropsychologia Vol. 134,  (Nov 2019)."
The spatiotemporal pattern of pure tone processing: A single-trial EEG-fMRI study,"Li, Qiang; Liu, Guangyuan; Wei, Dongtao; Guo, Jing; Yuan, Guangjie; et al.","NeuroImage Vol. 187,  (Feb 15, 2019): 184-191."
Multimodal evidence on shape and surface information in individual face processing,"Nemrodov, Dan; Behrmann, Marlene; Niemeier, Matthias; Drobotenko, Natalia; Nestor, Adrian.","NeuroImage Vol. 184,  (Jan 1, 2019): 813-825."
EEG dynamics of spontaneous stimulus-independent thoughts,"Bocharov, Andrey V; Knyazev, Gennady G; Savostyanov, Alexander N; Astakhova, Tatiana N; Tamozhnikov, Sergey S.","Cognitive Neuroscience Vol. 10, Iss. 2,  (Jan 2019 - Apr 2019): 77-87."
Semantic unification modulates N400 and BOLD signal change in the brain: A simultaneous EEG-fMRI study,"Zhu, Zude; Bastiaansen, Marcel; Hakun, Jonathan G; Petersson, Karl Magnus; Wang, Suiping; et al.","Journal of Neurolinguistics Vol. 52,  (Nov 2019)."
Neurocognitive performance is enhanced during short periods of microgravity—Part 2,"Wollseiffen, Petra; Klein, Timo; Vogt, Tobias; Abeln, Vera; Strüder, Heiko K; et al.","Physiology & Behavior Vol. 207,  (Aug 1, 2019): 48-54."
Opportunities to sit and stand trigger equivalent reward-related brain activity,"Cheval, Boris; Boisgontier, Matthieu P; Bacelar, Mariane F. B; Feiss, Robyn; Miller, Matthew W.","International Journal of Psychophysiology Vol. 141,  (Jul 2019): 9-17."
The relationship between negative BOLD responses and ERS and ERD of alpha/beta oscillations in visual and motor cortex,"Wilson, Ross; Mullinger, Karen J; Francis, Susan T; Mayhew, Stephen D.","NeuroImage Vol. 199,  (Oct 1, 2019): 635-650."
Two spatially distinct posterior alpha sources fulfill different functional roles in attention,"Sokoliuk, Rodika; Mayhew, Stephen D; Aquino, Kevin M; Wilson, Ross; Brookes, Matthew J; et al.","The Journal of Neuroscience Vol. 39, Iss. 36,  (Sep 4, 2019): 7183-7194."
Adjustment of synchronization stability of dynamic brain-networks based on feature fusion,"Li, Haifang; Yao, Rong; Xia, Xiaoluan; Yin, Guimei; Deng, Hongxia; et al.","Frontiers in Human Neuroscience Vol. 13,  (Apr 2, 2019)."
Modeling the ongoing dynamics of short and long-range temporal correlations in broadband EEG during movement,"Wairagkar, Maitreyee; Hayashi, Yoshikatsu; Nasuto, Slawomir J.","Frontiers in Systems Neuroscience Vol. 13,  (Nov 8, 2019)."
Brief executive function training for individuals with severe mental illness: Effects on EEG synchronization and executive functioning,"Best, Michael W; Gale, Daniel; Tran, Tanya; Haque, Mashal K; Bowie, Christopher R.","Schizophrenia Research Vol. 203,  (Jan 2019): 32-40."
Striatum-related functional activation during reward-versus punishment-based learning in psychosis risk,"Karcher, Nicole R; Hua, Jessica P. Y; Kerns, John G.","Neuropsychopharmacology Vol. 44, Iss. 11,  (Oct 2019): 1967-1974."
EEG microstates distinguish between cognitive components of fluid reasoning,"Zappasodi, Filippo; Perrucci, Mauro Gianni; Saggino, Aristide; Croce, Pierpaolo; Mercuri, Pasqua; et al.","NeuroImage Vol. 189,  (Apr 1, 2019): 560-573."
Evaluation on directed functional brain connectivity during the expert rifle pre-shot period,"Zhang, Liwei; Zhou, Qianxiang; Liu, Zhongqi; Tang, Shichuan.","Journal of Motor Behavior Vol. 51, Iss. 5,  (2019): 511-520."
Reduced frontal gamma power at 24 months is associated with better expressive language in toddlers at risk for autism,"Wilkinson, Carol L; Levin, April R; Gabard‐Durnam, Laurel J; Tager‐Flusberg, Helen; Nelson, Charles A.","Autism Research Vol. 12, Iss. 8,  (Aug 2019): 1211-1224."
Electroencephalographic spectral power as a marker of cortical function and disease severity in girls with Rett syndrome,"Roche, Katherine J; LeBlanc, Jocelyn J; Levin, April R; O'Leary, Heather M; Baczewski, Lauren M; et al.","Journal of Neurodevelopmental Disorders Vol. 11,  (Jul 31, 2019)."
Neural and behavioral correlates of attentional bias to cannabis cues among adults with cannabis use disorders,"Ruglass, Lesia M; Shevorykin, Alina; Dambreville, Naomi; Melara, Robert D.","Psychology of Addictive Behaviors Vol. 33, Iss. 1,  (Feb 2019): 69-80."
Shooting a high-density electroencephalographic picture on sleep in children with attention-deficit/hyperactivity disorder,"Miano, Silvia; Amato, Ninfa; Garbazza, Corrado; Abbafati, Manuel; Foderaro, Giuseppe; et al.","Sleep: Journal of Sleep and Sleep Disorders Research Vol. 42, Iss. 11,  (Nov 2019): 1-9."
No trace of phase: Corticomotor excitability is not tuned by phase of pericentral mu-rhythm,"Madsen, Kristoffer Hougaard; Karabanov, Anke Ninija; Krohne, Lærke Gebser; Safeldt, Mads Gylling; Tomasevic, Leo; et al.","Brain Stimulation Vol. 12, Iss. 5,  (Sep 2019 - Oct 2019): 1261-1270."
Analysis of the structural-functional organization of a counting task in the context of a study of executive functions,"Yarets, M. Y; Sharova, E. V; Smirnov, A. S; Pogozbekyan, A. L; Boldyreva, G. N; et al.","Neuroscience and Behavioral Physiology Vol. 49, Iss. 6,  (Jul 15, 2019): 694-703."
Neuronal signatures of a random-dot motion comparison task,"von Lautz, Alexander; Herding, Jan; Blankenburg, Felix.","NeuroImage Vol. 193,  (Jun 2019): 57-66."
Dynamics of brain activity reveal a unitary recognition signal,"Weidemann, Christoph T; Kahana, Michael J.","Journal of Experimental Psychology: Learning, Memory, and Cognition Vol. 45, Iss. 3,  (Mar 2019): 440-451."
Validating non-invasive EEG source imaging using optimal electrode configurations on a representative rat head model,"Valdés-Hernández, Pedro A; Bae, Jihye; Song, Yinchen; Sumiyoshi, Akira; Aubert-Vázquez, Eduardo; et al.","Brain Topography Vol. 32, Iss. 4,  (Jul 30, 2019): 599-624."
Cortical reactivations during sleep spindles following declarative learning,"Jegou, Aude; Schabus, Manuel; Gosseries, Olivia; Dahmen, Brigitte; Albouy, Geneviève; et al.","NeuroImage Vol. 195,  (Jul 15, 2019): 104-112."
Dysfunctional brain dynamics and their origin in Lewy body dementia,"Schumacher, Julia; Peraza, Luis R; Firbank, Michael; Thomas, Alan J; Kaiser, Marcus; et al.","Brain: A Journal of Neurology Vol. 142, Iss. 6,  (Jun 2019): 1767-1782."
