Title,Authors,Journal
Comparison of site localization techniques for brain stimulation,"Nikolin, Stevan; D'Souza, Olav; Vulovic, Vedran; Alonzo, Angelo; Chand, Nicholas; et al.","The Journal of ECT Vol. 35, Iss. 2,  (Jun 2019): 127-132."
Do isolated packaging variables influence consumers' attention and preferences?,"García-Madariaga, Jesús; López, Maria-Francisca Blasco; Burgos, Ingrit Moya; Virto, Nuria Recuero.","Physiology & Behavior Vol. 200,  (Mar 1, 2019): 96-103."
Phase‐amplitude coupling of sleep slow oscillatory and spindle activity correlates with overnight memory consolidation,"Mikutta, Christian; Feige, Bernd; Maier, Jonathan G; Hertenstein, Elisabeth; Holz, Johannes; et al.","Journal of Sleep Research Vol. 28, Iss. 6,  (Dec 2019)."
Decreased resting gamma activity in adult attention deficit/hyperactivity disorder,"Tombor, László; Kakuszi, Brigitta; Papp, Szilvia; Réthelyi, János; Bitter, István; et al.","The World Journal of Biological Psychiatry Vol. 20, Iss. 9,  (Nov 2019): 691-702."
EEG‐based outcome prediction after cardiac arrest with convolutional neural networks: Performance and visualization of discriminative features,"Jonas, Stefan; Rossetti, Andrea O; Oddo, Mauro; Jenni, Simon; Favaro, Paolo; et al.","Human Brain Mapping Vol. 40, Iss. 16,  (Nov 1, 2019): 4606-4617."
Human visual cortical gamma reflects natural image structure,"Brunet, Nicolas M; Fries, Pascal.","NeuroImage Vol. 200,  (Oct 15, 2019): 635-643."
Reflexstudien—Hirnstammreflexe,,"Dohrn, Maike F; Urban, Peter P; Dafotakis, Manuel."
Mindfulness induces changes in anterior alpha asymmetry in healthy older adults,"Isbel, Ben; Lagopoulos, Jim; Hermens, Daniel F; Summers, Mathew J.","Mindfulness Vol. 10, Iss. 7,  (Jul 15, 2019): 1381-1394."
Auditory awareness negativity is an electrophysiological correlate of awareness in an auditory threshold task,"Eklund, Rasmus; Wiens, Stefan.","Consciousness and Cognition: An International Journal Vol. 71,  (May 2019): 70-78."
No evidence that predictions and attention modulate the first feedforward sweep of cortical information processing,"Alilović, Josipa; Timmermans, Bart; Reteig, Leon C; van Gaal, Simon; Slagter, Heleen A.","Cerebral Cortex Vol. 29, Iss. 5,  (May 2019): 2261-2278."
Methylphenidate modifies activity in the prefrontal and parietal cortex accelerating the time judgment,"Farias, Tiago Lopes; Marinho, Victor; Carvalho, Valécia; Rocha, Kaline; Silva, Paulo Ramiler Alves; et al.","Neurological Sciences Vol. 40, Iss. 4,  (Apr 3, 2019): 829-837."
"Pupillary instability as an accurate, objective marker of alertness failure and performance impairment","Maccora, Jordan; Manousakis, Jessica E; Anderson, Clare.","Journal of Sleep Research Vol. 28, Iss. 2,  (Apr 2019): 1-11."
Efecto del programa neuroeducativo HERVAT en el potencial evocado P300 en niños con trastorno por déficit de atención,,"Ortiz, Tomás; Turrero, Agustín; López Ibor, María I."
The think/no‐think alcohol task: A new paradigm for assessing memory suppression in alcohol‐related contexts,"López‐Caneda, Eduardo; Crego, Alberto; Campos, Ana D; González‐Villar, Alberto; Sampaio, Adriana.","Alcoholism: Clinical and Experimental Research Vol. 43, Iss. 1,  (Jan 2019): 36-47."
Exposing pathological sensory predictions in tinnitus using auditory intensity deviant evoked responses,"Sedley, William; Alter, Kai; Gander, Phillip E; Berger, Joel; Griffiths, Timothy D.","The Journal of Neuroscience Vol. 39, Iss. 50,  (Dec 11, 2019): 10096-10103."
After-effects of 10 Hz tACS over the prefrontal cortex on phonological word decisions,"Moliadze, Vera; Sierau, Leon; Lyzhko, Ekaterina; Stenner, Tristan; Werchowski, Michael; et al.","Brain Stimulation Vol. 12, Iss. 6,  (Nov 2019 - Dec 2019): 1464-1474."
The effects of videogaming with a brain–computer interface on mood and physiological arousal,"Arias, Francisco J. Carrera; Boucher, Leanne; Tartar, Jaime L.","Games for Health Vol. 8, Iss. 5,  (Oct 2019): 366-369."
Smell and 3D haptic representation: A common pathway to understand brain dynamics in a cross-modal task. A pilot OERP and fNIRS study,"Invitto, Sara; Montinaro, Roberta; Ciccarese, Vincenzo; Venturella, Irene; Fronda, Giulia; et al.","Frontiers in Behavioral Neuroscience Vol. 13,  (Sep 26, 2019)."
Subjective preferences differentially modulate the processing of rewards gained by own vs. Observed choices,"Peterburs, Jutta; Sannemann, Lena; Bellebaum, Christian.","Neuropsychologia Vol. 132,  (Sep 2019)."
The relation between brain signal complexity and task difficulty on an executive function task,"Grundy, John G; Barker, Ryan M; Anderson, John A. E; Shedden, Judith M.","NeuroImage Vol. 198,  (Sep 2019): 104-113."
Downstream behavioral and electrophysiological consequences of word prediction on recognition memory,"Hubbard, Ryan J; Rommers, Joost; Jacobs, Cassandra L; Federmeier, Kara D.","Frontiers in Human Neuroscience Vol. 13,  (Aug 28, 2019)."
The neural correlate of mid-value offers in ultimatum game,"Zhong, Xiyun; Wang, Ruojun; Huang, Shiyun; Chen, Jingwei; Chen, Hongmin; et al.","PLoS ONE Vol. 14, Iss. 8,  (Aug 20, 2019)."
"Seeing emotions, reading emotions: Behavioral and ERPs evidence of the regulation of pictures and words","Grecucci, Alessandro; Sulpizio, Simone; Tommasello, Elisa; Vespignani, Francesco; Job, Remo.","PLoS ONE Vol. 14, Iss. 5,  (May 31, 2019)."
Auditory cues for somatosensory targets invoke visuomotor transformations: Behavioral and electrophysiological evidence,"Manson, Gerome A; Tremblay, Luc; Lebar, Nicolas; de Grosbois, John; Mouchnino, Laurence; et al.","PLoS ONE Vol. 14, Iss. 5,  (May 2, 2019)."
Aerobic exercise modulates transfer and brain signal complexity following cognitive training,"Wang, Chun-Hao; Moreau, David; Yang, Cheng-Ta; Tsai, Yun-Yen; Lin, Jui-Tang; et al.","Biological Psychology Vol. 144,  (May 2019): 85-98."
Triage of mild head-injured intoxicated patients could be aided by use of an electroencephalogram-based biomarker,"von Gaudecker, Jane R.","Journal of Neuroscience Nursing Vol. 51, Iss. 2,  (Apr 2019): 82-83."
Contribution of left frontal-motor alpha phase synchronization to semantic inhibition in obsessive–compulsive tendencies,"Iyoki, Nao; Kawasaki, Masahiro.","NeuroReport: For Rapid Communication of Neuroscience Research Vol. 30, Iss. 5,  (Mar 20, 2019): 338-343."
Cortical processing of irrelevant somatosensory information from the leg is altered by attention during early movement preparation,"Peters, Sue; Brown, Katlyn E; Garland, S. Jayne; Staines, W. Richard; Handy, Todd C; et al.","Brain Research Vol. 1707,  (Mar 15, 2019): 45-53."
Social dimension and complexity differentially influence brain responses during feedback processing,"Pfabigan, Daniela M; Gittenberger, Marianne; Lamm, Claus.","Social Neuroscience Vol. 14, Iss. 1,  (Feb 2019): 26-40."
The cognitive and neural oscillatory mechanisms underlying the facilitating effect of rhythm regularity on speech comprehension,"Li, Xiaoqing; Shao, Ximing; Xia, Jinyan; Xu, Xiaoying.","Journal of Neurolinguistics Vol. 49,  (Feb 2019): 155-167."
The relationship between mismatch negativity and the COMTVal108/158Met genotype in schizophrenia,"Horikoshi, Sho; Shiga, Tetsuya; Hoshino, Hiroshi; Ochiai, Haruka; Kanno-Nozaki, Keiko; et al.","Neuropsychobiology Vol. 77, Iss. 4,  (2019): 192-196."
The relationship between resting electroencephalogram oscillatory abnormalities and schizotypal personality traits in the first-degree relatives of schizophrenia patients,"Chen, Chen; Huang, Wei; Chen, Xianjun; Shi, Xiufang; Zhu, Xiquan; et al.","NeuroReport: For Rapid Communication of Neuroscience Research Vol. 30, Iss. 17,  (Dec 10, 2019): 1215-1221."
Differential semantic processing in patients with schizophrenia versus bipolar disorder: An N400 study,"Raucher-Chéné, D; Terrien, S; Gobin, P; Gierski, F; Caillies, S; et al.","Acta Neuropsychiatrica Vol. 31, Iss. 6,  (Dec 2019): 337-342."
Neural mechanisms of affective instability and cognitive control in substance use,"Bodkyn, Carmen N; Holroyd, Clay B.","International Journal of Psychophysiology Vol. 146,  (Dec 2019): 1-19."
Improving the accuracy of EEG emotion recognition by combining valence lateralization and ensemble learning with tuning parameters,"Pane, Evi Septiana; Wibawa, Adhi Dharma; Purnomo, Mauridhi Hery.","Cognitive Processing Vol. 20, Iss. 4,  (Nov 2019): 405-417."
On ignoring words—exploring the neural signature of inhibition of affective words using ERPs,"Seib-Pfeifer, Laura-Effi; Koppehele-Gossel, Judith; Gibbons, Henning.","Experimental Brain Research Vol. 237, Iss. 9,  (Sep 1, 2019): 2397-2409."
Effects of arousal on biased competition in attention and short-term memory,"Ásgeirsson, Árni Gunnar; Nieuwenhuis, Sander.","Attention, Perception, & Psychophysics Vol. 81, Iss. 6,  (Aug 15, 2019): 1901-1912."
Increased neural strength and reliability to audiovisual stimuli at the boundary of peripersonal space,"Noel, Jean-Paul; Serino, Andrea; Wallace, Mark T.","Journal of Cognitive Neuroscience Vol. 31, Iss. 8,  (Aug 2019): 1155-1172."
P300 speller performance predictor based on RSVP multi-feature,"Won, Kyungho; Kwon, Moonyoung; Jang, Sehyeon; Ahn, Minkyu; Jun, Sung Chan.","Frontiers in Human Neuroscience Vol. 13,  (Jul 30, 2019)."
Lestaurtinib (CEP-701) modulates the effects of early life hypoxic seizures on cognitive and emotional behaviors in immature rats,"Medlej, Yasser; Salah, Houssein; Wadi, Lara; Saad, Sarah; Bashir, Bashir; et al.","Epilepsy & Behavior Vol. 92,  (Mar 2019): 332-340."
Loss of HCN1 subunits causes absence epilepsy in rats,"Nishitani, Ai; Kunisawa, Naofumi; Sugimura, Taketoshi; Sato, Kazuaki; Yoshida, Yusaku; et al.","Brain Research Vol. 1706,  (Mar 1, 2019): 209-217."
Reappraisal and suppression emotion-regulation tendencies differentially predict reward-responsivity and psychological well-being,"Kelley, Nicholas J; Glazer, James E; Pornpattananangkul, Narun; Nusslock, Robin.","Biological Psychology Vol. 140,  (Jan 2019): 35-47."
Motivational effects on brain activity: Need for closure moderates the impact of task uncertainty on engagement-related P3b,"Kossowska, Małgorzata; Szwed, Paulina; Wyczesany, Miroslaw.","NeuroReport: For Rapid Communication of Neuroscience Research Vol. 30, Iss. 17,  (Dec 10, 2019): 1179-1183."
Selection of visual objects in perception and working memory one at a time,"Thigpen, Nina; Petro, Nathan M; Oschwald, Jessica; Oberauer, Klaus; Keil, Andreas.","Psychological Science Vol. 30, Iss. 9,  (Sep 2019): 1259-1272."
Effects of acute lying and sleep deprivation on the behavior of lactating dairy cows,"Kull, Jessie A; Proudfoot, Katy L; Pighetti, Gina M; Bewley, Jeffery M; O'Hara, Bruce F; et al.","PLoS ONE Vol. 14, Iss. 8,  (Aug 28, 2019)."
Atypical frontal midline theta activity during cognitive control in heroin addicts,"Li, Shifeng; Xu, Qiongying.","NeuroReport: For Rapid Communication of Neuroscience Research Vol. 30, Iss. 12,  (Aug 14, 2019): 852-855."
Sleep as a potential biomarker of tau and β-amyloid burden in the human brain,"Winer, Joseph R; Mander, Bryce A; Helfrich, Randolph F; Maass, Anne; Harrison, Theresa M; et al.","The Journal of Neuroscience Vol. 39, Iss. 32,  (Aug 7, 2019): 6315-6324."
Reduced empathic pain processing in patients with somatoform pain disorder: Evidence from behavioral and neurophysiological measures,"Peng, Weiwei; Meng, Jing; Lou, Yixue; Li, Xinyu; Lei, Yi; et al.","International Journal of Psychophysiology Vol. 139,  (May 2019): 40-47."
Optimized complex network method (OCNM) for improving accuracy of measuring human attention in single-electrode neurofeedback system,"Wu, Zheng-Ping; Zhang, Wei; Zhao, Jing; Chen, Chun; Ji, Peng.","Computational Intelligence and Neuroscience Vol. 2019,  (Mar 3, 2019)."
Cognitive resilience after prolonged task performance: An ERP investigation,"Takács, Endre; Barkaszi, Irén; Altbäcker, Anna; Czigler, István; Balázs, László.","Experimental Brain Research Vol. 237, Iss. 2,  (Feb 4, 2019): 377-388."
Spectral imprints of working memory for everyday associations in the frontoparietal network,"Johnson, Elizabeth L; King-Stephens, David; Weber, Peter B; Laxer, Kenneth D; Lin, Jack J; et al.","Frontiers in Systems Neuroscience Vol. 12,  (Jan 8, 2019)."
Variation in cognitive function over time in Gaucher disease type 3,"Steward, Alta M; Wiggs, Edythe; Lindstrom, Taylor; Ukwuani, Somto; Ryan, Emory; et al.","Neurology Vol. 93, Iss. 24,  (Dec 10, 2019): e2272-e2283."
Effects of mental fatigue on small-world brain functional network organization,"Li, Gang; Luo, Youdong; Zhang, Zhengru; Xu, Yanting; Jiao, Weidong; et al.","Neural Plasticity Vol. 2019,  (Dec 6, 2019)."
Age differences in electrocortical reactivity to fearful faces following aversive conditioning in youth,"Burkhouse, Katie L; Owens, Max; James, Kiera; Gibb, Brandon E.","Journal of Experimental Child Psychology Vol. 188,  (Dec 2019)."
Impoverished auditory cues limit engagement of brain networks controlling spatial selective attention,"Deng, Yuqi; Choi, Inyong; Shinn-Cunningham, Barbara; Baumgartner, Robert.","NeuroImage Vol. 202,  (Nov 15, 2019)."
Reward boosts neural coding of task rules to optimize cognitive flexibility,"Hall-McMaster, Sam; Muhle-Karbe, Paul S; Myers, Nicholas E; Stokes, Mark G.","The Journal of Neuroscience Vol. 39, Iss. 43,  (Oct 23, 2019): 8549-8561."
Extraversion and reward-processing: Consolidating evidence from an electroencephalographic index of reward-prediction-error,"Smillie, Luke D; Jach, Hayley K; Hughes, David M; Wacker, Jan; Cooper, Andrew J; et al.","Biological Psychology Vol. 146,  (Sep 2019)."
Early change of prefrontal theta cordance and occipital alpha asymmetry in the prediction of responses to antidepressants,"Bares, Martin; Novak, Tomas; Vlcek, Premysl; Hejzlar, Martin; Brunovsky, Martin.","International Journal of Psychophysiology Vol. 143,  (Sep 2019): 1-8."
Sensory gating capacity and attentional function in adults with ADHD: A preliminary neurophysiological and neuropsychological study,"Micoulaud-Franchi, Jean-Arthur; Lopez, Régis; Cermolacce, Michel; Vaillant, Florence; Péri, Pauline; et al.","Journal of Attention Disorders Vol. 23, Iss. 10,  (Aug 2019): 1199-1209."
Neural dynamics underlying coherent motion perception in children and adults,"Manning, Catherine; Kaneshiro, Blair; Kohler, Peter J; Duta, Mihaela; Scerif, Gaia; et al.","Developmental Cognitive Neuroscience Vol. 38,  (Aug 2019)."
Neurophysiological activity following rewards and losses among female adolescents and young adults with borderline personality disorder,"Stewart, Jeremy G; Singleton, Paris; Benau, Erik M; Foti, Dan; Allchurch, Hannah; et al.","Journal of Abnormal Psychology Vol. 128, Iss. 6,  (Aug 2019): 610-621."
Performance monitoring and correct response significance in conscientious individuals,"Imhof, Mike F; Rüsseler, Jascha.","Frontiers in Human Neuroscience Vol. 13,  (Jul 10, 2019)."
Neurophysiological evidence for early modulation of amygdala activity by emotional reappraisal,"Guex, Raphael; Hofstetter, Christoph; Domínguez-Borràs, Judith; Méndez-Bértolo, Constantino; Sterpenich, Virginie; et al.","Biological Psychology Vol. 145,  (Jul 2019): 211-223."
Dynamics of measures of the functional state of the central nervous system in navy operators after long work cycles on the background of cytoflavin,"Parfenov, S. A; Belov, V. G; Parfenov, Yu. A.","Neuroscience and Behavioral Physiology Vol. 49, Iss. 5,  (Jun 15, 2019): 535-538."
Efficacy and safety of pyridoxal in West syndrome: A retrospective study,"Matsuura, Ryuki; Hamano, Shin-ichiro; Kubota, Jun; Daida, Atsuro; Ikemoto, Satoru; et al.","Brain & Development Vol. 41, Iss. 5,  (May 2019): 413-419."
Reliability of reported peri-ictal behavior to identify psychogenic nonepileptic seizures,"Kerr, Wesley T; Chau, Andrea M; Janio, Emily A; Braesch, Chelsea T; Le, Justine M; et al.","Seizure Vol. 67,  (Apr 2019): 45-51."
Electrophysiological alterations in motor‐auditory predictive coding in autism spectrum disorder,"van Laarhoven, Thijs; Stekelenburg, Jeroen J; Eussen, Mart L. J. M; Vroomen, Jean.","Autism Research Vol. 12, Iss. 4,  (Apr 2019): 589-599."
Regulation of arousal via online neurofeedback improves human performance in a demanding sensory-motor task,"Faller, Josef; Cummings, Jennifer; Saproo, Sameer; Sajda, Paul.","PNAS Proceedings of the National Academy of Sciences of the United States of America Vol. 116, Iss. 13,  (Mar 26, 2019): 6482-6490."
The effect of Kalman-weighted averaging and artifact rejection on residual noise during auditory brainstem response testing,"Norrix, Linda W; Thein, Julie; Velenovsky, David.","American Journal of Audiology Vol. 28, Iss. 1,  (Mar 2019): 114-124."
Schizotypal traits are associated with sleep spindles and rapid eye movement in adolescence,"Kuula, Liisa; Merikanto, Ilona; Makkonen, Tommi; Halonen, Risto; Lahti‐Pulkkinen, Marius; et al.","Journal of Sleep Research Vol. 28, Iss. 1,  (Feb 2019): 1-7."
Inherent physiological artifacts in EEG during tDCS,"Gebodh, Nigel; Esmaeilpour, Zeinab; Adair, Devin; Chelette, Kenneth; Dmochowski, Jacek; et al.","NeuroImage Vol. 185,  (Jan 15, 2019): 408-424."
Empathy for pain in fibromyalgia patients: An EEG study,"de Tommaso, Marina; Ricci, Katia; Conca, Giuliana; Vecchio, Eleonora; Delussi, Marianna; et al.","International Journal of Psychophysiology Vol. 146,  (Dec 2019): 43-53."
No evidence of associations between ADHD and event-related brain potentials from a continuous performance task in a population-based sample of adolescent twins,"Lau-Zhu, Alex; Tye, Charlotte; Rijsdijk, Frühling; McLoughlin, Grainne.","PLoS ONE Vol. 14, Iss. 10,  (Oct 4, 2019)."
Acute separate and combined effects of cannabinoid and nicotinic receptor agonists on mmn-indexed auditory deviance detection in healthy humans,"de la Salle, Sara; Inyang, Lawrence; Impey, Danielle; Smith, Dylan; Choueiry, Joelle; et al.","Pharmacology, Biochemistry and Behavior Vol. 184,  (Sep 2019)."
"Common and specific loci of Stroop effects in vocal and manual tasks, revealed by event-related brain potentials and posthypnotic suggestions","Zahedi, Anoushiravan; Abdel Rahman, Rasha; Stürmer, Birgit; Sommer, Werner.","Journal of Experimental Psychology: General Vol. 148, Iss. 9,  (Sep 2019): 1575-1594."
A robust implicit measure of facial attractiveness discrimination,"Luo, Qiuling; Rossion, Bruno; Dzhelyova, Milena.","Social Cognitive and Affective Neuroscience Vol. 14, Iss. 7,  (Jul 2019): 737-746."
Evaluation for epilepsy surgery—Why do patients not proceed to operation?,"Weber, Johan; Gustafsson, Cecilia; Malmgren, Kristina; Strandberg, Moa; Can, Ûmran; et al.","Seizure Vol. 69,  (Jul 2019): 241-244."
Nightmares do result in psychophysiological arousal: A multimeasure ambulatory assessment study,"Paul, Franc; Alpers, Georg W; Reinhard, Iris; Schredl, Michael.","Psychophysiology Vol. 56, Iss. 7,  (Jul 2019): 1-16."
Childhood high‐frequency EEG activity during sleep is associated with incident insomnia symptoms in adolescence,"Fernandez‐Mendoza, Julio; Li, Yun; Fang, Jidong; Calhoun, Susan L; Vgontzas, Alexandros N; et al.","Journal of Child Psychology and Psychiatry Vol. 60, Iss. 7,  (Jul 2019): 742-751."
Alterations in resting-state gamma activity in patients with schizophrenia: A high-density EEG study,"Baradits, Máté; Kakuszi, Brigitta; Bálint, Sára; Fullajtár, Máté; Mód, László; et al.","European Archives of Psychiatry and Clinical Neuroscience Vol. 269, Iss. 4,  (Jun 1, 2019): 429-437."
Effortful processing reduces the attraction effect in multi-alternative decision making: An electrophysiological study using a task-irrelevant probe technique,"Tsuzuki, Takashi; Takeda, Yuji; Chiba, Itsuki.","Frontiers in Psychology Vol. 10,  (Apr 24, 2019)."
A postdecisional neural marker of confidence predicts information-seeking in decision-making,"Desender, Kobe; Murphy, Peter; Boldt, Annika; Verguts, Tom; Yeung, Nick.","The Journal of Neuroscience Vol. 39, Iss. 17,  (Apr 24, 2019): 3309-3319."
Distinguishing different emotions evoked by music via electroencephalographic signals,"Hou, Yimin; Chen, Shuaiqi.","Computational Intelligence and Neuroscience Vol. 2019,  (Mar 6, 2019)."
A test of dopamine hyper- and hyposensitivity in alcohol use,"Soder, Heather E; Webber, Troy A; Bornovalova, Marina A; Park, Jong Y; Potts, Geoffrey F.","Addictive Behaviors Vol. 90,  (Mar 2019): 395-401."
Spectral modification by operant conditioning of cortical theta suppression in rats,"Roh, Mootaek; Jang, Il-Sung; Suk, Kyoungho; Lee, Maan-Gee.","Clinical Psychopharmacology and Neuroscience Vol. 17, Iss. 1,  (Feb 2019): 93-104."
A touching sight: EEG/ERP correlates for the vicarious processing of affectionate touch,"Schirmer, Annett; McGlone, Francis.","Cortex: A Journal Devoted to the Study of the Nervous System and Behavior Vol. 111,  (Feb 2019): 1-15."
Understanding the link between anxiety and a neural marker of anxiety (the error-related negativity) in 5 to 7 year-old children,"Chong, Lyndsey Juliane; Meyer, Alexandria.","Developmental Neuropsychology Vol. 44, Iss. 1,  (Jan 2019 - Feb 2019): 71-87."
Differentiating responders and non-responders to rTMS treatment for depression after one week using resting EEG connectivity measures,"Bailey, N. W; Hoy, K. E; Rogasch, N. C; Thomson, R. H; McQueen, S; et al.","Journal of Affective Disorders Vol. 242,  (Jan 1, 2019): 68-79."
Interictal epileptiform discharges shape large-scale intercortical communication,"Dahal, Prawesh; Ghani, Naureen; Flinker, Adeen; Dugan, Patricia; Friedman, Daniel; et al.","Brain: A Journal of Neurology Vol. 142, Iss. 11,  (Nov 2019): 3502-3513."
Qualitative scoring of the Pentagon Test: A tool for the identification of subtle cognitive deficits in isolated REM sleep behavior disorder patients,"Galbiati, Andrea; Carli, Giulia; Dodich, Alessandra; Marelli, Sara; Caterina, Pagnini; et al.","Archives of Clinical Neuropsychology Vol. 34, Iss. 7,  (Oct 2019): 1113-1120."
Afferent-efferent connectivity between auditory brainstem and cortex accounts for poorer speech-in-noise comprehension in older adults,"Bidelman, Gavin M; Price, Caitlin N; Shen, Dawei; Arnott, Stephen R; Alain, Claude.","Hearing Research Vol. 382,  (Oct 2019)."
Elucidating the neural representation and the processing dynamics of face ensembles,"Roberts, Tyler; Cant, Jonathan S; Nestor, Adrian.","The Journal of Neuroscience Vol. 39, Iss. 39,  (Sep 25, 2019): 7737-7747."
Epilepsy in neurofibromatosis type 1: Diffuse cerebral dysfunction?,"Serdaroglu, Esra; Konuskan, Bahadir; Oguz, Kader Karli; Gurler, Gokce; Yalnizoglu, Dilek; et al.","Epilepsy & Behavior Vol. 98, Iss. Part A,  (Sep 2019): 6-9."
Modulation of large-scale cortical coupling by transcranial alternating current stimulation,"Schwab, Bettina C; Misselhorn, Jonas; Engel, Andreas K.","Brain Stimulation Vol. 12, Iss. 5,  (Sep 2019 - Oct 2019): 1187-1196."
Frontal brain asymmetry and the trajectory of shyness across the early school years,"Poole, Kristie L; Santesso, Diane L; Van Lieshout, Ryan J; Schmidt, Louis A.","Journal of Abnormal Child Psychology Vol. 47, Iss. 7,  (Jul 15, 2019): 1253-1263."
Association between electroencephalogram changes and plasma clozapine levels in clozapine-treated patients,"Kim, Hye Sung; Youn, Tak; Kim, Se Hyun; Jeong, Seong Hoon; Jung, Hee Yeon; et al.","International Clinical Psychopharmacology Vol. 34, Iss. 3,  (May 2019): 131-137."
Middle latency responses to optimized chirps in adult cochlear implant users,"Alemi, Razieh; Lehmann, Alexandre.","Journal of the American Academy of Audiology Vol. 30, Iss. 5,  (May 1, 2019): 396-405."
Electroencephalographic evidence for improved visual working memory performance during standing and exercise,"Dodwell, Gordon; Müller, Hermann J; Töllner, Thomas.","British Journal of Psychology Vol. 110, Iss. 2,  (May 2019): 400-427."
Enhanced theta-band coherence between midfrontal and posterior parietal areas reflects post-feedback adjustments in the state of outcome uncertainty,"Nurislamova, Yulia M; Novikov, Nikita A; Zhozhikashvili, Natalia A; Chernyshev, Boris V.","Frontiers in Integrative Neuroscience Vol. 13,  (Apr 24, 2019)."
"Lateralized inhibition of symmetric contractions is associated with motor, attentional and executive processes","Tisseyre, Joseph; Marquet-Doléac, Jérôme; Barral, Jérôme; Amarantini, David; Tallet, Jessica.","Behavioural Brain Research Vol. 361,  (Apr 1, 2019): 65-73."
Automatic artefact detection in single‐channel sleep EEG recordings,"Malafeev, Alexander; Omlin, Ximena; Wierzbicka, Aleksandra; Wichniak, Adam; Jernajczyk, Wojciech; et al.","Journal of Sleep Research Vol. 28, Iss. 2,  (Apr 2019): 1-10."
Parafoveal previews and lexical frequency in natural reading: Evidence from eye movements and fixation-related potentials,"Degno, Federica; Loberg, Otto; Zang, Chuanli; Zhang, Manman; Donnelly, Nick; et al.","Journal of Experimental Psychology: General Vol. 148, Iss. 3,  (Mar 2019): 453-474."
Visual mismatch negativity to disappearing parts of objects and textures,"Czigler, István; Sulykos, István; File, Domonkos; Kojouharova, Petia; Gaál, Zsófia Anna.","PLoS ONE Vol. 14, Iss. 2,  (Feb 7, 2019)."
Sophisticated deception in junior middle school students: An ERP study,"Leng, Haizhou; Wang, Yanrong; Li, Qian; Yang, Lizhu; Sun, Yan.","Frontiers in Psychology Vol. 9,  (Jan 11, 2019)."
Tinnitus and neuropathic pain share a common neural substrate in the form of specific brain connectivity and microstate profiles,"Vanneste, Sven; To, Wing Ting; De Ridder, Dirk.","Progress in Neuro-Psychopharmacology & Biological Psychiatry Vol. 88,  (Jan 10, 2019): 388-400."
