Title,Authors,Journal
Examining the underpinnings of loudness dependence of auditory evoked potentials with positron emission tomography,"Pillai, Rajapillai L. I; Bartlett, Elizabeth A; Ananth, Mala R; Zhu, Chencan; Yang, Jie; et al.","NeuroImage Vol. 213,  (Jun 2020)."
Extent of single-neuron activity modulation by hippocampal interictal discharges predicts declarative memory disruption in humans,"Reed, Chrystal M; Mosher, Clayton P; Chandravadia, Nand; Chung, Jeffrey M; Mamelak, Adam N; et al.","The Journal of Neuroscience Vol. 40, Iss. 3,  (Jan 15, 2020): 682-693."
Preservation of interference effects in working memory after orbitofrontal damage,"Llorens, Anaïs; Funderud, Ingrid; Blenkmann, Alejandro O; Lubell, James; Foldal, Maja; et al.","Frontiers in Human Neuroscience Vol. 13,  (Jan 8, 2020)."
Benign syndrome of transient epileptic amnesia: Good outcome after 67 years of follow-up,"Cretin, B; Philippi, N; Dibitonto, L; Blanc, F.","Revue Neurologique Vol. 176, Iss. 1-2,  (Jan 2020 - Feb 2020): 124-125."
Topographic specificity of alpha power during auditory spatial attention,"Deng, Yuqi; Choi, Inyong; Shinn-Cunningham, Barbara.","NeuroImage Vol. 207,  (Feb 15, 2020)."
Noradrenergic responsiveness supports selective attention across the adult lifespan,"Dahl, Martin J; Mather, Mara; Sander, Myriam C; Werkle-Bergner, Markus.","The Journal of Neuroscience Vol. 40, Iss. 22,  (May 27, 2020): 4372-4390."
Electrocorticography reveals spatiotemporal neuronal activation patterns of verbal fluency in patients with epilepsy,"Williams Roberson, Shawniqua; Shah, Preya; Piai, Vitória; Gatens, Heather; Krieger, Abba M; et al.","Neuropsychologia Vol. 141,  (Apr 2020)."
Microstructural correlates of ²³Na relaxation in human brain at 7 Tesla,"Kolbe, Scott C; Syeda, Warda; Blunck, Yasmin; Glarin, Rebecca; Law, Meng; et al.","NeuroImage Vol. 211,  (May 1, 2020)."
Status epilepticus mimicking stroke recurrence,"Pauletto, Giada; Bax, Francesco; Gigli, Gian Luigi; Lorenzut, Simone; Verriello, Lorenzo; et al.","Epilepsy & Behavior Vol. 104, Iss. Part B,  (Mar 2020)."
A metabolic brain pattern associated with Anti-N-Methyl-D-Aspartate receptor encephalitis,"Kerik-Rotenberg, Nora; Diaz-Meneses, Ivan; Hernandez-Ramirez, Rodrigo; Muñoz-Casillas, Rodrigo; Reynoso-Mejia, Carlos A; et al.","Psychosomatics: Journal of Consultation and Liaison Psychiatry Vol. 61, Iss. 1,  (Jan 2020 - Feb 2020): 39-48."
Evidence that alpha blocking is due to increases in system-level oscillatory damping not neuronal population desynchronisation,"Liley, David T. J; Muthukumaraswamy, Suresh D.","NeuroImage Vol. 208,  (Mar 2020)."
Advanced TMS approaches to probe corticospinal excitability during action preparation,"Derosiere, Gerard; Vassiliadis, Pierre; Duque, Julie.","NeuroImage Vol. 213,  (Jun 2020)."
Long term sequelae of amygdala enlargement in temporal lobe epilepsy,"Peedicail, Joseph Samuel; Sandy, Sherry; Singh, Shaily; Hader, Walter; Myles, Terence; et al.","Seizure: European Journal of Epilepsy Vol. 74,  (Jan 2020): 33-40."
Clinical presentation of sporadic Creutzfeldt-Jakob disease in Han-Chinese,"Chen, Shuai; He, Shuang; Xu, Yin-Yan; Teng, Hai-Ying; Zhang, Jie-Wen.","Alzheimer Disease and Associated Disorders Vol. 34, Iss. 2,  (Apr 2020 - Jun 2020): 188-190."
Effects of cTBS on the frequency-following response and other auditory evoked potentials,"López-Caballero, Fran; Martin-Trias, Pablo; Ribas-Prats, Teresa; Gorina-Careta, Natàlia; Bartrés-Faz, David; et al.","Frontiers in Human Neuroscience Vol. 14,  (Jul 8, 2020)."
Intraexperimental development of priming and event related potentials effects with abstract geometrical stimuli,"Ortu, Daniele; Vaidya, Manish.","Behavioural Processes Vol. 172,  (Mar 2020)."
"Quasi-diffusion magnetic resonance imaging (QDI): A fast, high B-value diffusion imaging technique","Barrick, Thomas R; Spilling, Catherine A; Ingo, Carson; Madigan, Jeremy; Isaacs, Jeremy D; et al.","NeuroImage Vol. 211,  (May 1, 2020)."
Psychiatric presentation of probable seronegative autoimmune encephalitis in a late middle-aged woman with ovarian teratoma,"Lavasani, Shadi; Lipsitt, Adam; Young, Keith A; Bourgeois, James A.","Psychosomatics: Journal of Consultation and Liaison Psychiatry Vol. 61, Iss. 3,  (May 2020 - Jun 2020): 288-295."
Forced conceptual thought induced by electrical stimulation of the left prefrontal gyrus involves widespread neural networks,"Liu, Anli; Friedman, Daniel; Barron, Daniel S; Wang, Xiuyuan; Thesen, Thomas; et al.","Epilepsy & Behavior Vol. 104, Iss. Part A,  (Mar 2020)."
Spinal cord demyelination in children: A diagnostic challenge in neuropaediatrics for a good outcome,"Battini, Roberta; Olivieri, Giorgia; Milone, Roberta; Mazio, Federica; Scalise, Roberta; et al.","Brain & Development Vol. 42, Iss. 6,  (Jun 2020): 457-461."
Focal status epilepticus as unique clinical feature of COVID-19: A case report,"Vollono, Catello; Rollo, Eleonora; Romozzi, Marina; Frisullo, Giovanni; Servidei, Serenella; et al.","Seizure: European Journal of Epilepsy Vol. 78,  (May 2020): 109-112."
Impaired face-like object recognition in premanifest Huntington's disease,"Martínez-Horta, Saul; Horta-Barba, Andrea; Perez-Perez, Jesús; Antoran, Mizar; Pagonabarraga, Javier; et al.","Cortex: A Journal Devoted to the Study of the Nervous System and Behavior Vol. 123,  (Feb 2020): 162-172."
Pain behavior without pain sensation: An epileptic syndrome of “symbolism for pain”?,"Hagiwara, Koichi; Garcia-Larrea, Luis; Tremblay, Léon; Montavont, Alexandra; Catenoix, Hélène; et al.","Pain Vol. 161, Iss. 3,  (Mar 2020): 502-508."
Identificacion of MRI-based psychosis subtypes: Replication and refinement,"Planchuelo-Gómez, Álvaro; Lubeiro, Alba; Núñez-Novo, Pablo; Gomez-Pilar, Javier; de Luis-García, Rodrigo; et al.","Progress in Neuro-Psychopharmacology & Biological Psychiatry Vol. 100,  (Jun 8, 2020)."
Stereo-EEG exploration in the insula/operculum in paediatric patients with refractory epilepsy,"Kappen, Pablo; Eltze, Christin; Tisdall, Martin; Cross, J. Helen; Thornton, Rachel; et al.","Seizure: European Journal of Epilepsy Vol. 78,  (May 2020): 63-70."
Brain source imaging based on movement-related cortical potentials induced by fatigue during self-paced handgrip contractions,"Guo, Feng; Zhang, Tianyu; Hanson, Nicholas J; Zhang, Rihui.","NeuroReport: For Rapid Communication of Neuroscience Research Vol. 31, Iss. 4,  (Mar 4, 2020): 300-304."
Response activation and inhibition in patients with prolactinomas: An electrophysiological study,"Song, Jian; Cao, Chenglong; Wang, Yu; Yao, Shun; Catalino, Michael P; et al.","Frontiers in Human Neuroscience Vol. 14,  (Jul 23, 2020)."
Delirious mania as a neuropsychiatric presentation in patients with anti–N-methyl-D-aspartate receptor encephalitis,"Restrepo-Martínez, Miguel; Chacón-González, Jacobo; Bayliss, Leo; Ramírez-Bermúdez, Jesús; Fricchione, Gregory Lewis; et al.","Psychosomatics: Journal of Consultation and Liaison Psychiatry Vol. 61, Iss. 1,  (Jan 2020 - Feb 2020): 64-69."
Praxis induction and its relationship with cognition in genetic generalized epilepsy,"Abarrategui, Belén; Parejo-Carbonell, Beatriz; García, Maria Eugenia García; Gil-Nagel, Antonio; García-Morales, Irene.","Epilepsy & Behavior Vol. 102,  (Jan 2020)."
Microsleep episodes in the borderland between wakefulness and sleep,"Hertig-Godeschalk, Anneke; Skorucak, Jelena; Malafeev, Alexander; Achermann, Peter; Mathis, Johannes; et al.","Sleep: Journal of Sleep and Sleep Disorders Research Vol. 43, Iss. 1,  (Jan 2020): 1-11."
Brain networks communicate through theta oscillations to encode high load in a visuospatial working memory task: An EEG connectivity study,"Muthukrishnan, Suriya Prakash; Soni, Sunaina; Sharma, Ratna.","Brain Topography Vol. 33, Iss. 1,  (Jan 2020): 75-85."
A psychophysiological model of firearms training in police officers: A virtual reality experiment for biocybernetic adaptation,"Muñoz, John E; Quintero, Luis; Stephens, Chad L; Pope, Alan T.","Frontiers in Psychology Vol. 11,  (Apr 16, 2020)."
Brain mapping performance as an occupational therapy assessment aid in attention deficit hyperactivity disorder,"Chatthong, Winai; Khemthong, Supalak; Wongsawat, Yodchanan.","American Journal of Occupational Therapy Vol. 74, Iss. 2,  (Mar 2020 - Apr 2020): 1-7."
Symmetric patterns with different luminance polarity (anti‐symmetry) generate an automatic response in extrastriate cortex,"Makin, Alexis D. J; Rampone, Giulia; Bertamini, Marco.","European Journal of Neuroscience Vol. 51, Iss. 3,  (Feb 2020): 922-936."
The importance of cursive handwriting over typewriting for learning in the classroom: A high-density EEG study of 12-year-old children and young adults,"Ose Askvik, Eva; van der Weel, F. R. (Ruud); van der Meer, Audrey L. H.","Frontiers in Psychology Vol. 11,  (Jul 28, 2020)."
A pilot study on the electrophysiological monitoring of patient’s engagement in post-stroke physical rehabilitation,"Bartur, Gadi; Joubran, Katherin; Peleg-Shani, Sara; Vatine, Jean-Jacques; Shahaf, Goded.","Disability and Rehabilitation: Assistive Technology Vol. 15, Iss. 4,  (May 2020): 471-479."
Inhibitory‐control event‐related potentials correlate with individual differences in alcohol use,"O'Halloran, Laura; Rueda‐Delgado, Laura M; Jollans, Lee; Cao, Zhipeng; Boyle, Rory; et al.","Addiction Biology Vol. 25, Iss. 2,  (Mar 2020)."
Ongoing electroencephalographic rhythms related to exploratory movements in transgenic TASTPM mice,"Del Percio, Claudio; Drinkenburg, Wilhelmus; Lopez, Susanna; Pascarelli, Maria Teresa; Lizio, Roberta; et al.","Journal of Alzheimer's Disease Vol. 78, Iss. 1,  (2020): 291-308."
Neurophysiology of threat processing bias in combat‐related post‐traumatic stress disorder,"DeLaRosa, Bambi L; Spence, Jeffrey S; Didehbani, Nyaz; Tillman, Gail D; Motes, Michael A; et al.","Human Brain Mapping Vol. 41, Iss. 1,  (Jan 2020): 218-229."
Pharmacological mechanisms of interhemispheric signal propagation: A TMS-EEG study,"Hui, Jeanette; Zomorrodi, Reza; Lioumis, Pantelis; Salavati, Bahar; Rajji, Tarek K; et al.","Neuropsychopharmacology Vol. 45, Iss. 6,  (May 2020): 932-939."
Dopaminergic drugs alter beta coherence during motor imagery and motor execution in healthy adults,"Aprigio, Danielle; Tanaka, Guaraci Ken; Bittencourt, Juliana; Gongora, Mariana; Teixeira, Silmar; et al.","Arquivos de Neuro-Psiquiatria Vol. 78, Iss. 4,  (Apr 2020): 199-205."
Alpha rhythm slowing in a modified thalamocortico-thalamic model related with Alzheimer’s disease,"Li, XiaoYuan; Yang, XiaoLi; Sun, ZhongKui.","PLoS ONE Vol. 15, Iss. 3,  (Mar 12, 2020)."
Children with unilateral cerebral palsy utilize more cortical resources for similar motor output during treadmill gait,"Short, Matthew R; Damiano, Diane L; Kim, Yushin; Bulea, Thomas C.","Frontiers in Human Neuroscience Vol. 14,  (Feb 14, 2020)."
"Fitness, physical activity, sedentary time, inhibitory control, and neuroelectric activity in children with overweight or obesity: The ActiveBrains project","Mora‐Gonzalez, Jose; Esteban‐Cornejo, Irene; Solis‐Urra, Patricio; Migueles, Jairo H; Cadenas‐Sanchez, Cristina; et al.","Psychophysiology Vol. 57, Iss. 6,  (Jun 2020)."
Frequency-based dissociation of symbolic and nonsymbolic numerical processing during numerical comparison,"Rubinsten, Orly; Korem, Nachshon; Levin, Naama; Furman, Tamar.","Journal of Cognitive Neuroscience Vol. 32, Iss. 5,  (May 2020): 762-782."
All-or-none face categorization in the human brain,"Retter, Talia L; Jiang, Fang; Webster, Michael A; Rossion, Bruno.","NeuroImage Vol. 213,  (Jun 2020)."
Neurophysiological correlates of user experience in smart home systems (SHSs): First evidence from electroencephalography and autonomic measures,"Angioletti, Laura; Cassioli, Federico; Balconi, Michela.","Frontiers in Psychology Vol. 11,  (Mar 19, 2020)."
Sleep restriction does not potentiate nocebo‐induced changes in pain and cortical potentials,"Ree, Anbjørn; Nilsen, Kristian Bernhard; Knardahl, Stein; Sand, Trond; Matre, Dagfinn.","European Journal of Pain Vol. 24, Iss. 1,  (Jan 2020): 110-121."
Resting-state EEG beta band power predicts quality of life outcomes in patients with depressive disorders: A longitudinal investigation,"Koshiyama, Daisuke; Kirihara, Kenji; Usui, Kaori; Tada, Mariko; Fujioka, Mao; et al.","Journal of Affective Disorders Vol. 265,  (Mar 15, 2020): 416-422."
Neurophysiological features of cognitive activity in patients with anxiety-depressive and hypochondriasis disorders,"Lebedeva, N. N; Maltsev, V. Yu; Pochigaeva, K. I; Guekht, A. B.","Neuroscience and Behavioral Physiology Vol. 50, Iss. 2,  (Feb 2020): 137-142."
Feature overlap and relevance determine sequential modulations in the Simon task,"Hoppe, Katharina; Wascher, Edmund; Küper, Kristina.","Journal of Psychophysiology Vol. 34, Iss. 2,  (2020): 81-98."
Cortical response to fat taste,"Andersen, Camilla Arndal; Nielsen, Line; Møller, Stine; Kidmose, Preben.","Chemical Senses Vol. 45, Iss. 4,  (May 2020): 283-291."
Bispectral EEG (BSEEG) to assess arousal after electro-convulsive therapy (ECT),"Zarei, Kasra; Sparr, Nicholas A; Trapp, Nicholas T; Neuhaus, Elena D; Cromwell, John W; et al.","Psychiatry Research Vol. 285,  (Mar 2020)."
Temperament predictors of motor imagery control in BCI,"Zapała, Dariusz; Małkiewicz, Monika; Francuz, Piotr; Kołodziej, Marcin; Majkowski, Andrzej.","Journal of Psychophysiology Vol. 34, Iss. 4,  (2020): 246-254."
An exploratory study using electroencephalography (EEG) to measure the smartphone user experience in the short term,"Ding, Yi; Cao, Yaqin; Qu, Qingxing; Duffy, Vincent G.","International Journal of Human-Computer Interaction Vol. 36, Iss. 11,  (Jul 2020): 1008-1021."
Exploitation of local and global information in predictive processing,"Kluger, Daniel S; Broers, Nico; Roehe, Marlen A; Wurm, Moritz F; Busch, Niko A; et al.","PLoS ONE Vol. 15, Iss. 4,  (Apr 13, 2020)."
Performance monitoring during visual priming,"Westerberg, Jacob A; Maier, Alexander; Woodman, Geoffrey F; Schall, Jeffrey D.","Journal of Cognitive Neuroscience Vol. 32, Iss. 3,  (Mar 2020): 515-526."
Hearing aids do not alter cortical entrainment to speech at audible levels in mild-to-moderately hearing-impaired subjects,"Vanheusden, Frederique J; Kegler, Mikolaj; Ireland, Katie; Georga, Constantina; Simpson, David M; et al.","Frontiers in Human Neuroscience Vol. 14,  (Apr 3, 2020)."
Alterations in sleep electroencephalography synchrony in combat-exposed veterans with post-traumatic stress disorder,"Laxminarayan, Srinivas; Wang, Chao; Ramakrishnan, Sridhar; Oyama, Tatsuya; Cashmere, J. David; et al.","Sleep: Journal of Sleep and Sleep Disorders Research Vol. 43, Iss. 7,  (Jul 2020): 1-11."
"Large EEG amplitude effects are highly similar across Necker cube, smiley, and abstract stimuli","Joos, Ellen; Giersch, Anne; Hecker, Lukas; Schipp, Julia; Heinrich, Sven P; et al.","PLoS ONE Vol. 15, Iss. 5,  (May 20, 2020)."
Behavioral and neural indices of trust formation in cross-race and same-race interactions,"Olcaysoy Okten, Irmak; Magerman, Adam; Forbes, Chad E.","Journal of Neuroscience, Psychology, and Economics Vol. 13, Iss. 2,  (Jun 2020): 100-125."
SMR/theta neurofeedback training improves cognitive performance and EEG activity in elderly with mild cognitive impairment: A pilot study,"Marlats, Fabienne; Bao, Guillaume; Chevallier, Sylvain; Boubaya, Marouane; Djabelkhir-Jemmi, Leila; et al.","Frontiers in Aging Neuroscience Vol. 12,  (Jun 16, 2020)."
Dual tasks as an indicator of the characteristics of cognitive deficit in patients after craniocerebral trauma,"Zhavoronkova, L. A; Maksakova, O. A; Shevtsova, T. P; Moraresku, S. I; Kuptsova, S. V; et al.","Neuroscience and Behavioral Physiology Vol. 50, Iss. 5,  (Jun 2020): 546-551."
Detection of moderate traumatic brain injury from resting-state eye-closed electroencephalography,"Lai, Chi Qin; Ibrahim, Haidi; Abd. Hamid, Aini Ismafairus; Abdullah, Mohd Zaid; Azman, Azlinda; et al.","Computational Intelligence and Neuroscience Vol. 2020,  (Mar 11, 2020)."
Disruption of the prefrontal cortex improves implicit contextual memory-guided attention: Combined behavioral and electrophysiological evidence,"Pahi, Mario Rosero; Cavalli, Juliana; Nees, Frauke; Flor, Herta; Andoh, Jamila.","Cerebral Cortex Vol. 30, Iss. 1,  (Jan 2020): 20-30."
The human k-complex: Insights from combined scalp-intracranial EEG recordings,"Latreille, Véronique; von Ellenrieder, Nicolás; Peter-Derex, Laure; Dubeau, François; Gotman, Jean; et al.","NeuroImage Vol. 213,  (Jun 2020)."
A design thinking model based on quantitative electroencephalography in social emotional learning for attention deficit hyperactivity disorder,"Chatthong, Winai; Khemthong, Supalak; Wongsawat, Yodchanan.","Mind, Brain, and Education Vol. 14, Iss. 2,  (May 2020): 104-113."
Double-criteria active learning for multiclass brain-computer interfaces,"She, Qingshan; Chen, Kang; Luo, Zhizeng; Nguyen, Thinh; Potter, Thomas; et al.","Computational Intelligence and Neuroscience Vol. 2020,  (Mar 10, 2020)."
Wakefulness/sleep architecture and electroencephalographic activity in mice lacking the translational repressor 4E-BP1 or 4E-BP2,"Areal, Cassandra C; Cao, Ruifeng; Sonenberg, Nahum; Mongrain, Valérie.","Sleep: Journal of Sleep and Sleep Disorders Research Vol. 43, Iss. 2,  (Feb 2020): 1-12."
Steady-state visually evoked potential is modulated by the difference of recognition condition,"Minami, Tetsuto; Azuma, Kazuki; Nakauchi, Shigeki.","PLoS ONE Vol. 15, Iss. 7,  (Jul 2, 2020)."
Prediction of individual responses to electroconvulsive therapy in patients with schizophrenia: Machine learning analysis of resting-state electroencephalography,"Min, Beomjun; Kim, Minah; Lee, Junhee; Byun, Jung-Ick; Chu, Kon; et al.","Schizophrenia Research Vol. 216,  (Feb 2020): 147-153."
Neurophysiological correlates of sexually evocative speech,"Rigoulot, Simon; Jiang, Xiaoming; Vergis, Nikos; Pell, Marc D.","Biological Psychology Vol. 154,  (Jul 2020)."
An orthographic prediction error as the basis for efficient visual word recognition,"Gagl, Benjamin; Sassenhagen, Jona; Haan, Sophia; Gregorova, Klara; Richlan, Fabio; et al.","NeuroImage Vol. 214,  (Jul 1, 2020)."
A WiSARD network approach for a BCI-based robotic prosthetic control,"Staffa, Mariacarla; Giordano, Maurizio; Ficuciello, Fanny.","International Journal of Social Robotics Vol. 12, Iss. 3,  (Jul 2020): 749-764."
Frontal alpha asymmetry moderated by suicidal ideation in patients with major depressive disorder: A comparison with healthy individuals,"Roh, Sang-Choong; Kim, Ji Sun; Kim, Sungkean; Kim, Yourim; Lee, Seung-Hwan.","Clinical Psychopharmacology and Neuroscience Vol. 18, Iss. 1,  (Feb 2020): 58-66."
Age-related changes in cortical connectivity during surgical anesthesia,"Li, Duan; Puglia, Mike P; Lapointe, Andrew P; Ip, Ka I; Zierau, Mackenzie; et al.","Frontiers in Aging Neuroscience Vol. 11,  (Jan 10, 2020)."
Outcome of prolonged video-EEG monitoring in a new VA monitoring unit,"Amin, Ushtar; Benbadis, Selim R; Frontera, Alfred T., Jr.","Epilepsy & Behavior Vol. 102,  (Jan 2020)."
EEG dynamical network analysis method reveals the neural signature of visual-motor coordination,"Li, Xinzhe; Mota, Bruno; Kondo, Toshiyuki; Nasuto, Slawomir; Hayashi, Yoshikatsu.","PLoS ONE Vol. 15, Iss. 5,  (May 27, 2020)."
Gamma entrainment in a large retrospective cohort: Implications for photic stimulation therapy for Alzheimer’s disease,"Zibrandtsen, Ivan C; Agger, Mikkel; Kjaer, Troels W.","Journal of Alzheimer's Disease Vol. 75, Iss. 4,  (2020): 1181-1190."
Multifractal and entropy-based analysis of delta band neural activity reveals altered functional connectivity dynamics in schizophrenia,"Racz, Frigyes Samuel; Stylianou, Orestis; Mukli, Peter; Eke, Andras.","Frontiers in Systems Neuroscience Vol. 14,  (Jul 24, 2020)."
Contact heat evoked potentials are responsive to peripheral sensitization: Requisite stimulation parameters,"Linde, Lukas D; Haefeli, Jenny; Jutzeler, Catherine R; Rosner, Jan; McDougall, Jessica; et al.","Frontiers in Human Neuroscience Vol. 13,  (Jan 10, 2020)."
A highly cognitive demanding working memory task may prevent the development of nociceptive hypersensitivity,"Torta, Diana M; De Laurentis, Martina; Eichin, Katharina Naomi; von Leupoldt, Andreas; van den Broeke, Emanuel N; et al.","Pain Vol. 161, Iss. 7,  (Jul 2020): 1459-1469."
Sleep architecture of adenosine A 2A receptor-deficient mice,"Tsai, Chia-Jung; Liu, Chih-Yao; Lazarus, Michael; Hayashi, Yu.","Sleep and Biological Rhythms Vol. 18, Iss. 3,  (Jul 2020): 275-279."
Assessing the depth of language processing in patients with disorders of consciousness,"Gui, Peng; Jiang, Yuwei; Zang, Di; Qi, Zengxin; Tan, Jiaxing; et al.","Nature Neuroscience Vol. 23, Iss. 6,  (Jun 2020): 761-770."
Four-dimensional map of direct effective connectivity from posterior visual areas,"Sugiura, Ayaka; Silverstein, Brian H; Jeong, Jeong-Won; Nakai, Yasuo; Sonoda, Masaki; et al.","NeuroImage Vol. 210,  (Apr 15, 2020)."
Global effects of feature-based attention depend on surprise,"Smout, Cooper A; Garrido, Marta I; Mattingley, Jason B.","NeuroImage Vol. 215,  (Jul 15, 2020)."
The impact of body posture on intrinsic brain activity: The role of beta power at rest,"Donno, Brunella; Migliorati, Daniele; Zappasodi, Filippo; Perrucci, Mauro Gianni; Costantini, Marcello.","PLoS ONE Vol. 15, Iss. 1,  (Jan 24, 2020)."
Cognitive outcome of early school‐aged children born very preterm is not predicted by early short‐term amplitude‐integrated electroencephalography,"Feldmann, Maria; Rousson, Valentin; Nguyen, Thi Dao; Bernet, Vera; Hagmann, Cornelia; et al.","Acta Paediatrica Vol. 109, Iss. 1,  (Jan 2020): 78-84."
A history of concussion affects relevancy-based modulation of cortical responses to tactile stimuli,"Adams, Meaghan S; Niechwiej-Szwedo, Ewa; McIlroy, William E; Staines, William R.","Frontiers in Integrative Neuroscience Vol. 14,  (Jul 3, 2020)."
Changes in the electroencephalographic activity in response to odors produced by organic compounds,"Kim, Minju; Song, Jieun; Nishi, Kosuke; Sowndhararajan, Kandhasamy; Kim, Songmun.","Journal of Psychophysiology Vol. 34, Iss. 1,  (2020): 35-49."
Stereotactic electroencephalography in humans reveals multisensory signal in early visual and auditory cortices,"Ferraro, Stefania; Van Ackeren, Markus J; Mai, Roberto; Tassi, Laura; Cardinale, Francesco; et al.","Cortex: A Journal Devoted to the Study of the Nervous System and Behavior Vol. 126,  (May 2020): 253-264."
Global EEG coherence as a marker for cognition in older adults at risk for dementia,"Laptinskaya, Daria; Fissler, Patrick; Küster, Olivia Caroline; Wischniowski, Jakob; Thurm, Franka; et al.","Psychophysiology Vol. 57, Iss. 4,  (Apr 2020)."
Multiple constrained minimum variance beamformer (MCMV) performance in connectivity analyses,"Nunes, Adonay S; Moiseev, Alexander; Kozhemiako, Nataliia; Cheung, Teresa; Ribary, Urs; et al.","NeuroImage Vol. 208,  (Mar 2020)."
Auditory categorical processing for speech is modulated by inherent musical listening skills,"Mankel, Kelsey; Barber, Jacob; Bidelman, Gavin M.","NeuroReport: For Rapid Communication of Neuroscience Research Vol. 31, Iss. 2,  (Jan 27, 2020): 162-166."
Seizure aesthetics: Temporal regimes and medical technology in epilepsy diagnosis,"Marathe, Megh.","Time & Society Vol. 29, Iss. 2,  (May 2020): 420-443."
The dynamics of resting-state alpha oscillations predict individual differences in creativity,"Prent, Naomi; Smit, Dirk J. A.","Neuropsychologia Vol. 142,  (May 2020)."
The spectral fingerprint of sleep problems in post-traumatic stress disorder,"de Boer, M; Nijdam, M. J; Jongedijk, R. A; Bangel, K. A; Olff, M; et al.","Sleep: Journal of Sleep and Sleep Disorders Research Vol. 43, Iss. 4,  (Apr 2020): 1-9."
Abnormal beta and gamma frequency neural oscillations mediate auditory sensory gating deficit in schizophrenia,"Nguyen, Ann T; Hetrick, William P; O'Donnell, Brian F; Brenner, Colleen A.","Journal of Psychiatric Research Vol. 124,  (May 2020): 13-21."
The effect of alpha tACS on the temporal resolution of visual perception,"Battaglini, Luca; Mena, Federica; Ghiani, Andrea; Casco, Clara; Melcher, David; et al.","Frontiers in Psychology Vol. 11,  (Jul 31, 2020)."
Electrophysiological correlates of attentional monitoring during a complex driving simulation task,"Gianfranchi, Evelyn; Mento, Giovanni; Duma, Gian Marco; Chierchia, Christian; Sarlo, Michela; et al.","Biological Psychology Vol. 154,  (Jul 2020)."
Cracking the black box: Capturing the role of expectation states in status processes,"Kalkhoff, Will; Melamed, David; Pollock, Josh; Miller, Brennan; Overton, Jon; et al.","Social Psychology Quarterly Vol. 83, Iss. 1,  (Mar 2020): 26-48."
Effect and mechanism of music therapy on neural restoration in patients with epilepsy,"Su, Yue.","Revista Argentina de Clínica Psicológica Vol. 29, Iss. 2,  (Feb 2020): 1493-1499."
Intermittent absence of control during reinforcement learning interferes with Pavlovian bias in action selection,"Csifcsák, Gábor; Melsæter, Eirik; Mittner, Matthias.","Journal of Cognitive Neuroscience Vol. 32, Iss. 4,  (Apr 2020): 646-663."
Circadian rhythms and decision-making: A review and new evidence from electroencephalography,"Correa, Ángel; Alguacil, Sonia; Ciria, Luis F; Jiménez, Ana; Ruz, María.","Chronobiology International Vol. 37, Iss. 4,  (Apr 2020): 520-541."
Neural oscillations and connectivity characterizing the state of tonic experimental pain in humans,"Nickel, Moritz M; Dinh, Son Ta; May, Elisabeth S; Tiemann, Laura; Hohn, Vanessa D; et al.","Human Brain Mapping Vol. 41, Iss. 1,  (Jan 2020): 17-29."
