Title,Authors,Journal
Neurophysiological markers of cognitive deficits and recovery in concussed adolescents,"Ruiter, Kyle I; Boshra, Rober; DeMatteo, Carol; Noseworthy, Michael; Connolly, John F.","Brain Research Vol. 1746,  (Nov 1, 2020)."
Continuous electroencephalographic training for neuroscience intensive care unit nurses: A feasibility study,"Picinich, Christine; Kennedy, Jeffrey; Thind, Harjot; Foreman, Christine; Martin, Ryan M; et al.","Journal of Neuroscience Nursing Vol. 52, Iss. 5,  (Oct 2020): 245-250."
Repeated afternoon sleep recordings indicate first‐night‐effect‐like adaptation process in family dogs,"Reicher, Vivien; Kis, Anna; Simor, Péter; Bódizs, Róbert; Gombos, Ferenc; et al.","Journal of Sleep Research Vol. 29, Iss. 6,  (Dec 2020)."
Prediction of social behavior in autism spectrum disorders: Explicit versus implicit social cognition,"Keifer, Cara M; Mikami, Amori Yee; Morris, James P; Libsack, Erin J; Lerner, Matthew D.","Autism Vol. 24, Iss. 7,  (Oct 2020): 1758-1772."
Neonatal multisensory processing in preterm and term infants predicts sensory reactivity and internalizing tendencies in early childhood,"Maitre, Nathalie L; Key, Alexandra P; Slaughter, James C; Yoder, Paul J; Neel, Mary Lauren; et al.","Brain Topography Vol. 33, Iss. 5,  (Sep 2020): 586-599."
Inter- and intra-individual variability in brain oscillations during sports motor imagery,"Wriessnegger, Selina C; Müller-Putz, Gernot R; Brunner, Clemens; Sburlea, Andreea I.","Frontiers in Human Neuroscience Vol. 14,  (Oct 30, 2020)."
Sleep in pituitary insufficient patients compared to patients with depression and healthy controls at baseline and after challenge with CRH,"Künzel, Heike; Kluge, Michael; Zeising, Marcel; Schopohl, Jochen; Yassouridis, Alexander; et al.","Journal of Psychiatric Research Vol. 129,  (Oct 2020): 124-128."
Neural responses to interpersonal requests: Effects of imposition and vocally-expressed stance,"Vergis, Nikos; Jiang, Xiaoming; Pell, Marc D.","Brain Research Vol. 1740,  (Aug 1, 2020)."
"Too little, too late, and in the wrong place: Alpha band activity does not reflect an active mechanism of selective attention","Antonov, Plamen A; Chakravarthi, Ramakrishna; Andersen, Søren K.","NeuroImage Vol. 219,  (Oct 1, 2020)."
Association between depression and hostile attribution bias in hostile and non-hostile individuals: An ERP study,"Gasse, A; Kim, W. S; Gagnon, J.","Journal of Affective Disorders Vol. 276,  (Nov 1, 2020): 1077-1083."
Intermittent cerebellar theta burst stimulation improves visuo-motor learning in stroke patients: A pilot study,"Bonnì, Sonia; Motta, Caterina; Pellicciari, Maria Concetta; Casula, Elias Paolo; Cinnera, Alex Martino; et al.","The Cerebellum Vol. 19, Iss. 5,  (Oct 2020): 739-743."
Exploring differences between self-report and electrophysiological indices of drowsy driving: A usability examination of a personal brain-computer interface device,"Dunbar, Jerone; Gilbert, Juan E; Lewis, Ben.","Journal of Safety Research Vol. 74,  (Sep 2020): 27-34."
Deficits in auditory predictive coding in individuals with the psychosis risk syndrome: Prediction of conversion to psychosis,"Fryer, Susanna L; Roach, Brian J; Hamilton, Holly K; Bachman, Peter; Belger, Aysenil; et al.","Journal of Abnormal Psychology Vol. 129, Iss. 6,  (Aug 2020): 599-611."
The estradiol synthesis inhibitor formestane diminishes the ability of sevoflurane to induce neurodevelopmental abnormalities in male rats,"Wang, Jie; Yang, Baofeng; Ju, Lingsha; Yang, Jiaojiao; Allen, Andrea; et al.","Frontiers in Systems Neuroscience Vol. 14,  (Sep 4, 2020)."
Repetition attenuates the influence of recency on recognition memory: Behavioral and electrophysiological evidence,"Scofield, John E; Price, Mason H; Flores, Angélica; Merkle, Edgar C; Johnson, Jeffrey D.","Psychophysiology Vol. 57, Iss. 9,  (Sep 2020)."
Cerebellar theta and beta noninvasive stimulation rhythms differentially influence episodic memory versus semantic prediction,"Dave, Shruti; VanHaerents, Stephen; Voss, Joel L.","The Journal of Neuroscience Vol. 40, Iss. 38,  (Sep 16, 2020): 7300-7310."
Feasibility and safety of bilateral hybrid EEG/EOG brain/neural–machine interaction,"Nann, Marius; Peekhaus, Niels; Angerhöfer, Cornelius; Soekadar, Surjo R.","Frontiers in Human Neuroscience Vol. 14,  (Dec 9, 2020)."
Neural dynamics supporting auditory long-term memory effects on target detection,"Zimmermann, Jacqueline; Ross, Bernhard; Moscovitch, Morris; Alain, Claude.","NeuroImage Vol. 218,  (Sep 2020)."
Prior reproductive experience modulates neural responses to infant faces across the postpartum period,"Bunderson, Madison; Diaz, David; Maupin, Angela; Landi, Nicole; Potenza, Marc N; et al.","Social Neuroscience Vol. 15, Iss. 6,  (Dec 2020): 650-654."
Pubertal stress decreases sexual motivation and supresses the relation between cerebral theta rhythms and testosterone levels in adult male rats,"Hernández-Arteaga, Enrique; Hernández-González, Marisela; Bonilla-Jaime, Herlinda; Guevara, Miguel Angel; Ågmo, Anders.","Brain Research Vol. 1745,  (Oct 15, 2020)."
Emotional reactivity and regulation in 5- to 8-year-old children: An ERP study of own-age face processing,"Usler, Evan; Foti, Dan; Weber, Christine.","International Journal of Psychophysiology Vol. 156,  (Oct 2020): 60-68."
Transient amplitude modulation of alpha-band oscillations by short-time intermittent closed-loop tACS,"Zarubin, Georgy; Gundlach, Christopher; Nikulin, Vadim; Villringer, Arno; Bogdan, Martin.","Frontiers in Human Neuroscience Vol. 14,  (Sep 4, 2020)."
"No evidence for a role of spatially modulated α-band activity in tactile remapping and short-latency, overt orienting behavior","Ossandón, José P; König, Peter; Heed, Tobias.","The Journal of Neuroscience Vol. 40, Iss. 47,  (Nov 18, 2020): 9088-9102."
In the absence of visual input: Electrophysiological evidence of infants’ mapping of labels onto auditory objects,"Cosper, Samuel H; Männel, Claudia; Mueller, Jutta L.","Developmental Cognitive Neuroscience Vol. 45,  (Oct 2020)."
Measuring directed functional connectivity using non-parametric directionality analysis: Validation and comparison with non-parametric granger causality,"West, Timothy O; Halliday, David M; Bressler, Steven L; Farmer, Simon F; Litvak, Vladimir.","NeuroImage Vol. 218,  (Sep 2020)."
Sleep and diurnal rest-activity rhythm disturbances in a mouse model of Alzheimer’s disease,"Filon, Mikolaj J; Wallace, Eli; Wright, Samantha; Douglas, Dylan J; Steinberg, Lauren I; et al.","Sleep: Journal of Sleep and Sleep Disorders Research Vol. 43, Iss. 11,  (Nov 2020): 1-11."
Transcranial ultrasound stimulation in humans is associated with an auditory confound that can be effectively masked,"Braun, Verena; Blackmore, Joseph; Cleveland, Robin O; Butler, Christopher R.","Brain Stimulation Vol. 13, Iss. 6,  (Nov 2020 - Dec 2020): 1527-1534."
Phenotypic profiling of mGlu₇ knockout mice reveals new implications for neurodevelopmental disorders,"Fisher, Nicole M; Gould, Robert W; Gogliotti, Rocco G; McDonald, Annalise J; Badivuku, Hana; et al.","Genes, Brain & Behavior Vol. 19, Iss. 7,  (Sep 2020)."
"Food cue-elicited brain potentials change throughout menstrual cycle: Modulation by eating styles, negative affect, and premenstrual complaints","Strahler, J; Hermann, A; Schmidt, N. M; Stark, R; Hennig, J; et al.","Hormones and Behavior Vol. 124,  (Aug 2020)."
Overground walking decreases alpha activity and entrains eye movements in humans,"Cao, Liyu; Chen, Xinyu; Haendel, Barbara F.","Frontiers in Human Neuroscience Vol. 14,  (Dec 22, 2020)."
Aberrant connectivity in auditory precision encoding in schizophrenia spectrum disorder and across the continuum of psychotic-like experiences,"Larsen, Kit Melissa; Dzafic, Ilvana; Darke, Hayley; Pertile, Holly; Carter, Olivia; et al.","Schizophrenia Research Vol. 222,  (Aug 2020): 185-194."
"The effects of direct brain stimulation in humans depend on frequency, amplitude, and white-matter proximity","Mohan, Uma R; Watrous, Andrew J; Miller, Jonathan F; Lega, Bradley C; Sperling, Michael R; et al.","Brain Stimulation Vol. 13, Iss. 5,  (Sep 2020 - Oct 2020): 1183-1195."
Distinct neural mechanisms for reading arabic vs. verbal numbers: An ERP study,"Proverbio, Alice Mado; Bianco, Marco; Benedetto, Francesco.","European Journal of Neuroscience Vol. 52, Iss. 11,  (Dec 2020): 4480-4489."
Motion-onset visual potentials evoked in a sport-specific visuomotor reaction task,"Hülsdünker, Thorben; Ostermann, Martin; Mierau, Andreas.","Journal of Sport & Exercise Psychology Vol. 42, Iss. 4,  (Aug 2020): 280-291."
Exploring the event‐related potentials' time course of associative recognition in autism,"Desaunay, Pierre; Clochon, Patrice; Doidy, Franck; Lambrechts, Anna; Wantzen, Prany; et al.","Autism Research Vol. 13, Iss. 11,  (Nov 2020): 1998-2016."
Heterogeneity in abstract verbs: An ERP study,"Muraki, Emiko J; Cortese, Filomeno; Protzner, Andrea B; Pexman, Penny M.","Brain and Language Vol. 211,  (Dec 2020)."
Using ICD-10 codes to identify elective epilepsy monitoring unit admissions from administrative billing data: A validation study,"Kamitaki, Brad K; Rishty, Shelly; Mani, Ram; Wong, Stephen; Bateman, Lisa M; et al.","Epilepsy & Behavior Vol. 111,  (Oct 2020)."
Frontal alpha asymmetry in schizotypy: Electrophysiological evidence for motivational dysfunction,"Le, Thanh P; Lucas, Heather D; Schwartz, Elana K; Mitchell, Kyle R; Cohen, Alex S.","Cognitive Neuropsychiatry Vol. 25, Iss. 5,  (Sep 2020): 371-386."
Effects of perampanel on secondary bilateral synchrony and behavioral problems in adolescents with epilepsy showing insufficient response with levetiracetam,"Kanemura, Hideaki; Sano, Fumikazu; Hoshino, Hiroki; Takayama, Kazuko; Aihara, Masao.","Seizure: European Journal of Epilepsy Vol. 80,  (Aug 2020): 131-137."
Methylprednisolone pulse therapy in 31 patients with refractory epilepsy: A single-center retrospective analysis,"Kimizu, Tomokazu; Takahashi, Yukitoshi; Oboshi, Taikan; Horino, Asako; Omatsu, Hirowo; et al.","Epilepsy & Behavior Vol. 109,  (Aug 2020)."
Spatiotemporal complexity patterns of resting‐state bioelectrical activity explain fluid intelligence: Sex matters,"Dreszer, Joanna; Grochowski, Marek; Lewandowska, Monika; Nikadon, Jan; Gorgol, Joanna; et al.","Human Brain Mapping Vol. 41, Iss. 17,  (Dec 2020): 4846-4865."
Implicit outcomes expectancies shape memory process: Electrophysiological evidence,"Carmona, Isabel; Ortells, Juan José; Fuentes, Luis J; Kiefer, Markus; Estévez, Angeles F.","Biological Psychology Vol. 157,  (Nov 2020)."
Centroparietal activity mirrors the decision variable when tracking biased and time-varying sensory evidence,"Kohl, Carmen; Spieser, Laure; Forster, Bettina; Bestmann, Sven; Yarrow, Kielan.","Cognitive Psychology Vol. 122,  (Nov 2020)."
Distinguishing vigilance decrement and low task demands from mind‐wandering: A machine learning analysis of EEG,"Jin, Christina Yi; Borst, Jelmer P; van Vugt, Marieke K.","European Journal of Neuroscience Vol. 52, Iss. 9,  (Nov 2020): 4147-4164."
State-dependent and bandwidth-specific effects of ketamine and propofol on electroencephalographic complexity in rats,"Brito, Michael A; Li, Duan; Mashour, George A; Pal, Dinesh.","Frontiers in Systems Neuroscience Vol. 14,  (Aug 11, 2020)."
A neurofeedback protocol for executive function to reduce depression and rumination: A controlled study,"Yu, Sheng-Hsiang; Tseng, Chao-Yuan; Lin, Wei-Lun.","Clinical Psychopharmacology and Neuroscience Vol. 18, Iss. 3,  (Aug 2020): 375-385."
Changes in electroencephalography and cardiac autonomic function during craft activities: Experimental evidence for the effectiveness of occupational therapy,"Shiraiwa, Keigo; Yamada, Sumie; Nishida, Yurika; Toichi, Motomi.","Frontiers in Human Neuroscience Vol. 14,  (Dec 11, 2020)."
Testing the ‘seizure scaffold’: What can experimental simulation tell us about functional seizures?,"Tiefenbach, Jakov; Cox, Emily R; Paterson, Mhairi; Iannoukos, Denis; Scott, Shona; et al.","Epilepsy & Behavior Vol. 113,  (Dec 2020)."
The state of memory-matched distractor in working memory influence the visual attention,"Long, Quanshan; Luo, Ting; Zhang, Sheng; Jiang, Yuanling; Hu, Na; et al.","PLoS ONE Vol. 15, Iss. 12,  (Dec 1, 2020)."
Slow electroencephalographic oscillations and behavioral measures as predictors of high executive processing in early postmenopausal females: A discriminant analysis approach,"Solís-Ortiz, Silvia; González-Pérez, Erika G.","Brain and Cognition Vol. 145,  (Nov 2020)."
The effect of sleep-need and time-on-task on driver fatigue,"Zeller, Rainer; Williamson, Ann; Friswell, Rena.","Transportation Research Part F: Traffic Psychology and Behaviour Vol. 74,  (Oct 2020): 15-29."
Effect of highway directional signs on driver mental workload and behavior using eye movement and brain wave,"Yang, Yanqun; Chen, Yubin; Wu, Changxu; Easa, Said. M; Lin, Wei; et al.","Accident Analysis and Prevention Vol. 146,  (Oct 2020)."
Effects of transcranial direct current stimulation over the dorsolateral prefrontal cortex (PFC) on cognitive-motor dual control skills,"Lee, JaeHyuk; Dong, SungHee; Jeong, JiChai; Yoon, BumChul.","Perceptual and Motor Skills Vol. 127, Iss. 5,  (Oct 2020): 803-822."
What does temporal brain signal complexity reveal about verbal creativity?,"Kaur, Yadwinder; Ouyang, Guang; Sommer, Werner; Weiss, Selina; Zhou, Changsong; et al.","Frontiers in Behavioral Neuroscience Vol. 14,  (Aug 27, 2020)."
High‐gamma oscillations precede visual steady‐state responses: A human electrocorticography study,"Wittevrongel, Benjamin; Khachatryan, Elvira; Carrette, Evelien; Boon, Paul; Meurs, Alfred; et al.","Human Brain Mapping Vol. 41, Iss. 18,  (Dec 15, 2020): 5341-5355."
Physiological correlates of subjective emotional valence and arousal dynamics while viewing films,"Sato, Wataru; Kochiyama, Takanori; Yoshikawa, Sakiko.","Biological Psychology Vol. 157,  (Nov 2020)."
Effects of one-pedal automobile operation on the driver's emotional state and cognitive workload,"Sugimoto, Fumie; Kimura, Motohiro; Takeda, Yuji; Akamatsu, Motoyuki; Kitazaki, Satoshi; et al.","Applied Ergonomics Vol. 88,  (Oct 2020)."
Contextual source information modulates neural face processing in the absence of conscious recognition: A threat-of-shock study,"Schellhaas, Sabine; Arnold, Nina; Schmahl, Christian; Bublatzky, Florian.","Neurobiology of Learning and Memory Vol. 174,  (Oct 2020)."
Executive dysfunction in medication-naïve children with ADHD: A multi-modal fNIRS and EEG study,"Kaga, Yoshimi; Ueda, Riyo; Tanaka, Miho; Kita, Yosuke; Suzuki, Kota; et al.","Brain & Development Vol. 42, Iss. 8,  (Sep 2020): 555-563."
Sensitivity and specificity of induction of psychogenic non-epileptic seizures in children and adolescents,"Kaczmarek, Izabela; Starczewska, Monika; Wiktor, Anna Winczewska-; Steinborn, Barbara.","Seizure: European Journal of Epilepsy Vol. 80,  (Aug 2020): 278-280."
EEG gamma activity to emotional movies in individuals with high traits of primary “successful” psychopathy,"Maffei, Antonio; Polver, Silvia; Spironelli, Chiara; Angrilli, Alessandro.","Brain and Cognition Vol. 143,  (Aug 2020)."
Electrophysiological correlates of the continued influence effect of misinformation: An exploratory study,"Brydges, Christopher R; Gordon, Andrew; Ecker, Ullrich K. H.","Journal of Cognitive Psychology Vol. 32, Iss. 8,  (Dec 2020): 771-784."
"Imagery‐induced negative affect, social touch and frontal EEG power band activity","Kraus, Jakub; Roman, Robert; Lacinová, Lenka; Lamoš, Martin; Brázdil, Milan; et al.","Scandinavian Journal of Psychology Vol. 61, Iss. 6,  (Dec 2020): 731-739."
Individual differences in negative emotion differentiation predict resting-state spontaneous emotional regulatory processes,"Wang, Yali; Shangguan, Chenyu; Gu, Chuanhua; Hu, Biying.","Frontiers in Psychology Vol. 11,  (Nov 10, 2020)."
Association of epileptiform abnormalities and seizures in Alzheimer disease,"Lam, Alice D; Sarkis, Rani A; Pellerin, Kyle R; Jing, Jin; Dworetzky, Barbara A; et al.","Neurology Vol. 95, Iss. 16,  (Oct 20, 2020): e2259-e2270."
Reduced flanker P300 prospectively predicts increases in depression in female adolescents,"Santopetro, Nicholas J; Kallen, Alexander M; Threadgill, A. Hunter; Hajcak, Greg.","Biological Psychology Vol. 156,  (Oct 2020)."
A backward encoding approach to recover subcortical auditory activity,"Schmidt, Fabian; Demarchi, Gianpaolo; Geyer, Florian; Weisz, Nathan.","NeuroImage Vol. 218,  (Sep 2020)."
Cultural relevance reduces the enhanced neural processing of positively valenced information in older adults,"Gong, Xianmin; Fung, Helene H; Zeng, Ginger Qinghong; Tse, Chun-Yu.","The Journals of Gerontology: Series B: Psychological Sciences and Social Sciences Vol. 75, Iss. 10,  (Dec 2020): 2075-2085."
Serotonergic system may be involved in alterations of sleep homeostasis in spontaneously hypertensive rats,"Cui, Su‐Ying; Huang, Yuan‐Li; Cui, Xiang‐Yu; Zhao, Hui‐Ling; Hu, Xiao; et al.","Journal of Sleep Research Vol. 29, Iss. 6,  (Dec 2020)."
Atypical visual-auditory predictive coding in autism spectrum disorder: Electrophysiological evidence from stimulus omissions,"van Laarhoven, Thijs; Stekelenburg, Jeroen J; Eussen, Mart L. J. M; Vroomen, Jean.","Autism Vol. 24, Iss. 7,  (Oct 2020): 1849-1859."
Responses to visual speech in human posterior superior temporal gyrus examined with iEEG deconvolution,"Metzger, Brian A; Magnotti, John F; Wang, Zhengjia; Nesbitt, Elizabeth; Karas, Patrick J; et al.","The Journal of Neuroscience Vol. 40, Iss. 36,  (Sep 2, 2020): 6938-6948."
Stimulus valence influences the evaluative processing of action outcome,"Ishii, Chikara; Katayama, Jun'ichi.","NeuroReport: For Rapid Communication of Neuroscience Research Vol. 31, Iss. 11,  (Aug 5, 2020): 840-844."
In pursuit of visual attention: SSVEP frequency-tagging moving targets,"de Lissa, Peter; Caldara, Roberto; Nicholls, Victoria; Miellet, Sebastien.","PLoS ONE Vol. 15, Iss. 8,  (Aug 4, 2020)."
Neural association between non‐verbal number sense and arithmetic fluency,"Li, Mengyi; Cheng, Dazhi; Lu, Yujie; Zhou, Xinlin.","Human Brain Mapping Vol. 41, Iss. 18,  (Dec 15, 2020): 5128-5140."
Using fixation-related potentials for inspecting natural interactions,"Wobrock, Dennis; Finke, Andrea; Schack, Thomas; Ritter, Helge.","Frontiers in Human Neuroscience Vol. 14,  (Nov 5, 2020)."
Special considerations in the assessment of catastrophic brain injury and determination of brain death in patients with SARS-CoV-2,"Valdes, Eduard; Agarwal, Shashank; Carroll, Elizabeth; Kvernland, Alexandra; Bondi, Steven; et al.","Journal of the Neurological Sciences Vol. 417,  (Oct 15, 2020)."
Unskilled shooters improve both accuracy and grouping shot having as reference skilled shooters cortical area: An EEG and tDCS study,"Rocha, Kaline; Marinho, Victor; Magalhães, Francisco; Carvalho, Valécia; Fernandes, Thayaná; et al.","Physiology & Behavior Vol. 224,  (Oct 1, 2020)."
Context facilitation in text reading: A study of children’s eye movements,"Tiffin-Richards, Simon P; Schroeder, Sascha.","Journal of Experimental Psychology: Learning, Memory, and Cognition Vol. 46, Iss. 9,  (Sep 2020): 1701-1713."
Human brain dynamics reflect the correctness and presentation modality of physics concept memory retrieval,"Liang, Chih-Ping; She, Hsiao-Ching; Huang, Li-Yu; Chou, Wen-Chi; Chen, Sheng-Chang; et al.","Frontiers in Human Neuroscience Vol. 14,  (Aug 31, 2020)."
Parafoveal‐on‐foveal repetition effects in sentence reading: A co‐registered eye‐tracking and electroencephalogram study,"Mirault, Jonathan; Yeaton, Jeremy; Broqua, Fanny; Dufau, Stéphane; Holcomb, Phillip J; et al.","Psychophysiology Vol. 57, Iss. 8,  (Aug 2020)."
"Preparatory ERPs in visual, auditory, and somatosensory discriminative motor tasks","Bianco, Valentina; Berchicci, Marika; Livio Perri, Rinaldo; Quinzi, Federico; Mussini, Elena; et al.","Psychophysiology Vol. 57, Iss. 12,  (Dec 2020)."
Slow‐wave activity preceding the onset of 10–15‐Hz sleep spindles and 5–9‐Hz oscillations in electroencephalograms in rats with and without absence seizures,"Sitnikova, Evgenia; Grubov, Vadim; Hramov, Alexander E.","Journal of Sleep Research Vol. 29, Iss. 6,  (Dec 2020)."
A stacked sparse auto-encoder and back propagation network model for sensory event detection via a flexible ECoG,"Idowu, Oluwagbenga Paul; Huang, Jianping; Zhao, Yang; Samuel, Oluwarotimi William; Yu, Mei; et al.","Cognitive Neurodynamics Vol. 14, Iss. 5,  (Oct 2020): 591-607."
Constitutive deletion of astrocytic connexins aggravates kainate‐induced epilepsy,"Deshpande, Tushar; Li, Tingsong; Henning, Lukas; Wu, Zhou; Müller, Julia; et al.","Glia Vol. 68, Iss. 10,  (Oct 2020): 2136-2147."
Decreased alertness reconfigures cognitive control networks,"Canales-Johnson, Andrés; Beerendonk, Lola; Blain, Salome; Kitaoka, Shin; Ezquerro-Nassar, Alejandro; et al.","The Journal of Neuroscience Vol. 40, Iss. 37,  (Sep 9, 2020): 7142-7154."
Slow repetitive transcranial magnetic stimulation in refractory juvenile myoclonic epilepsies,"Özek, Sibel Üstün; Gürses, Candan; Bebek, Nerses; Baykan, Betül; Gökyiğit, Ayşen; et al.","Epilepsy & Behavior Vol. 112,  (Nov 2020)."
"Age-related changes in selection, recognition, updating and maintenance information in WM. An ERP study in children and adolescents","Pelegrina, Santiago; Molina, Rosa; Rodríguez-Martínez, Elena I; Linares, Rocío; Gómez, Carlos M.","Biological Psychology Vol. 157,  (Nov 2020)."
"N-Back related ERPs depend on stimulus type, task structure, pre-processing, and lab factors","Shalchy, Mahsa Alizadeh; Pergher, Valentina; Pahor, Anja; Van Hulle, Marc M; Seitz, Aaron R.","Frontiers in Human Neuroscience Vol. 14,  (Oct 28, 2020)."
Response inhibition in the task-switching paradigm,"Liu, Hailan; Zhang, Qin.","Biological Psychology Vol. 156,  (Oct 2020)."
Sleep in highly automated driving: Takeover performance after waking up,"Wörle, Johanna; Metz, Barbara; Othersen, Ina; Baumann, Martin.","Accident Analysis and Prevention Vol. 144,  (Sep 2020)."
Neurons of the ventral tegmental area encode individual differences in motivational “wanting” for reward cues,"Ferguson, Lindsay M; Ahrens, Allison M; Longyear, Lauren G; Aldridge, J. Wayne.","The Journal of Neuroscience Vol. 40, Iss. 46,  (Nov 11, 2020): 8951-8963."
Corollary discharge versus efference copy: Distinct neural signals in speech preparation differentially modulate auditory responses,"Li, Siqi; Zhu, Hao; Tian, Xing.","Cerebral Cortex Vol. 30, Iss. 11,  (Nov 2020): 5806-5820."
Neurophysiological characteristics of patients with juvenile schizophrenia at the late follow-up stage,"Lebedeva, I. S; Golubev, S. A; Klochkova, I. V; Kaleda, V. G.","Neuroscience and Behavioral Physiology Vol. 50, Iss. 9,  (Nov 2020): 1140-1145."
Evidence accumulation during perceptual decision-making is sensitive to the dynamics of attentional selection,"Rangelov, Dragan; Mattingley, Jason B.","NeuroImage Vol. 220,  (Oct 15, 2020)."
PSPH-D-18-00526: Effect of a dual orexin receptor antagonist (DORA-12) on sleep and event-related oscillations in rats exposed to ethanol vapor during adolescence,"Ehlers, Cindy L; Benedict, Jessica; Wills, Derek; Sanchez-Alavez, Manuel.","Psychopharmacology Vol. 237, Iss. 10,  (Oct 2020): 2917-2927."
BCI-based rehabilitation on the stroke in sequela stage,"Miao, Yangyang; Chen, Shugeng; Zhang, Xinru; Jin, Jing; Xu, Ren; et al.","Neural Plasticity Vol. 2020,  (Dec 14, 2020)."
Pain avoidance and its relation to neural response to punishment characterizes suicide attempters with Major Depression Disorder,"Song, Wei; Li, Huanhuan; Sun, Fang; Guo, Ting; Jiang, Songyuan; et al.","Psychiatry Research Vol. 294,  (Dec 2020)."
Distraction and expressive suppression strategies in down-regulation of high- and low-intensity positive emotions,"Li, Ping; Zhu, Chuanlin; Leng, Yexi; Luo, Wenbo.","International Journal of Psychophysiology Vol. 158,  (Dec 2020): 56-61."
The relationship between exercise intensity and neurophysiological responses to food stimuli in women: A randomized crossover event-related potential (ERP) study,"Carbine, Kaylie A; Anderson, Jillesa; Larson, Michael J; LeCheminant, James D; Bailey, Bruce W.","International Journal of Psychophysiology Vol. 158,  (Dec 2020): 349-361."
Mindfulness meditation alters neural activity underpinning working memory during tactile distraction,"Wang, Michael Yufeng; Freedman, Gabrielle; Raj, Kavya; Fitzgibbon, Bernadette Mary; Sullivan, Caley; et al.","Cognitive, Affective & Behavioral Neuroscience Vol. 20, Iss. 6,  (Dec 2020): 1216-1233."
A direct comparison of the electrophysiological effects of transcranial direct and alternating current stimulation in healthy subjects,"Kim, Jiheon; Jang, Kuk-In; Roh, Daeyoung; Kim, Hansol; Kim, Do Hoon.","Brain Research Vol. 1747,  (Nov 15, 2020)."
Neural dynamics of the combined discounting of delay and probability during the evaluation of a delayed risky reward,"Wang, Guangrong; Li, Jianbiao; Li, Shuaiqi; Zhu, Chengkang.","Frontiers in Psychology Vol. 11,  (Sep 29, 2020)."
"Cholinergic dysfunction, neurodegeneration, and amyloid-beta pathology in neurodegenerative diseases","Petrova, Teodora; Orellana, Camila; Jelic, Vesna; Oeksengaard, Anne-Rita; Snaedal, Jon; et al.","Psychiatry Research: Neuroimaging Vol. 302,  (Aug 30, 2020)."
Do nociceptive stimulation intensity and temporal predictability influence pain-induced corticospinal excitability modulation?,"Neige, Cécilia; Brun, Clémentine; Gagné, Martin; Bouyer, Laurent J; Mercier, Catherine.","NeuroImage Vol. 216,  (Aug 1, 2020)."
Attentional modulation of unconscious inhibitory visuomotor processes: An EEG study,"Wang, Yongchun; Di, Meilin; Zhao, Jingjing; Hu, Saisai; Yao, Zhao; et al.","Psychophysiology Vol. 57, Iss. 8,  (Aug 2020)."
