Title,Authors,Journal
I endeavor to make it: Effort increases valuation of subsequent monetary reward,"Ma, Qingguo; Meng, Liang; Wang, Lei; Shen, Qiang.","Behavioural Brain Research Vol. 261,  (Mar 2014): 1-7."
Cortical Activity during Perception of Musical Rhythm; Comparing Musicians and Non-musicians.,"Habibi, Assal; Wirantana, Vinthia; Starr, Arnold; National Library of Medicine.","Psychomusicology Vol. 24, Iss. 2,  (June 1, 2014): 125-135."
Clinical workout for the early detection of cognitive decline and dementia,"Tsolaki, M.","European Journal of Clinical Nutrition; London Vol. 68, Iss. 11,  (Nov 2014): 1186-1191."
Investigation of global and local network properties of music perception with culturally different styles of music,"Li, Yan; Rui, Xue; Li, Shuyu; Pu, Fang.","Computers in Biology and Medicine Vol. 54,  (Nov 2014): 37-43."
How about watching others? Observation of error-related feedback by others in autism spectrum disorders,"Clawson, Ann; Clayson, Peter E; Worsham, Whitney; Johnston, Oliver; South, Mikle; et al.","International Journal of Psychophysiology Vol. 92, Iss. 1,  (Apr 1, 2014): 26-34."
Understanding age-related reductions in visual working memory capacity: Examining the stages of change detection,"Ko, Philip C; Duda, Bryant; Hussey, Erin; Mason, Emily; Molitor, Robert J; et al.","Attention, Perception, & Psychophysics Vol. 76, Iss. 7,  (Oct 2014): 2015-2030."
Is faster better? Effects of response deadline on ERP correlates of recognition memory in younger and older adults,"Scheuplein, Anna-Lena; Bridger, Emma K; Mecklinger, Axel.","Brain Research Vol. 1582,  (Sep 25, 2014): 139-153."
Attention-based modulation of tactile stimuli: A comparison between prefrontal lesion patients and healthy age-matched controls,"Bolton, David A. E; Staines, W. Richard.","Neuropsychologia Vol. 57,  (May 2014): 101-111. [Duplicate]"
EEG-based assessment of interest in video clips using a single-stimulus probe method,"Miki, Shigeto; Nittono, Hiroshi.","Japanese Journal of Physiological Psychology and Psychophysiology Vol. 32, Iss. 1,  (Apr 2014): 1-10."
Neuronal Correlates of a Virtual-Reality-Based Passive Sensory P300 Network,"Chun-Chuan, Chen; Kai-Syun Syue; Li, Kai-Chiun; Shih-Ching Yeh.","PLoS One; San Francisco Vol. 9, Iss. 11,  (Nov 2014): e112228."
Development of auditory event-related potentials in infants prenatally exposed to methadone,"Paul, Jonathan A; Logan, Beth A; Krishnan, Ramesh; Heller, Nicole A; Morrison, Deborah G; et al.","Developmental Psychobiology Vol. 56, Iss. 5,  (Jul 2014): 1119-1128."
Power corrupts co-operation: Cognitive and motivational effects in a double EEG paradigm,"Kanso, Riam; Hewstone, Miles; Hawkins, Erin; Waszczuk, Monika; Nobre, Anna Christina.","Social Cognitive and Affective Neuroscience Vol. 9, Iss. 2,  (Feb 2014): 218-224."
Neural adaptation to non-symbolic number and visual shape: An electrophysiological study,"Soltesz, Fruzsina; Szuecs, Denes.","Biological Psychology Vol. 103,  (Dec 1, 2014): 203-211."
Brain signatures of reward-dependent bias in visual attention,"Wiegand, Iris; Nielsen, Carsten; Petersen, Anders; Dyrholm, Mads; Bundesen, Claus.","Journal of Vision Vol. 14, Iss. 10,  (August 2014)."
Wavelet Decomposition-Based Analysis of Mismatch Negativity Elicited by a Multi-Feature Paradigm,"Najafi-Koopaie, M; Sadjedi, H; Mahmoudian, S; Farahani, ED; Mohebbi, M.","Neurophysiology Vol. 46, Iss. 4,  (Aug 2014): 361-369."
Decreased spectral entropy modulation in patients with schizophrenia during a P300 task,"Bachiller, Alejandro; Díez, Alvaro; Suazo, Vanessa; Domínguez, Cristina; Ayuso, Marta; et al.","European Archives of Psychiatry and Clinical Neuroscience Vol. 264, Iss. 6,  (Sep 2014): 533-543."
Oddball distractors demand attention: Neural and behavioral responses to predictability in the flanker task,"Noyce, Abigail; Sekuler, Robert.","Neuropsychologia Vol. 65,  (Dec 1, 2014): 18-24."
"The Relationship between Dehydroepiandrosterone (DHEA), Working Memory and Distraction – A Behavioral and Electrophysiological Approach","Sónia do Vale; Selinger, Lenka; João Martin Martins; Ana Coelho Gomes; Bicho, Manuel; et al.","PLoS One; San Francisco Vol. 9, Iss. 8,  (Aug 2014): e104869."
Distinguishing lexical- versus discourse-level processing using event-related potentials,"Huang, Yi; Hopfinger, Joseph; Gordon, Peter.","Memory & Cognition Vol. 42, Iss. 2,  (Feb 1, 2014): 275-291."
Head start for target language in bilingual listening,"FitzPatrick, Ian; Indefrey, Peter.","Brain Research Vol. 1542,  (Jan 2014): 111-130."
Single-Trial Classification of Event-Related Potentials in Rapid Serial Visual Presentation Tasks Using Supervised Spatial Filtering,"Cecotti, Hubert; Eckstein, Miguel P; Giesbrecht, Barry.","IEEE Transactions on Neural Networks and Learning Systems Vol. 25, Iss. 11,  (Nov 2014): 2030-2042."
Differences in the Efficiency of Pattern Encoding in Relation to Autistic-Like Traits: An Event-Related Potential Study,"Takahashi, Junichi; Yasunaga, Daichi; Gyoba, Jiro.","Journal of Autism and Developmental Disorders Vol. 44, Iss. 11,  (Nov 2014): 2895-2907."
sLORETA current source density analysis of evoked potentials for spatial updating in a virtual navigation task,"Nguyen, Hai Minh; Matsumoto, Jumpei; Tran, Anh Hai; Ono, Taketoshi; Nishijo, Hisao.","Frontiers in Behavioral Neuroscience; Lausanne (Mar 4, 2014)."
Using auditory pre-information to solve the cocktail-party problem: electrophysiological evidence for age-specific differences,"Getzmann, Stephan; Lewald, Jörg; Falkenstein, Michael.","Frontiers in Neuroscience; Lausanne (Dec 10, 2014)."
Efficiency of Conscious Access Improves with Coupling of Slow and Fast Neural Oscillations,"Nakatani, Chie; Raffone, Antonino; van Leeuwen, Cees.","Journal of Cognitive Neuroscience Vol. 26, Iss. 5,  (May 2014): 1168."
Neurophysiological correlates of visuo-motor learning through mental and physical practice,"Allami, Nadia; Brovelli, Andrea; Hamzaoui, El Mehdi; Regragui, Fakhita; Paulignan, Yves; et al.","Neuropsychologia Vol. 55,  (Mar 1, 2014): 6-14. [Duplicate]"
Dissociable Neural Correlates of Intention and Action Preparation in Voluntary Task Switching,"Poljac, Edita; Yeung, Nick.","Cerebral Cortex Vol. 24, Iss. 2,  (February 2014): 465-478."
Sequential inhibitory control processes assessed through simultaneous EEG-fMRI,"Baumeister, Sarah; Hohmann, Sarah; Wolf, Isabella; Plichta, Michael M; Rechtsteiner, Stefanie; et al.","NeuroImage Vol. 94,  (Jul 2014): 349-359."
Beyond the N400: Complementary access to early neural correlates of novel metaphor comprehension using combined electrophysiological and haemodynamic measurements,"Schneider, Sabrina; Rapp, Alexander M; Haeusinger, Florian B; Ernst, Lena H; Hamm, Friedrich; et al.","Cortex Vol. 53,  (Apr 1, 2014): 45-59."
Different colors of light lead to different adaptation and activation as determined by high-density EEG,"Muench, M; Plomp, G; Thunell, E; Kawasaki, A; Scartezzini, J L; et al.","NeuroImage Vol. 101,  (November 2014): 547-554."
Agency and Ownership are Independent Components of 'Sensing the Self' in the Auditory-Verbal Domain,"Hubl, Daniela; Schneider, Rahel C; Kottlow, Mara; Kindler, Jochen; Strik, Werner; et al.","Brain Topography Vol. 27, Iss. 5,  (Sep 2014): 672-682."
Bayesian estimation of ERP components from multicondition and multichannel EEG,"Wu, Wei; Wu, Chaohua; Gao, Shangkai; Liu, Baolin; Li, Yuanqing; et al.","NeuroImage Vol. 88,  (Mar 2014): 319-339."
Abnormal semantic processing in females with fragile X-associated tremor/ataxia syndrome,"Yang, J-C; Simon, C; Schneider, A; Seritan, AL; Hamilton, L; et al.","Genes, Brain and Behavior Vol. 13, Iss. 2,  (Feb 2014): 152-162."
Orthographic Recognition in Late Adolescents: An Assessment Through Event-Related Brain Potentials,"Gonzalez-Garrido, Andres Antonio; Gomez-Velazquez, Fabiola Reveca; Rodriguez-Santillan, Elizabeth.","Clinical EEG and Neuroscience Vol. 45, Iss. 2,  (2014): 113."
Three stages of emotional word processing: An ERP study with rapid serial visual presentation,"Zhang, Dandan; He, Weiqi; Wang, Ting; Luo, Wenbo; Zhu, Xiangru; et al.","Social Cognitive and Affective Neuroscience Vol. 9, Iss. 12,  (Dec 2014): 1897-1903."
Two-character Chinese compound word processing in Chinese children with and without dyslexia: ERP evidence,"Tong, Xiuhong; Chung, Kevin Kien Hoa; McBride, Catherine.","Developmental Neuropsychology Vol. 39, Iss. 4,  (May 2014): 285-301."
The neural basis of belief updating and rational decision making,"Achtziger, Anja; Alós-Ferrer, Carlos; Hügelschäfer, Sabine; Steinhauser, Marco.","Social Cognitive and Affective Neuroscience Vol. 9, Iss. 1,  (Jan 2014): 55-62."
Time-frequency analysis of the event-related potentials associated with the Stroop test,"Ergen, Mehmet; Saban, Sara; Kirmizi-Alsan, Elif; Uslu, Atilla; Keskin-Ergen, Yasemin; et al.","International Journal of Psychophysiology Vol. 94, Iss. 3,  (Dec 1, 2014): 463-472."
Rapid mental fatigue amplifies age-related attentional deficits,"Wascher, Edmund; Getzmann, Stephan.","Journal of Psychophysiology Vol. 28, Iss. 3,  (2014): 215-224."
How vertical hand movements impact brain activity elicited by literally and metaphorically related words: an ERP study of embodied metaphor,"Bardolph, Megan; Coulson, Seana.","Frontiers in Human Neuroscience; Lausanne (Dec 23, 2014)."
Spatiotemporal Dynamics of Online Motor Correction Processing Revealed by High-density Electroencephalography,"Dipietro, Laura; Poizner, Howard; Krebs, Hermano I.","Journal of Cognitive Neuroscience Vol. 26, Iss. 9,  (Sep 2014): 1966."
EEG study on affective valence elicited by novel and familiar pictures using ERD/ERS and SVM-RFE,"Hidalgo-Munoz, A R; Lopez, M M; Galvao-Carmona, A; Pereira, A T; Santos, I M; et al.","Medical & Biological Engineering & Computing Vol. 52, Iss. 2,  (Feb 2014): 149-158."
Disrupted Gamma-Band Neural Oscillations During Coherent Motion Perception in Heavy Cannabis Users,"Skosnik, Patrick D; Krishnan, Giri P; D'Souza, Deepak C; Hetrick, William P; O'Donnell, Brian F.","Neuropsychopharmacology Vol. 39, Iss. 13,  (Dec 2014): 3087-3099."
Oscillatory Responses to Semantic and Syntactic Violations,"Kielar, Aneta; Meltzer, Jed A; Moreno, Sylvain; Alain, Claude; Bialystok, Ellen.","Journal of Cognitive Neuroscience Vol. 26, Iss. 12,  (Dec 2014): 2840."
Using neuroimaging to understand the cortical mechanisms of auditory selective attention,"Lee, Adrian; Larson, Eric; Maddox, Ross; Shinn-Cunningham, Barbara.","Hearing Research Vol. 307,  (Jan 1, 2014): 111-120."
Cortical indices of sound localization mature monotonically in early infancy,"Slugocki, Christopher; Trainor, Laurel J.","European Journal of Neuroscience Vol. 40, Iss. 11,  (Dec 2014): 3608-3619."
Neuromodulation Integrating rTMS and Neurofeedback for the Treatment of Autism Spectrum Disorder: An Exploratory Study,"Sokhadze, Estate M; El-Baz, Ayman S; Tasman, Allan; Sears, Lonnie L; Wang, Yao; et al.","Applied Psychophysiology and Biofeedback Vol. 39, Iss. 3-4,  (Dec 2014): 237-257."
In search of a reliable electrophysiological marker of oculomotor inhibition of return,"Satel, Jason; Hilchey, Matthew D; Wang, Zhiguo; Reiss, Caroline S; Klein, Raymond M.","Psychophysiology Vol. 51, Iss. 10,  (Oct 2014): 1037-1045."
Event-related potentials show that semantic relations between objects are computed even under change blindness,"Ball, Felix; Busch, Niko.","Journal of Vision Vol. 14, Iss. 10,  (August 2014)."
N450 as a candidate neural marker for interference control deficits in children with learning disabilities,"Liu, Chunlei; Yao, Ru; Wang, Zuowei; Zhou, Renlai.","International Journal of Psychophysiology Vol. 93, Iss. 1,  (Jul 1, 2014): 70-77."
Risk assessment and reward processing in problem gambling investigated by event-related potentials and fMRI-constrained source analysis,"Miedl, Stephan F; Fehr, Thorsten; Herrmann, Manfred; Meyer, Gerhard.","BMC Psychiatry Vol. 14, Iss. 1,  (2014): 229."
Redefining the diagnostic (and prognostic) criteria for the vegetative state,"Young, B; Owen, A.","Canadian Journal of Neurological Sciences Vol. 41, Iss. 3,  (May 2014): S33."
Crosslinking EEG time-frequency decomposition and fMRI in error monitoring,"Hoffmann, Sven; Labrenz, Franziska; Themann, Maria; Wascher, Edmund; Beste, Christian.","Brain Structure and Function Vol. 219, Iss. 2,  (Mar 2014): 595-605."
"Gamma band activity and the P3 reflect post-perceptual processes, not visual awareness","Pitts, Michael A; Padwal, Jennifer; Fennelly, Daniel; Martinez, Antigona; Hillyard, Steven A.","NeuroImage Vol. 101,  (November 2014): 337-350."
Human EEG Uncovers Latent Generalizable Rule Structure during Learning,"Collins, Anne G E; Cavanagh, James F; Frank, Michael J.","Journal of Neuroscience Vol. 34, Iss. 13,  (March 26, 2014): 4677-4685."
Neurophysiological evidence for the country-of-origin effect: An event-related potential study,"Min, Byoung-Kyong; Cho, Kwangsu; Sung, Jungyeon; Cho, Erin.","NeuroReport: For Rapid Communication of Neuroscience Research Vol. 25, Iss. 4,  (Mar 5, 2014): 274-278."
Attention bias in earthquake-exposed survivors: An event-related potential study,"Zhang, Yan; Kong, Fanchang; Han, Li; Hasan, Abbasi Najam ul; Chen, Hong.","International Journal of Psychophysiology Vol. 94, Iss. 3,  (Dec 1, 2014): 358-364."
Refining the picture of reduced alerting responses in ADHD - A single-trial analysis of event-related potentials,"Heinrich, Hartmut; Busch, Katrin; Studer, Petra; Erbe, Karlheinz; Moll, Gunther H; et al.","Neuroscience Letters Vol. 582,  (Oct 17, 2014): 49-53."
Differential familiarity effects in amodal completion: Support from behavioral and electrophysiological measurements,"Hazenberg, Simon J; Jongsma, Marijtje L A; Koning, Arno; van Lier, Rob.","Journal of Experimental Psychology: Human Perception and Performance Vol. 40, Iss. 2,  (Apr 2014): 669."
Combat veterans with PTSD after mild TBI exhibit greater ERPs from posterior-medial cortical areas while appraising facial features,"Shu, I-Wei; Onton, Julie; Prabhakar, Nitin; O'Connell, Ryan; Simmons, Alan; et al.","Journal of Affective Disorders Vol. 155,  (Feb 1, 2014): 234-240."
Differential Task Effects on N400 and P600 Elicited by Semantic and Syntactic Violations,"Schacht, Annekathrin; Sommer, Werner; Shmuilovich, Olga; Pilar Casado Martíenz; Martín-Loeches, Manuel.","PLoS One; San Francisco Vol. 9, Iss. 3,  (Mar 2014): e91226."
Face the Hierarchy: ERP and Oscillatory Brain Responses in Social Rank Processing,"Breton, Audrey; Jerbi, Karim; Marie-Anne Henaff; Cheylus, Anne; Baudouin, Jean-Yves; et al.","PLoS One; San Francisco Vol. 9, Iss. 3,  (Mar 2014): e91451."
The motor cost of telling lies: Electrocortical signatures and personality foundations of spontaneous deception,"Panasiti, Maria Serena; Pavone, Enea F; Mancini, Alessandra; Merla, Arcangelo; Grisoni, Luigi; et al.","Social Neuroscience Vol. 9, Iss. 6,  (Nov 2, 2014): 573-589."
The dorsal medial frontal cortex mediates automatic motor inhibition in uncertain contexts: Evidence from combined fMRI and EEG studies,"Albares, Marion; Lio, Guillaume; Criaud, Marion; Anton, Jean-Luc; Desmurget, Michel; et al.","Human Brain Mapping Vol. 35, Iss. 11,  (Nov 2014): 5517-5531."
Looking for a face in the crowd: Fixation-related potentials in an eye-movement visual search task,"Kaunitz, Lisandro N; Kamienkowski, Juan E; Varatharajah, Alexander; Sigman, Mariano; Quiroga, Rodrigo Quian; et al.","NeuroImage Vol. 89,  (April 2014): 297-305."
Neurofeedback training for peak performance,"Graczyk, Marek; Pąchalska, Maria; Ziółkowski, Artur; Mańko, Grzegorz; Łukaszewska, Beata; et al.","Annals of Agricultural and Environmental Medicine; Lublin Vol. 21, Iss. 4,  (2014): 871-875."
Unidirectional switch-costs in oculomotor control are a result of a stimulus-response updating: Evidence from electroencephalography,"Weiler, Jeff; Hassall, Cameron; Krigolson, Olave; Heath, Matthew.","Journal of Vision Vol. 14, Iss. 10,  (August 2014)."
ERP abnormalities elicited by word repetition in fragile X-associated tremor/ataxia syndrome (FXTAS) and amnestic MCI,"Yang, Jin-Chen; Chi, Lillian; Teichholtz, Sara; Schneider, Andrea; Nanakul, Rawi; et al.","Neuropsychologia Vol. 63,  (Oct 1, 2014): 34-42."
PO-0804Cognition In Children With Attention Deficit Hyperactivity Disorder (adhd),"Rusishvili, T; Bakhtadze, S; Khachapuridze, N; Sebiskveradze, N; Geladze, N; et al.","Archives of Disease in Childhood Vol. 99, Iss. Suppl 2,  (October 2014): A517-A517."
The Decoupled Mind: Mind-wandering Disrupts Cortical Phase-locking to Perceptual Events,"Baird, Benjamin; Smallwood, Jonathan; Lutz, Antoine; Schooler, Jonathan W.","Journal of Cognitive Neuroscience Vol. 26, Iss. 11,  (November 2014): 2596."
Processing of Emotion Words by Patients with Autism Spectrum Disorders: Evidence from Reaction Times and EEG,"Lartseva, Alina; Dijkstra, Ton; Kan, Cornelis C; Buitelaar, Jan K.","Journal of Autism and Developmental Disorders Vol. 44, Iss. 11,  (Nov 2014): 2882-2894."
Continuous decoding of movement intention of upper limb self-initiated analytic movements from pre-movement EEG correlates,"Lopez-Larraz, Eduardo; Montesano, Luis; Gil-Agudo, Angel; Minguez, Javier.","Journal of NeuroEngineering and Rehabilitation Vol. 11, Iss. 1,  (2014): 153."
Integration of Spoken and Written Words in Beginning Readers: A Topographic ERP Study,"Jost, Lea B; Eberhard-Moscicka, Aleksandra K; Frisch, Christine; Dellwo, Volker; Maurer, Urs.","Brain Topography Vol. 27, Iss. 6,  (Nov 2014): 786-800."
Linking brain electrical signals elicited by current outcomes with future risk decision-making,"Zhang, Dandan; Gu, Ruolei; Broster, Lucas S; Jiang, Yang; Luo, Wenbo; et al.","Frontiers in Behavioral Neuroscience Vol. 8,  (Mar 18, 2014)."
Mismatch Negativity of Sad Syllables Is Absent in Patients with Major Depressive Disorder,"Pang, Xiaomei; Xu, Jing; Chang, Yi; Tang, Di; Zheng, Ya; et al.","PLoS One; San Francisco Vol. 9, Iss. 3,  (Mar 2014): e91995."
The Neural Response to Maternal Stimuli: An ERP Study,"Wu, Lili; Gu, Ruolei; Cai, Huajian; Luo, Yu L L; Zhang, Jianxin.","PLoS One; San Francisco Vol. 9, Iss. 11,  (Nov 2014): e111391."
A graphical user interface for infant ERP analysis,"Kaatiala, Jussi; Yrttiaho, Santeri; Forssman, Linda; Perdue, Katherine; Leppänen, Jukka.","Behavior Research Methods Vol. 46, Iss. 3,  (Sep 2014): 745-757."
Differences in Visuo-Motor Control in Skilled vs. Novice Martial Arts Athletes during Sustained and Transient Attention Tasks: A Motor-Related Cortical Potential Study,"Sanchez-Lopez, Javier; Fernandez, Thalia; Silva-Pereyra, Juan; Martinez Mesa, Juan A; Francesco Di Russo.","PLoS One; San Francisco Vol. 9, Iss. 3,  (Mar 2014): e91112."
The effect of attenuating noradrenergic neurotransmission by clonidine on brain activity measures of visuospatial attention,"Logemann, H. N. Alexander; Böcker, Koen B. E; Deschamps, Peter K. H; Kemner, Chantal; Kenemans, J. Leon.","Human Psychopharmacology: Clinical and Experimental Vol. 29, Iss. 1,  (Jan 2014): 46-54."
"Asymmetric interhemispheric excitability evidenced by event-related potential amplitude patterns after ""wide-awake surgery"" of brain tumours","Bonnetblanc, Francois; Herbet, Guillaume; Charras, Pom; Hayashibe, Mitsuhiro; Guiraud, David; et al.","Experimental Brain Research Vol. 232, Iss. 12,  (Dec 2014): 3907-3918."
Investigating letter recognition in the brain by varying typeface: An event-related potential study,"Keage, Hannah AD; Coussens, Scott; Kohler, Mark; Thiessen, Myra; Churches, Owen F.","Brain and Cognition Vol. 88,  (Jul 1, 2014): 83-89."
Dopamine modulates frontomedial failure processing of agentic introverts versus extraverts in incentive contexts,"Mueller, Erik M; Burgdorf, Christin; Chavanon, Mira-Lynn; Schweiger, Desiree; Wacker, Jan; et al.","Cognitive, Affective & Behavioral Neuroscience Vol. 14, Iss. 2,  (Jun 1, 2014): 756-768."
Network dynamics predict improvement in working memory performance following donepezil administration in healthy young adults,"Reches, A; Laufer, I; Ziv, K; Cukierman, G; McEvoy, K; et al.","NeuroImage Vol. 88,  (Mar 2014): 228-241."
The boundary condition for observing compensatory responses by the elderly in a flanker-task paradigm,"Hsieh, Shulan; Lin, Yu-Chi.","Biological Psychology Vol. 103,  (Dec 2014): 69-82."
Overlapped Partitioning for Ensemble Classifiers of P300-Based Brain-Computer Interfaces,"Onishi, Akinari; Natsume, Kiyohisa.","PLoS One; San Francisco Vol. 9, Iss. 4,  (Apr 2014): e93045."
Towards a Communication Brain Computer Interface Based on Semantic Relations,"Geuze, Jeroen; Farquhar, Jason; Desain, Peter.","PLoS One; San Francisco Vol. 9, Iss. 2,  (Feb 2014): e87511."
Spatial configuration of vertically related word pairs modulates the N400 component,"Hubbard, Tyler M; Magne, Cyrille; Langston, William.","NeuroReport: For Rapid Communication of Neuroscience Research Vol. 25, Iss. 18,  (Dec 17, 2014): 1424-1428."
Electrical Stimulation over Bilateral Occipito-Temporal Regions Reduces N170 in the Right Hemisphere and the Composite Face Effect,"Li-Zhuang, Yang; Zhang, Wei; Shi, Bin; Yang, Zhiyu; Zhengde Wei; et al.","PLoS One; San Francisco Vol. 9, Iss. 12,  (Dec 2014): e115772."
Second language phonology influences first language word naming,"Timmer, Kalinka; Ganushchak, Lesya Y; Ceusters, Ilse; Schiller, Niels O.","Brain and Language Vol. 133,  (Jun 2014): 14-25."
Emotional scenes elicit more pronounced self-reported emotional experience and greater EPN and LPP modulation when compared to emotional faces,"Thom, Nathaniel; Knight, Justin; Dishman, Rod; Sabatinelli, Dean; Johnson, Douglas C; et al.","Cognitive, Affective & Behavioral Neuroscience Vol. 14, Iss. 2,  (Jun 1, 2014): 849-860."
Elucidating the neurophysiological underpinnings of autism spectrum disorder: new developments,"Luckhardt, C; Jarczok, T A; Bender, S.","Journal of Neural Transmission Vol. 121, Iss. 9,  (Sep 2014): 1129-1144."
The Dynamics of Proactive and Reactive Cognitive Control Processes in the Human Brain,"Appelbaum, L Gregory; Boehler, C Nicolas; Davis, Lauren A; Won, Robert J; Woldorff, Marty G.","Journal of Cognitive Neuroscience Vol. 26, Iss. 5,  (May 2014): 1021."
"Combining and comparing EEG, peripheral physiology and eye-related measures for the assessment of mental workload","Hogervorst, Maarten A; Brouwer, Anne-Marie; van Erp, Jan B. F.","Frontiers in Neuroscience; Lausanne (Oct 14, 2014)."
The P600-as-P3 hypothesis revisited: Single-trial analyses reveal that the late EEG positivity following linguistically deviant material is reaction time aligned,"Sassenhagen, Jona; Schlesewsky, Matthias; Bornkessel-Schlesewsky, Ina.","Brain and Language Vol. 137,  (Oct 2014): 29-39."
"Effects of eye artifact removal methods on single trial P300 detection, a comparative study","Ghaderi, Foad; Kim, Su; Kirchner, Elsa.","Journal of Neuroscience Methods Vol. 221,  (Jan 1, 2014): 41-47."
Electrophysiological evidence for greater attention to threat when cognitive control resources are depleted,"Holmes, Amanda; Mogg, Karin; de Fockert, Jan; Nielsen, Maria Kragh; Bradley, Brendan P.","Cognitive, Affective & Behavioral Neuroscience Vol. 14, Iss. 2,  (Jun 2014): 827-835."
Exploring Combinations of Auditory and Visual Stimuli for Gaze-Independent Brain-Computer Interfaces,"An, Xingwei; Höhne, Johannes; Dong, Ming; Blankertz, Benjamin.","PLoS One; San Francisco Vol. 9, Iss. 10,  (Oct 2014): e111070."
Examining Event-Related Potential (ERP) Correlates of Decision Bias in Recognition Memory Judgments,"Hill, Holger; Windmann, Sabine.","PLoS One; San Francisco Vol. 9, Iss. 9,  (Sep 2014): e106411."
Electrophysiological correlates of local–global visual processing in college students with schizotypal traits: An event-related potential study,"Choi, Eun-Jung; Jang, Kyoung-Mi; Kim, Myung-Sun.","Biological Psychology Vol. 96,  (Feb 2014): 158-165."
The persistent influence of concussive injuries on cognitive control and neuroelectric function,"Moore, Robert D; Hillman, Charles H; Broglio, Steven P.","Journal of Athletic Training Vol. 49, Iss. 1,  (Jan 2014 - Feb 2014): 24-35."
Slow cortical potential and theta/beta neurofeedback training in adults: Effects on attentional processes and motor system excitability,"Studer, Petra; Kratz, Oliver; Gevensleben, Holger; Rothenberger, Aribert; Moll, Gunther H; et al.","Frontiers in Human Neuroscience Vol. 8,  (Jul 24, 2014)."
Internal Consistency of Event-Related Potentials Associated with Cognitive Control: N2/P3 and ERN/Pe,"Rietdijk, Wim J R; Franken, Ingmar H A; A Roy Thurik.","PLoS One; San Francisco Vol. 9, Iss. 7,  (Jul 2014): e102672."
Distributed Patterns of Event-Related Potentials Predict Subsequent Ratings of Abstract Stimulus Attributes,"Bode, Stefan; Bennett, Daniel; Stahl, Jutta; Murawski, Carsten.","PLoS One; San Francisco Vol. 9, Iss. 10,  (Oct 2014): e109070."
Age-related differences in working memory: ERPs reveal age-related delays in selection- and inhibition-related processes,"Yi, Yuji; Friedman, David.","Aging, Neuropsychology, and Cognition Vol. 21, Iss. 4,  (Jul 2014): 483-513."
Influence of emotional context on concreteness effects in words processing for field-independent and field-dependent individuals,"Zhang, Qin; Jiao, Lihua; Cui, Lixia.","NeuroReport: For Rapid Communication of Neuroscience Research Vol. 25, Iss. 9,  (Jun 18, 2014): 661-667."
Epidural electrocorticography of phantom hand movement following long-term upper-limb amputation,"Gharabaghi, Alireza; Naros, Georgios; Walter, Armin; Roth, Alexander; Bogdan, Martin; et al.","Frontiers in Human Neuroscience; Lausanne (May 6, 2014)."
Emoticons in mind: An event-related potential study,"Churches, Owen; Nicholls, Mike; Thiessen, Myra; Kohler, Mark; Keage, Hannah.","Social Neuroscience Vol. 9, Iss. 2,  (Mar 2014): 196-202."
