Title,Authors,Journal
Self-esteem and risky decision-making: An ERP study,"Yang, Juan; Dedovic, Katarina; Zhang, Qinglin.","Neurocase Vol. 16, Iss. 6,  (Dec 2010): 512-519."
Proficiency differences in syntactic processing of monolingual native speakers indexed by event-related potentials,"Pakulak, Eric; Neville, Helen J.","Journal of Cognitive Neuroscience Vol. 22, Iss. 12,  (Dec 2010): 2728-2744."
Exceptions and anomalies: An ERP study on context sensitivity in autism,"Pijnacker, Judith; Geurts, Bart; van Lambalgen, Michiel; Buitelaar, Jan; Hagoort, Peter.","Neuropsychologia Vol. 48, Iss. 10,  (Aug 2010): 2940-2951."
Revisiting P300 cognitive studies for dementia diagnosis: Early dementia with Lewy bodies (DLB) and Alzheimer disease (AD),"Bonanni, L; Franciotti, R; Onofrj, V; Anzellotti, F; Mancino, E; et al.","Neurophysiologie Clinique Vol. 40, Iss. 5-6,  (Dec 2010): 255-265."
Auditory Evoked Potentials and Impairments to Psychomotor Activity Evoked by Falling Asleep,"Dorokhov, V B; Verbitskaya, YuS; Lavrova, T P.","Neuroscience and Behavioral Physiology Vol. 40, Iss. 4,  (May 2010): 411-419."
Beyond good and evil: The time-course of neural activity elicited by specific picture content,"Weinberg, Anna; Hajcak, Greg.","Emotion Vol. 10, Iss. 6,  (Dec 2010): 767-782."
What's in a name? Brain activity reveals categorization processes differ across languages,"Liu, Chao; Tardif, Twila; Mai, Xiaoqin; Gehring, William J; Simms, Nina; et al.","Human Brain Mapping Vol. 31, Iss. 11,  (Nov 2010): 1786-1801."
Phasic brain activity related to the onset of rapid eye movements during rapid eye movement sleep: Study of event-related potentials and standardized low-resolution brain electromagnetic tomography,"Ogawa, Keiko; Abe, Takashi; Nittono, Hiroshi; Yamazaki, Katuo; Hori, Tadao.","Journal of Sleep Research Vol. 19, Iss. 3,  (Sep 2010): 407-414."
ERPs reveal sensitivity to hypothetical contexts in spoken discourse,"Dwivedi, Veena D; Drury, John E; Molnar, Monika; Phillips, Natalie A; Baum, Shari; et al.","NeuroReport: For Rapid Communication of Neuroscience Research Vol. 21, Iss. 11,  (Aug 4, 2010): 791-795."
Updating of context in working memory: An event-related potential study,"Lenartowicz, Agatha; Escobedo-Quiroz, Rafael; Cohen, Jonathan D.","Cognitive, Affective & Behavioral Neuroscience Vol. 10, Iss. 2,  (May 2010): 298-315."
Chronic cannabis users show altered neurophysiological functioning on Stroop task conflict resolution,"Battisti, Robert A; Roodenrys, Steven; Johnstone, Stuart J; Pesa, Nicole; Hermens, Daniel F; et al.","Psychopharmacology Vol. 212, Iss. 4,  (Dec 2010): 613-624."
Modulation of early conflict processing: N200 responses to emotional words in a flanker task,"Kanske, Philipp; Kotz, Sonja A.","Neuropsychologia Vol. 48, Iss. 12,  (Oct 2010): 3661-3664."
The time course of activity in dorsolateral prefrontal cortex and anterior cingulate cortex during top-down attentional control,"Silton, Rebecca Levin; Heller, Wendy; Towers, David N; Engels, Anna S; Spielberg, Jeffrey M; et al.","NeuroImage Vol. 50, Iss. 3,  (Apr 15, 2010): 1292-1302."
Schizotypal traits and N400 in healthy subjects,"Prévost, Marie; Rodier, Mitchell; Renoult, Louis; Kwann, Yvonne; Dionne-Dostie, Emmanuelle; et al.","Psychophysiology Vol. 47, Iss. 6,  (Nov 2010): 1047-1056."
Problem-solving without awareness: An ERP investigation,"Paynter, Christopher A; Kotovsky, Kenneth; Reder, Lynne M.","Neuropsychologia Vol. 48, Iss. 10,  (Aug 2010): 3137-3144."
Atypical event-related potentials in patients with mild cognitive impairment: An identification-priming study,"Galli, Giulia; Ragazzoni, Aldo; Viggiano, Maria Pia.","Alzheimer's & Dementia: The Journal of the Alzheimer's Association Vol. 6, Iss. 4,  (Jul 2010): 351-358."
Event-related potentials reveal the effects of aging on meaning selection and revision,"Meyer, Aaron M; Federmeier, Kara D.","Psychophysiology Vol. 47, Iss. 4,  (Jul 2010): 673-686."
Neural markers of subordinate-level categorization in 6- to 7-month-old infants,"Quinn, Paul C; Doran, Matthew M; Reiss, Jason E; Hoffman, James E.","Developmental Science Vol. 13, Iss. 3,  (May 2010): 499-507."
Altered emotional information processing in borderline personality disorder: An electrophysiological study,"Marissen, Marlies A. E; Meuleman, Linda; Franken, Ingmar H. A.","Psychiatry Research: Neuroimaging Vol. 181, Iss. 3,  (Mar 30, 2010): 226-232."
Switching associations between facial identity and emotional expression: A behavioural and ERP study,"Willis, Megan L; Palermo, Romina; Burke, Darren; Atkinson, Carmen M; McArthur, Genevieve.","NeuroImage Vol. 50, Iss. 1,  (Mar 2010): 329-339."
Imagine that! ERPs provide evidence for distinct hemispheric contributions to the processing of concrete and abstract concepts,"Huang, Hsu-Wen; Lee, Chia-Lin; Federmeier, Kara D.","NeuroImage Vol. 49, Iss. 1,  (Jan 1, 2010): 1116-1123."
"Evaluating two-step PCA of ERP data with Geomin, Infomax, Oblimin, Promax, and Varimax rotations","Dien, Joseph.","Psychophysiology Vol. 47, Iss. 1,  (Jan 2010): 170-183."
The Effects of Voluntary Attention on the Event-Related Potentials and Gamma-Band Response of EEG,"Connell Pensky, Allison E; Landau, Ayelet; Prinzmetal, William.","Journal of Vision Vol. 10, Iss. 7,  (2010): 93-93."
Detection of a Weak Somatosensory Stimulus: Role of the Prestimulus Mu Rhythm and Its Top-Down Modulation,"Zhang, Y; Ding, M.","Journal of Cognitive Neuroscience Vol. 22, Iss. 2,  (Feb 2010): 307-322."
Age-related and individual differences in the use of prediction during language comprehension,"Federmeier, Kara D; Kutas, Marta; Schul, Rina.","Brain and Language Vol. 115, Iss. 3,  (Dec 2010): 149-161."
It was not MY fault: Event-related brain potentials in active and observational learning from feedback,"Bellebaum, Christian; Kobza, Stefan; Thiele, Stefan; Daum, Irene.","Cerebral Cortex Vol. 20, Iss. 12,  (Dec 2010): 2874-2883."
"Social exclusion in middle childhood: Rejection events, slow-wave neural activity, and ostracism distress","Crowley, Michael J; Wu, Jia; Molfese, Peter J; Mayes, Linda C.","Social Neuroscience Vol. 5, Iss. 5-6,  (Oct 2010): 483-495."
ERP Generator Patterns in Schizophrenia During Tonal and Phonetic Oddball Tasks: Effects of Response Hand and Silent Count,"Kayser, Jürgen; Tenke, Craig E; Gil, Roberto; Bruder, Gerard E.","Clinical EEG and Neuroscience; Wheaton Vol. 41, Iss. 4,  (Oct 2010): 184-95."
Electrophysiological signals of familiarity and recency in the infant brain,"Snyder, Kelly A; Garza, John; Zolot, Liza; Kresse, Anna.","Infancy Vol. 15, Iss. 5,  (Sep 2010 - Oct 2010): 487-516."
Looking at emotional words is not the same as reading emotional words: Behavioral and neural correlates,"Hinojosa, José A; Méndez-Bértolo, Constantino; Pozo, Miguel A.","Psychophysiology Vol. 47, Iss. 4,  (Jul 2010): 748-757."
"ERP effects of change localization, change identification, and change blindness","Busch, Niko A; Dürschmid, Stefan; Herrmann, Christoph S.","NeuroReport: For Rapid Communication of Neuroscience Research Vol. 21, Iss. 5,  (Mar 31, 2010): 371-375."
Spatial Representations as an Emergent Feature of Perceptual Processing: Evidence from Human Electrophysiology,"Wascher, Edmund; Beste, C.","Journal of Psychophysiology Vol. 24, Iss. 3,  (2010): 161-172."
Brain dynamics in the auditory Go/NoGo task as a function of EEG frequency,"Barry, Robert J; De Blasio, Frances; Rushby, Jacqueline A; Clarke, Adam R.","International Journal of Psychophysiology Vol. 78, Iss. 2,  (Nov 2010): 115-128."
Reflection of the Emotional Significance of Visual Stimuli in the Characteristics of Evoked EEG Potentials,"Kovalenko, A A; Pavlenko, V B; Chernyi, S V.","Neurophysiology Vol. 42, Iss. 1,  (Jul 2010): 70-79."
A comparative study between a simplified Kalman filter and Sliding Window Averaging for single trial dynamical estimation of event-related potentials,"Vedel-Larsen, Esben; Fugloe, Jacob; Channir, Fouad; Thomsen, Carsten E; Soerensen, Helge BD.","Computer Methods and Programs in Biomedicine Vol. 99, Iss. 3,  (Sep 2010): 252-260."
Processing of emotional words measured simultaneously with steady-state visually evoked potentials and near-infrared diffusing-wave spectroscopy,"Koban, Leonie; Ninck, Markus; Li, Jun; Gisler, Thomas; Kissler, Johanna.","BMC Neuroscience Vol. 11,  (Jul 27, 2010): 85-85."
Induced theta oscillations as biomarkers for alcoholism,"Andrew, Colin; Fein, George.","Clinical Neurophysiology Vol. 121, Iss. 3,  (Mar 2010): 350-358."
Newborn brain event-related potentials revealing atypical processing of sound frequency and the subsequent association with later literacy skills in children with familial dyslexia,"Leppänen, Paavo H.T; Hämäläinen, Jarmo A; Salminen, Hanne K; Eklund, Kenneth M; Guttorm, Tomi K; et al.","Cortex: A Journal Devoted to the Study of the Nervous System and Behavior Vol. 46, Iss. 10,  (Nov 2010 - Dec 2010): 1362-1376."
Spatial cueing in time–space synesthetes: An event-related brain potential study,"Teuscher, Ursina; Brang, David; Ramachandran, Vilayanur S; Coulson, Seana.","Brain and Cognition Vol. 74, Iss. 1,  (Oct 2010): 35-46."
The relation of aerobic fitness to neuroelectric indices of cognitive and motor task preparation,"Kamijo, Keita; O'Leary, Kevin C; Pontifex, Matthew B; Themanson, Jason R; Hillman, Charles H.","Psychophysiology Vol. 47, Iss. 5,  (Sep 2010): 814-821."
Neural responses to faces reflect social personality traits,"Cheung, Celeste H. M; Rutherford, Helena J. V; Mayes, Linda C; McPartland, James C.","Social Neuroscience Vol. 5, Iss. 4,  (Aug 2010): 351-359."
Feedback-related negativity is correlated with unplanned impulsivity,"Onoda, Keiichi; Abe, Satoshi; Yamaguchi, Shuhei.","NeuroReport: For Rapid Communication of Neuroscience Research Vol. 21, Iss. 10,  (Jul 14, 2010): 736-739."
Neural correlates of cross-domain affective priming,"Zhang, Qin; Li, Xiaohua; Gold, Brian T; Jiang, Yang.","Brain Research Vol. 1329,  (May 6, 2010): 142-151."
ERP correlates of linear hand movements in a motor reproduction task,"Kirsch, Waldemar; Hennighausen, Erwin; Rösler, Frank.","Psychophysiology Vol. 47, Iss. 3,  (May 2010): 486-500."
Manual response preparation disrupts spatial attention: An electrophysiological investigation of links between action and attention,"Gherri, Elena; Eimer, Martin.","Neuropsychologia Vol. 48, Iss. 4,  (Mar 2010): 961-969."
Neurophysiological markers for child emotion regulation from the perspective of emotion-cognition integration: Current directions and future challenges,"Dennis, Tracy A.","Developmental Neuropsychology Vol. 35, Iss. 2,  (Feb 2010): 212-230."
Visual working memory deficits in patients with Parkinson’s disease are due to both reduced storage capacity and impaired ability to filter out irrelevant information,"Lee, Eun-Young; Cowan, Nelson; Vogel, Edward K; Rolan, Terry; Valle-Inclán, Fernando; et al.","Brain: A Journal of Neurology Vol. 133, Iss. 9,  (Sep 2010): 2677-2689."
Dissociation of visual C1 and P1 components as a function of attentional load: An event-related potential study,"Fu, Shimin; Fedota, John R; Greenwood, Pamela M; Parasuraman, Raja.","Biological Psychology Vol. 85, Iss. 1,  (Sep 2010): 171-178."
Cloze probability and completion norms for 498 sentences: Behavioral and neural validation using event-related potentials,"Block, Cady K; Baldwin, Carryl L.","Behavior Research Methods Vol. 42, Iss. 3,  (Aug 2010): 665-670."
An eye for detail: An event-related potential study of the rapid processing of fearful facial expressions in children,"Vlamings, Petra H. J. M; Jonkman, Lisa M; Kemner, Chantal.","Child Development Vol. 81, Iss. 4,  (Jul 2010 - Aug 2010): 1304-1319."
Neural correlates of top–down processing in emotion perception: An ERP study of emotional faces in white noise versus noise-alone stimuli,"Lee, Kyu-Yong; Lee, Tae-Ho; Yoon, So-Jeong; Cho, Yang Seok; Choi, June-Seek; et al.","Brain Research Vol. 1337,  (Jun 14, 2010): 56-63."
Event-related potential patterns and gender effects underlying facial affect processing in schizophrenia patients,"Lee, Seung-Hwan; Kim, Eun-Young; Kim, Sangrae; Bae, Sung-Man.","Neuroscience Research Vol. 67, Iss. 2,  (Jun 2010): 172-180."
Unexpected action effects elicit deviance-related brain potentials and cause behavioral delay,"Iwanaga, Mio; Nittono, Hiroshi.","Psychophysiology Vol. 47, Iss. 2,  (Mar 2010): 281-288."
An event-related potential study of temporal information encoding and decision making,"Chen, Youguo; Huang, Xiting; Yang, Bo; Jackson, Todd; Peng, Chunhua; et al.","NeuroReport: For Rapid Communication of Neuroscience Research Vol. 21, Iss. 2,  (Jan 27, 2010): 152-155."
Using ERPs for assessing the (sub) conscious perception of noise.,"Porbadnigk, Anne K; Antons, Jan-N; Blankertz, Benjamin; Treder, Matthias S; Schleicher, Robert; et al.","Annual International Conference of the IEEE Engineering in Medicine and Biology Society. IEEE Engineering in Medicine and Biology Society. Annual International Conference Vol. 2010,  (2010): 2690-2693."
Electrophysiological insights into the processing of nominal metaphors,"De Grauwe, Sophie; Swain, Abigail; Holcomb, Phillip J; Ditman, Tali; Kuperberg, Gina R.","Neuropsychologia Vol. 48, Iss. 7,  (Jun 2010): 1965-1984."
Sport is not always healthy: Executive brain dysfunction in professional boxers,"Di Russo, Francesco; Spinelli, Donatella.","Psychophysiology Vol. 47, Iss. 3,  (May 2010): 425-434."
Task relevance and recognition of concealed information have different influences on electrodermal activity and event-related brain potentials,"Gamer, Matthias; Berti, Stefan.","Psychophysiology Vol. 47, Iss. 2,  (Mar 2010): 355-364."
Enhanced neural reactivity and selective attention to threat in anxiety,"Eldar, Sharon; Yankelevitch, Roni; Lamy, Dominique; Bar-Haim, Yair.","Biological Psychology Vol. 85, Iss. 2,  (Oct 2010): 252-257."
An ERP study of the processing of response conflict in a dynamic localization task: The role of individual differences in task-appropriate behavior,"Fritzsche, Anna-Sophia; Stahl, Jutta; Gibbons, Henning.","Clinical Neurophysiology Vol. 121, Iss. 8,  (Aug 2010): 1358-1370."
Low-frequency repetitive transcranial magnetic stimulation (rTMS) affects event-related potential measures of novelty processing in autism,"Sokhadze, Estate; Baruth, Joshua; Tasman, Allan; Mansoor, Mehreen; Ramaswamy, Rajesh; et al.","Applied Psychophysiology and Biofeedback Vol. 35, Iss. 2,  (Jun 2010): 147-161."
Cognitive and emotional conflicts of counter-conformity choice in purchasing books online: An event-related potentials study,"Chen, Mingliang; Ma, Qingguo; Li, Minle; Lai, Hongxia; Wang, Xiaoyi; et al.","Biological Psychology Vol. 85, Iss. 3,  (Dec 2010): 437-445."
Neuronal generator patterns of olfactory event-related brain potentials in schizophrenia,"Kayser, Jürgen; Tenke, Craig E; Malaspina, Dolores; Kroppmann, Christopher J; Schaller, Jennifer D; et al.","Psychophysiology Vol. 47, Iss. 6,  (Nov 2010): 1075-1086."
Event-related potentials to overlapping shapes: Effects of saliency and interference,"Brodeur, Mathieu B; Lepore, Franco; Bacon, Benoit A; Renoult, Louis; Debruille, J. Bruno.","Attention, Perception, & Psychophysics Vol. 72, Iss. 6,  (Aug 2010): 1471-1479."
Gender differences in reading in school-aged children: An early ERP study,"Spironelli, Chiara; Penolazzi, Barbara; Angrilli, Alessandro.","Developmental Neuropsychology Vol. 35, Iss. 4,  (Jul 2010): 357-375."
Attentional bias to negative emotion as a function of approach and withdrawal anger styles: An ERP investigation,"Stewart, Jennifer L; Silton, Rebecca Levin; Sass, Sarah M; Fisher, Joscelyn E; Edgar, J. Christopher; et al.","International Journal of Psychophysiology Vol. 76, Iss. 1,  (Apr 2010): 9-18."
Finding meaning in novel geometric shapes influences electrophysiological correlates of repetition and dissociates perceptual and conceptual priming,"Voss, Joel L; Schendan, Haline E; Paller, Ken A.","NeuroImage Vol. 49, Iss. 3,  (Feb 1, 2010): 2879-2889."
The when and where of spatial storage in memory-guided saccades,"Brignani, Debora; Bortoletto, Marta; Miniussi, Carlo; Maioli, Claudio.","NeuroImage Vol. 52, Iss. 4,  (Oct 1, 2010): 1611-1620."
Effects of alcohol on attention orienting and dual-task performance during simulated driving: An event-related potential study,"Wester, Anne E; Verster, Joris C; Volkerts, Edmund R; Böcker, Koen B. E; Kenemans, J. Leon.","Journal of Psychopharmacology Vol. 24, Iss. 9,  (Sep 2010): 1333-1348."
"Mismatch negativity (MMN), the deviance-elicited auditory deflection, explained","May, Patrick J. C; Tiitinen, Hannu.","Psychophysiology Vol. 47, Iss. 1,  (Jan 2010): 66-122."
Effect of task-irrelevant high-speed verbal stimulation on a visual/verbal word-discrimination task: An event-related potential study,"Uemura, Jun-ichi; Hoshiyama, Minoru.","Clinical Neurophysiology Vol. 121, Iss. 12,  (Dec 2010): 2065-2069."
Gestures modulate speech processing early in utterances,"Wu, Ying Choon; Coulson, Seana.","NeuroReport: For Rapid Communication of Neuroscience Research Vol. 21, Iss. 7,  (May 12, 2010): 522-526."
Semantics does not need a processing license from syntax in reading Chinese,"Zhang, Yaxu; Yu, Jing; Boland, Julie E.","Journal of Experimental Psychology: Learning, Memory, and Cognition Vol. 36, Iss. 3,  (May 2010): 765-781."
Differential modulations of response control processes by by 5-HT1A gene variation,"Beste, Christian; Domschke, Katharina; Falkenstein, Michael; Konrad, Carsten.","NeuroImage Vol. 50, Iss. 2,  (Apr 1, 2010): 764-771."
The phonemic restoration effect reveals pre-N400 effect of supportive sentence context in speech perception,"Groppe, David M; Choi, Marvin; Huang, Tiffany; Schilz, Joseph; Topkins, Ben; et al.","Brain Research Vol. 1361,  (Nov 18, 2010): 54-66."
Spatiotemporal cortical activation underlying self-referencial processing evoked by self-hand,"Su, Yanhua; Chen, Antao; Yin, Huazhan; Qiu, Jiang; Lv, Jieyu; et al.","Biological Psychology Vol. 85, Iss. 2,  (Oct 2010): 219-225."
Brain dynamics associated with recollective experiences of emotional events,"Weymar, Mathias; Löw, Andreas; Schwabe, Lars; Hamm, Alfons O.","Neuroreport: An International Journal for the Rapid Communication of Research in Neuroscience Vol. 21, Iss. 12,  (Aug 23, 2010): 827-831."
Brain activation during upright and inverted encoding of own- and other-age faces: Erp evidence for an own-age bias,"Melinder, Annika; Gredebäck, Gustaf; Westerlund, Alissa; Nelson, Charles A.","Developmental Science Vol. 13, Iss. 4,  (Jul 2010): 588-598."
Eye contact and emotional face processing in 6-month-old infants: Advanced statistical methods applied to event-related potentials,"Stahl, Daniel; Parise, Eugenio; Hoehl, Stefanie; Striano, Tricia.","Brain & Development Vol. 32, Iss. 4,  (Apr 2010): 305-317."
Unimodal and crossmodal gradients of spatial attention: Evidence from event-related potentials,"Föcker, Julia; Hötting, Kirsten; Gondan, Matthias; Röder, Brigitte.","Brain Topography Vol. 23, Iss. 1,  (Mar 2010): 1-13."
On the role of conflict and control in social cognition: Event-related brain potential investigations,"Bartholow, Bruce D.","Psychophysiology Vol. 47, Iss. 2,  (Mar 2010): 201-212."
Response inhibition subprocesses and dopaminergic pathways: Basal ganglia disease effects,"Beste, Christian; Willemssen, Rita; Saft, Carsten; Falkenstein, Michael.","Neuropsychologia Vol. 48, Iss. 2,  (Jan 2010): 366-373."
The effect of interpersonal competition on monitoring internal and external error feedback,"Van Meel, Catharina S; Van Heijningen, Caroline A. A.","Psychophysiology Vol. 47, Iss. 2,  (Mar 2010): 213-222."
Disruption of synaesthesia by posthypnotic suggestion: An ERP study,"Terhune, Devin Blair; Cardeña, Etzel; Lindgren, Magnus.","Neuropsychologia Vol. 48, Iss. 11,  (Sep 2010): 3360-3364."
Dysfunctional reward processing in male alcoholics: An ERP study during a gambling task,"Kamarajan, Chella; Rangaswamy, Madhavi; Tang, Yongqiang; Chorlian, David B; Pandey, Ashwini K; et al.","Journal of Psychiatric Research Vol. 44, Iss. 9,  (Jul 2010): 576-590."
Inhibition dysfunction in depression: Event-related potentials during negative affective priming,"Yao, Shuqiao; Liu, Mingfan; Liu, Jianping; Hu, Zhujing; Yi, Jinyao; et al.","Psychiatry Research: Neuroimaging Vol. 182, Iss. 2,  (May 30, 2010): 172-179."
"Orthographic and associative neighborhood density effects: What is shared, what is different?","Müller, Oliver; Duñabeitia, Jon Andoni; Carreiras, Manuel.","Psychophysiology Vol. 47, Iss. 3,  (May 2010): 455-466."
An electrophysiological study of boundary conditions for control of recollection in the exclusion task,"Evans, L. H; Wilding, E. L; Hibbs, C. S; Herron, J. E.","Brain Research Vol. 1324,  (Apr 9, 2010): 43-53."
Individual differences in aging and cognitive control modulate the neural indexes of context updating and maintenance during task switching,"Adrover-Roig, Daniel; Barceló, Francisco.","Cortex: A Journal Devoted to the Study of the Nervous System and Behavior Vol. 46, Iss. 4,  (Apr 2010): 434-450."
Flanker negative priming from spatially unpredictable primes: An ERP study,"Gibbons, Henning; Frings, Christian.","International Journal of Psychophysiology Vol. 75, Iss. 3,  (Mar 2010): 339-348."
"Event-related potential (ERP) markers of melodic processing: The N2 component is modulated by structural complexity, not by melodic ‘meaningfulness’","Minati, L; Salvatoni, L; Rosazza, C; Pietrocini, E; Visani, E; et al.","Brain Research Bulletin Vol. 83, Iss. 1-2,  (Aug 30, 2010): 23-28."
Negative feedback influences auditory recognition: behavioral and event-related potential evidence,"Kuelzow, Nadine; Nessler, Doreen; Saenger, Jessica; Schneider, Till R; Debener, Stefan.","NeuroReport: For Rapid Communication of Neuroscience Research Vol. 21, Iss. 11,  (Aug 4, 2010): 751-755."
Event-related brain potentials and cognitive processes related to perceptual–motor information transmission,"Kopp, Bruno; Wessel, Karl.","Cognitive, Affective & Behavioral Neuroscience Vol. 10, Iss. 2,  (May 2010): 316-327."
Neural correlates of sequence encoding in visuomotor learning,"Agam, Yigal; Huang, Jie; Sekuler, Robert.","Journal of Neurophysiology Vol. 103, Iss. 3,  (Mar 2010): 1418-1424."
Sequence effects in cued task switching modulate response preparedness and repetition priming processes,"Jamadar, Sharna; Michie, Patricia T; Karayanidis, Frini.","Psychophysiology Vol. 47, Iss. 2,  (Mar 2010): 365-386."
Simplifying jackknifing of ERPs and getting more out of it: Retrieving estimates of participants' latencies,"Smulders, Fren T. Y.","Psychophysiology Vol. 47, Iss. 2,  (Mar 2010): 387-392."
The neural underpinnings of semantic ambiguity and anaphora,"Dwivedi, Veena D; Phillips, Natalie A; Einagel, Stephanie; Baum, Shari R.","Brain Research Vol. 1311,  (Jan 22, 2010): 93-109."
Automatic and controlled aspects of lexical associative processing in the two cerebral hemispheres,"Kandhadai, Padmapriya; Federmeier, Kara D.","Psychophysiology Vol. 47, Iss. 4,  (Jul 2010): 774-785."
Which Physiological Components are More Suitable for Visual ERP Based Brain-Computer Interface? A Preliminary MEG/EEG Study,"Bianchi, Luigi; Sami, Saber; Hillebrand, Arjan; Fawcett, Ian P; Quitadamo, Lucia Rita; et al.","Brain Topography; New York Vol. 23, Iss. 2,  (Jun 2010): 180-5."
"Syntax, concepts, and logic in the temporal dynamics of language comprehension: Evidence from event-related potentials","Steinhauer, Karsten; Drury, John E; Portner, Paul; Walenski, Matthew; Ullman, Michael T.","Neuropsychologia Vol. 48, Iss. 6,  (May 2010): 1525-1542."
Sentence integration processes: An ERP study of Chinese sentence comprehension with relative clauses,"Yang, Chin Lung; Perfetti, Charles A; Liu, Ying.","Brain and Language Vol. 112, Iss. 2,  (Feb 2010): 85-100."
The impact of social comparison on the neural substrates of reward processing: An event-related potential study,"Qiu, Jiang; Yu, Caiyun; Li, Hong; Jou, Jerwen; Tu, Shen; et al.","NeuroImage Vol. 49, Iss. 1,  (Jan 1, 2010): 956-962."
Multiple ways to the prior occurrence of an event: An electrophysiological dissociation of experimental and conceptually driven familiarity in recognition memory,"Wiegand, Iris; Bader, Regine; Mecklinger, Axel.","Brain Research Vol. 1360,  (Nov 11, 2010): 106-118."
Multi-set canonical correlation analysis for the fusion of concurrent single trial ERP and functional MRI,"Correa, Nicolle M; Eichele, Tom; Adalı, Tülay; Li, Yi-Ou; Calhoun, Vince D.","NeuroImage Vol. 50, Iss. 4,  (May 1, 2010): 1438-1445."
Brain responses evoked by high-frequency repetitive transcranial magnetic stimulation: An event-related potential study,"Hamidi, Massihullah; Slagter, Heleen A; Tononi, Giulio; Postle, Bradley R.","Brain Stimulation Vol. 3, Iss. 1,  (Jan 2010): 2-14."
Maturation of auditory temporal integration and inhibition assessed with event-related potentials (ERPs),"Fox, Allison M; Anderson, Mike; Reid, Corinne; Smith, Tim; Bishop, Dorothy V. M.","BMC Neuroscience Vol. 11,  (Apr 16, 2010)."
Infant febrile seizures: Changes in declarative memory as revealed by event-related potentials,"Kipp, Kerstin H; Mecklinger, Axel; Becker, Martina; Reith, Wolfgang; Gortner, Ludwig.","Clinical Neurophysiology Vol. 121, Iss. 12,  (Dec 2010): 2007-2016."
Priming of pop-out modulates attentional target selection in visual search: Behavioural and electrophysiological evidence,"Eimer, Martin; Kiss, Monika; Cheung, Theodore.","Vision Research Vol. 50, Iss. 14,  (Jun 25, 2010): 1353-1361."
Priming resolves perceptual ambiguity in visual search: Evidence from behaviour and electrophysiology,"Olivers, Christian N. L; Hickey, Clayton.","Vision Research Vol. 50, Iss. 14,  (Jun 25, 2010): 1362-1371."
