Title,Authors,Journal
An EEG study of detection without localisation in change blindness,"Scrivener, Catriona L; Malik, Asad; Marsh, Jade; Lindner, Michael; Roesch, Etienne B.","Experimental Brain Research; Heidelberg Vol. 237, Iss. 10,  (Oct 2019): 2535-2547."
Spatial attention affects the early processing of neutral versus fearful faces when they are task-irrelevant: a classifier study of the EEG C1 component,"Acunzo, David; MacKenzie, Graham; van Rossum, Mark C W.","Cognitive, Affective and Behavioral Neuroscience; New York Vol. 19, Iss. 1,  (Feb 2019): 123-137."
The Effect of Lexical Cohort Size Is Independent of Semantic Context Effects in a Picture–Word Interference Task: A Combined ERP and sLORETA Study,"Ouyang, Mingkun; Cai, Xiao; Zhang, Qingfang.","Frontiers in Human Neuroscience; Lausanne (Dec 20, 2019)."
Converging electrophysiological evidence for a processing advantage of social over nonsocial feedback,"Pfabigan, Daniela M; Han, Shihui.","Cognitive, Affective and Behavioral Neuroscience; New York Vol. 19, Iss. 5,  (Oct 2019): 1170-1183."
The semiotics of the message and the messenger: How nonverbal communication affects fairness perception,"Spapé, Michiel; Harjunen, Ville; Ahmed, Imtiaj; Jacucci, Giulio; Ravaja, Niklas.","Cognitive, Affective & Behavioral Neuroscience Vol. 19, Iss. 5,  (Oct 2019): 1259-1272."
Spatially Specific Attention Mechanisms Are Sensitive to Competition during Visual Search,"Lu-Chun, Yeh; Yei-Yu Yeh; Bo-Cheng, Kuo.","Journal of Cognitive Neuroscience; Cambridge Vol. 31, Iss. 8,  (Aug 2019): 1248–1259."
"The Potential of Trial-by-Trial Variabilities of Ongoing-EEG, Evoked Potentials, Event Related Potentials and fMRI as Diagnostic Markers for Neuropsychiatric Disorders","Trenado, Carlos; González-Ramírez, Anaí; Lizárraga-Cortés, Victoria; Pedroarena Leal, Nicole; Manjarrez, Elias; et al.","Frontiers in Neuroscience; Lausanne (Jul 17, 2019)."
The electrophysiology of subjectively perceived memory confidence in relation to recollection and familiarity,"Wynn, Syanah C; Daselaar, Sander M; Kessels, Roy P C; Schutter, Dennis J L G.","Brain and Cognition; Amsterdam Vol. 130,  (Mar 2019): 20."
Personal responsibility modulates neural representations of anticipatory and experienced pain,"Pu, Min; Yu, Rongjun.","Psychophysiology; Oxford Vol. 56, Iss. 3,  (Mar 2019)."
Anticipatory Distractor Suppression Elicited by Statistical Regularities in Visual Search,"Wang, Benchi; Joram van Driel; Ort, Eduard; Theeuwes, Jan.","Journal of Cognitive Neuroscience; Cambridge Vol. 31, Iss. 10,  (Oct 2019): 1535–1548."
The contribution of the prefrontal cortex to relevancy-based gating of visual and tactile stimuli,"Adams, Meaghan S; Andrew, Danielle; Staines, W Richard.","Experimental Brain Research; Heidelberg Vol. 237, Iss. 10,  (Oct 2019): 2747-2759."
"Neural correlates of anticipatory cardiac deceleration and its association with the speed of perceptual decision-making, in young and older adults","Ribeiro, Maria J; Castelo-Branco, Miguel.","NeuroImage; Amsterdam Vol. 199,  (Oct 1, 2019): 521-533."
Temporal Characteristics of Attentional Disengagement from Emotional Facial Cues in Depression,"Zhao, Qiangfeng; Jiao, Xiong; Tang, Yingying; Chen, Shan; Tong, Shanbao; et al.","Neurophysiologie Clinique = Clinical Neurophysiology; Paris Vol. 49, Iss. 3,  (Jun 2019): 235."
Bilateral engagement of the occipito-temporal cortex in response to dance kinematics in experts,"Orlandi, Andrea; Proverbio Alice Mado.","Scientific Reports (Nature Publisher Group); London Vol. 9, Iss. 1,  (Jan 2019)."
Decreased Information Replacement of Working Memory After Sleep Deprivation: Evidence From an Event-Related Potential Study.,"Zhang, Liwei; Shao, Yongcong; Liu, Zhongqi; Li, Chenming; Chen, Yuhong; et al.","Frontiers in neuroscience Vol. 13,  (2019): 408."
Use of Prosocial Word Enhances the Processing of Language: Frequency Domain Analysis of Human EEG,"Tarai, Shashikanta; Mukherjee, Rupsha; Quais Ain Qurratul; Singh, Bikesh Kumar; Bit, Arindam.","Journal of Psycholinguistic Research; New York Vol. 48, Iss. 1,  (Feb 2019): 145-161."
Intense and sustained pain reduces cortical responses to auditory stimuli: Implications for the interpretation of the effects of heterotopic noxious conditioning stimulation in humans,"Torta, Diana M; Jure, Fabricio A; Andersen, Ole K; José AB Biurrun Manresa.","European Journal of Neuroscience; Chichester Vol. 50, Iss. 12,  (Dec 2019): 3934-3943."
The Neural Basis of Herding Decisions in Enterprise Clustering: An Event-Related Potential Study,"Zhang, Wuke; Yang, Danping; Jin, Jia; Diao, Liuting; Ma, Qingguo.","Frontiers in Neuroscience; Lausanne (Oct 30, 2019)."
Enhanced response inhibition and reduced midfrontal theta activity in experienced Vipassana meditators,"Andreu, Catherine I; Palacios, Ismael; Moënne-Loccoz, Cristóbal; López, Vladimir; Franken, Ingmar H A; et al.","Scientific Reports (Nature Publisher Group); London Vol. 9,  (Sep 2019): 1-11."
Influence of age on the effects of lying on memory,"Paige, Laura E; Fields, Eric C; Gutchess, Angela.","Brain and Cognition; Amsterdam Vol. 133,  (Jul 2019): 42."
Which Reference Should We Use for EEG and ERP practice?,"Yao, Dezhong; Qin, Yun; Hu, Shiang; Li, Dong; Bringas Vega, Maria L; et al.","Brain Topography; New York Vol. 32, Iss. 4,  (Jul 2019): 530-549."
Using principal components analysis to examine resting state EEG in relation to task performance,"Karamacoska, Diana; Barry, Robert J; Steiner, Genevieve Z.","Psychophysiology; Oxford Vol. 56, Iss. 5,  (May 2019)."
Centro-parietal EEG potentials index subjective evidence and confidence during perceptual decision making,"Herding, Jan; Ludwig, Simon; Alexander von Lautz; Spitzer, Bernhard; Blankenburg, Felix.","NeuroImage; Amsterdam Vol. 201,  (Nov 1, 2019)."
Distress intolerance moderation of motivated attention to cannabis and negative stimuli after induced stress among cannabis users: an ERP study,"Macatee, Richard J; Okey, Sarah A; Albanese, Brian J; Schmidt, Norman B; Cougle, Jesse R.","Addiction Biology (Online); Leeds Vol. 24, Iss. 4,  (Jul 2019): 717-729."
Stability and change in emotional processing across development: A 6‐year longitudinal investigation using event‐related potentials,"Pegg, Samantha; Dickey, Lindsay; Mumper, Emma; Kessel, Ellen; Klein, Daniel N; et al.","Psychophysiology; Oxford Vol. 56, Iss. 11,  (Nov 2019)."
Evidence for age-related changes in sensorimotor neuromagnetic responses during cued button pressing in a large open-access dataset,"Bardouille, Timothy; Bailey, Lyam.","NeuroImage; Amsterdam Vol. 193,  (Jun 2019): 25-34."
Workshops,,"Indian Journal of Psychiatry, suppl. Suppl 3; Mysore Vol. 61, Iss. 9,  (Jan 2019): 440-451."
The feedback‐related negativity indexes prediction error in active but not observational learning,"Burnside, Rebecca; Fischer, Adrian G; Ullsperger, Markus.","Psychophysiology; Oxford Vol. 56, Iss. 9,  (Sep 2019)."
How Dutch and Turkish-Dutch readers process morphologically complex words: An ERP study,"Prins, Tineke; Dijkstra, Ton; Koeneman, Olaf.","Journal of Neurolinguistics; Tokyo Vol. 50,  (May 2019): 37."
Learning What Is Irrelevant or Relevant: Expectations Facilitate Distractor Inhibition and Target Facilitation through Distinct Neural Mechanisms,"van Moorselaar, Dirk; Slagter, Heleen A.","The Journal of Neuroscience; Baltimore Vol. 39, Iss. 35,  (Aug 28, 2019): 6953."
Abnormal performance monitoring but intact response inhibition in sensation seeking,"Zheng, Ya; Mei, Shuting; Wei, Yi; Li, Qi; Liu, Xun.","Psychophysiology; Oxford Vol. 56, Iss. 8,  (Aug 2019)."
Rapid Memory Reactivation at Movie Event Boundaries Promotes Episodic Encoding,"Silva, Marta; Baldassano, Christopher; Fuentemilla, Lluís.","The Journal of Neuroscience; Baltimore Vol. 39, Iss. 43,  (Oct 23, 2019): 8538."
Change detection to tone pairs during the first year of life – Predictive longitudinal relationships for EEG-based source and time-frequency measures,"Hämäläinen, Jarmo A; Ortiz-Mantilla, Silvia; Benasich, April.","NeuroImage; Amsterdam Vol. 198,  (Sep 2019): 83-92."
I feel what I do: Relating interoceptive processes and reward-related behavior,"Marshall, Amanda C; Gentsch, Antje; Anna-Lucia Blum; Broering, Christina; Schütz-Bosbach, Simone.","NeuroImage; Amsterdam Vol. 191,  (May 1, 2019): 315-324."
Towards a neurodynamical understanding of the prodrome in schizophrenia,"Emmi Mikanmaa; Grent-'t-Jong, Tineke; Hua, Lingling; Recasens, Marc; Thune, Hanna; et al.","NeuroImage; Amsterdam Vol. 190,  (Apr 15, 2019): 144-153."
Social dimension and complexity differentially influence brain responses during feedback processing,"Pfabigan, Daniela M; Gittenberger, Marianne; Lamm, Claus.","Social Neuroscience; Hove Vol. 14, Iss. 1,  (Feb 2019): 26-40."
Age differences in electrocortical reactivity to fearful faces following aversive conditioning in youth,"Burkhouse, Katie L; Owens, Max; James, Kiera; Gibb, Brandon E.","Journal of Experimental Child Psychology Vol. 188,  (Dec 2019)."
"Seeing emotions, reading emotions: Behavioral and ERPs evidence of the regulation of pictures and words","Grecucci, Alessandro; Sulpizio, Simone; Tommasello, Elisa; Vespignani, Francesco; Job, Remo.","PLoS One; San Francisco Vol. 14, Iss. 5,  (May 2019): e0209461."
Rapid stream stimulation can enhance the stimulus selectivity of early evoked responses to written characters but not faces,"Luo, Canhuang; Chen, Wei; Zhang, Ye; ⨯ Carl Michael Gaspar.","PLoS One; San Francisco Vol. 14, Iss. 3,  (Mar 2019): e0213637."
Diminished neural responses to emotionally valenced facial stimuli: A potential biomarker for unemotional traits in early childhood,"Hoyniak, Caroline P; Bates, John E; Petersen, Isaac T; Yang, Chung-Lin; Darcy, Isabelle; et al.","Child Psychiatry and Human Development Vol. 50, Iss. 1,  (Feb 15, 2019): 72-82."
Recording mobile EEG in an outdoor environment reveals cognitive-motor interference dependent on movement complexity,"Julian Elias Reiser; Wascher, Edmund; Arnau, Stefan.","Scientific Reports (Nature Publisher Group); London Vol. 9,  (Sep 2019): 1-14."
No matter how: Top-down effects of verbal and semantic category knowledge on early visual perception,"Maier, Martin; Rahman, Rasha Abdel.","Cognitive, Affective and Behavioral Neuroscience; New York Vol. 19, Iss. 4,  (Aug 2019): 859-876."
The role of levels of processing in disentangling the ERP signatures of conscious visual processing,"Derda, Monika; Koculak, Marcin; Windey, Bert; Gociewicz, Krzysztof; Wierzchoń, Michał; et al.","Consciousness and Cognition; San Diego Vol. 73,  (Aug 2019): 1."
The Speed of Neural Visual Motion Perception and Processing Determines the Visuomotor Reaction Time of Young Elite Table Tennis Athletes,"Hülsdünker, Thorben; Ostermann, Martin; Mierau, Andreas.","Frontiers in Behavioral Neuroscience; Lausanne (Jul 19, 2019)."
Attentional processes in typically developing children as revealed using brain event-related potentials and their source localization in Attention Network Test,"Santhana Gopalan Praghajieeth Raajhen; Loberg Otto; Hämäläinen, Jarmo Arvid; Leppänen Paavo H T.","Scientific Reports (Nature Publisher Group); London Vol. 9, Iss. 1,  (Dec 2019)."
Error-related brain activity in relation to psychopathic traits in multi-problem young adults: An ERP study,"Zijlmans, J; Bevaart, F; van Duin, L; Luijks, M. J. A; Popma, A; et al.","Biological Psychology Vol. 144,  (May 2019): 46-53."
Independent ERP predictors of affective priming underline the importance of depth of prime and target processing and implicit affect misattribution,"Seib-Pfeifer, Laura-Effi; Gibbons, Henning.","Brain and Cognition; Amsterdam Vol. 136,  (Nov 2019): 1."
Target‐related parietal P3 and medial frontal theta index the genetic risk for problematic substance use,"Harper, Jeremy; Malone, Stephen M; Iacono, William G.","Psychophysiology; Oxford Vol. 56, Iss. 8,  (Aug 2019)."
Abnormal neural functions associated with motor inhibition deficits in schizophrenia and bipolar disorder,"Van Voorhis, Abraham C; Kent, Jerillyn S; Kang, Seung Suk; Goghari, Vina M; MacDonald, Angus W., III; et al.","Human Brain Mapping Vol. 40, Iss. 18,  (Dec 15, 2019): 5397-5411."
Altered upright face recognition and presence of face inversion effect in temporal lobe epilepsy: An event‐related potential study,"Mogi, Taichi; Tsunoda, Tomoya; Yoshino, Aihide.","Psychiatry and Clinical Neurosciences Vol. 73, Iss. 5,  (May 2019): 269-276."
Remembering faces: The effects of emotional valence and temporal recency,"Proverbio, Alice Mado; Vanutelli, Maria Elide; Viganò, Simone.","Brain and Cognition; Amsterdam Vol. 135,  (Oct 2019): 1."
The Time Course of Dorsal and Rostral-Ventral Anterior Cingulate Cortex Activity in the Emotional Stroop Experiment Reveals Valence and Arousal Aberrant Modulation in Patients with Schizophrenia,"Feroz, F S; Leicht, G; Rauh, J; Mulert, C.","Brain Topography; New York Vol. 32, Iss. 1,  (Jan 2019): 161."
Neurobiological approaches to the study of clinical and genetic high risk for developing psychosis,"Niznikiewicz, Margaret A.","Psychiatry Research Vol. 277,  (Jul 2019): 17-22."
The difference of mild cognitive impairment in Parkinson's disease from amnestic mild cognitive impairment: Deeper power decrement and no phase-locking in visual event-related responses,"Yener, Görsev G; Fide, Ezgi; Özbek, Yağmur; Emek-Savaş, Derya Durusu; Aktürk, Tuba; et al.","International Journal of Psychophysiology Vol. 139,  (May 2019): 48-58."
Vision-aided brain–machine interface training system for robotic arm control and clinical application on two patients with cervical spinal cord injury,"Kim, Yoon Jae; Nam, Hyung Seok; Woo Hyung Lee; Han Gil Seo; Ja-Ho, Leigh; et al.","Biomedical Engineering Online; London Vol. 18,  (2019)."
Neutral face and complex object neurophysiological processing deficits in long-term schizophrenia and in first hospitalized schizophrenia-spectrum individuals,"Salisbury, Dean F; Krompinger, Jason W; Lynn, Spencer K; Onitsuka, Toshiaki; McCarley, Robert W.","International Journal of Psychophysiology Vol. 145,  (Nov 2019): 57-64."
"Comparison of automatic visual attention in schizophrenia, bipolar disorder, and major depression: Evidence from P1 event‐related component","Spironelli, Chiara; Romeo, Zaira; Maffei, Antonio; Angrilli, Alessandro.","Psychiatry and Clinical Neurosciences; Tokyo Vol. 73, Iss. 6,  (Jun 2019): 331-339."
Neural Activities Classification of Human Inhibitory Control Using Hierarchical Model,"Chikara, Rupesh Kumar; Li-Wei, Ko.","Sensors; Basel Vol. 19, Iss. 17,  (2019): 3791."
Contingent negative variation for the periodicity of migraine attacks without aura.,"Tian, Qiang; Xu, Song; Guo, Yunliang; Li, Jin; Han, Mimi; et al.","Journal of integrative neuroscience Vol. 18, Iss. 3,  (September 30, 2019): 269-276."
Breath-focused mindfulness alters early and late components during emotion regulation,"Zhang, Wenhai; Ouyang, Yongqiang; Tang, Fanggui; Chen, Jie; Li, Hong.","Brain and Cognition Vol. 135,  (Oct 2019)."
"Happy you, happy me: Expressive changes on a stranger’s voice recruit faster implicit processes than self-produced expressions","Rachman, Laura; Dubal, Stéphanie; Aucouturier, Jean-Julien.","Social Cognitive and Affective Neuroscience Vol. 14, Iss. 5,  (May 2019): 559-568."
Does the aura surrounding healthy-related imported products fade in China? ERP evidence for the country-of-origin stereotype,"Fan, Bonai; Zhang, Qianrong.","PLoS One; San Francisco Vol. 14, Iss. 5,  (May 2019): e0216866."
The emotion regulation effect of cognitive control is related to depressive state through the mediation of rumination: An ERP study,"Gan, Shuzhen; Chen, Shuang; Shen, Xiangrong.","PLoS One; San Francisco Vol. 14, Iss. 11,  (Nov 2019): e0225285."
Prior Emotional Context Modulates Early Event-Related Potentials to Neutral Retrieval Cues,"Bowen, Holly J; Fields, Eric C; Kensinger, Elizabeth A.","Journal of Cognitive Neuroscience; Cambridge Vol. 31, Iss. 11,  (Nov 2019): 1755–1767."
Increased neural sensitivity to self‐relevant stimuli in major depressive disorder,"Benau, Erik M; Hill, Kaylin E; Atchley, Ruth Ann; Aminda J O’Hare; Gibson, Linzi J; et al.","Psychophysiology; Oxford Vol. 56, Iss. 7,  (Jul 2019)."
"The neuromodulatory and hormonal effects of transcutaneous vagus nerve stimulation as evidenced by salivary alpha amylase, salivary cortisol, pupil diameter, and the P3 event-related potential","Warren, C. M; Tona, K. D; Ouwerkerk, L; van Paridon, J; Poletiek, F; et al.","Brain Stimulation Vol. 12, Iss. 3,  (May 2019 - Jun 2019): 635-642."
EEG-Based Brain-Computer Interfaces.,"Wang, Yijun; Nakanishi, Masaki; Zhang, Dan; National Library of Medicine.","Advances in experimental medicine and biology Vol. 1101,  (2019): 41-65."
Online Home Appliance Control Using EEG-Based Brain–Computer Interfaces,"Kim, Minju; Min-Ki, Kim; Hwang, Minho; Hyun-Young, Kim; Cho, Jeongho; et al.","Electronics; Basel Vol. 8, Iss. 10,  (2019): 1101."
The relationship between mismatch negativity and the COMTVal108/158Met genotype in schizophrenia,"Horikoshi, Sho; Shiga, Tetsuya; Hoshino, Hiroshi; Ochiai, Haruka; Kanno-Nozaki, Keiko; et al.","Neuropsychobiology Vol. 77, Iss. 4,  (2019): 192-196."
Cortical Pain Processing in the Rat Anterior Cingulate Cortex and Primary Somatosensory Cortex,"Xiao, Zhengdong; Martinez, Erik; Kulkarni, Prathamesh M; Zhang, Qiaosheng; Hou, Qianning; et al.","Frontiers in Cellular Neuroscience; Lausanne (Apr 24, 2019)."
Acquisition of a mental strategy to control a virtual tail via brain–computer interface,"Fujisawa, Ayaka; Kasuga, Shoko; Suzuki, Takaharu; Ushiba, Junichi.","Cognitive Neuroscience Vol. 10, Iss. 1,  (Jan 2019): 30-43."
Loss of control as a violation of expectations: Testing the predictions of a common inconsistency compensation approach in an inclusionary cyberball game,"Niedeggen, Michael; Kerschreiter, Rudolf; Schuck, Katharina.","PLoS One; San Francisco Vol. 14, Iss. 9,  (Sep 2019): e0221817."
Neural correlates of decision making related to information security: Self-control and moral potency,"West, Robert; Budde, Emily; Hu, Qing.","PLoS One; San Francisco Vol. 14, Iss. 9,  (Sep 2019): e0221808."
The effect of prioritization over cognitive-motor interference in people with relapsing-remitting multiple sclerosis and healthy controls,"Postigo-Alonso, Barbara; Galvao-Carmona, Alejandro; Conde-Gavilán, Cristina; Jover, Ana; Molina, Silvia; et al.","PLoS One; San Francisco Vol. 14, Iss. 12,  (Dec 2019): e0226775."
The Electrical Aftermath: Brain Signals of Posttraumatic Stress Disorder Filtered Through a Clinical Lens.,"Butt, Mamona; Espinal, Elizabeth; Aupperle, Robin L; Nikulina, Valentina; Stewart, Jennifer L; et al.","Frontiers in psychiatry Vol. 10,  (2019): 368."
Error-preceding brain activity links neural markers of task preparation to cognitive stability and flexibility,"Steinhauser, Robert; Steinhauser, Marco.","NeuroImage; Amsterdam Vol. 197,  (Aug 15, 2019): 344-353."
Electrophysiological correlates of concept type shifts,"Bekemeier, Natalia; ⨯ Dorothea Brenner; Klepp, Anne; Biermann-Ruben, Katja; Indefrey, Peter.","PLoS One; San Francisco Vol. 14, Iss. 3,  (Mar 2019): e0212624."
Forging neuroimaging targets for recovery in opioid use disorder,"Stewart, Jennifer L; May, April C; Aupperle, Robin L; Bodurka, Jerzy.","Frontiers in Psychiatry Vol. 10,  (Mar 7, 2019)."
Sensory and Cognitive Components of Auditory Processing in Individuals With Tinnitus,"Vasudevan, Harini; Palaniswamy, Hari Prakash; Balakrishnan, Ramaswamy.","American Journal of Audiology (Online); Rockville Vol. 28, Iss. 4,  (Dec 2019): 834-842."
Differences in the emotional conflict task between individuals with high and low social adjustment: An ERP study,"Yuan-Yan, Hu; Jun-Cheng, Zhu; Ge, Ying; Wen-Bo Luo; Tian-Tian, Liu; et al.","PLoS One; San Francisco Vol. 14, Iss. 6,  (Jun 2019): e0217962."
Intense and sustained pain reduces cortical responses to auditory stimuli: Implications for the interpretation of the effects of heterotopic noxious conditioning stimulation in humans,"Torta, Diana M; Jure, Fabricio A; Andersen, Ole K; Biurrun Manresa, José A. B.","European Journal of Neuroscience Vol. 50, Iss. 12,  (Dec 2019): 3934-3943. [Duplicate]"
Reactivation of previous experiences in a working memory task,"Bae, Gi-Yeul; Luck, Steven J.","Psychological Science Vol. 30, Iss. 4,  (Apr 2019): 587-595."
Semantic processing in children with cochlear implants: Evidence from event-related potentials,"Bell, Nicola; Angwin, Anthony J; Arnott, Wendy L; Wilson, Wayne J.","Journal of Clinical and Experimental Neuropsychology Vol. 41, Iss. 6,  (Aug 2019): 576-590."
Effects of methylphenidate treatment in children with ADHD: a multimodal EEG/fNIRS approach,"Dolu, Nazan; Altınkaynak, Miray; Güven, Ayşegül; Özmen, Sevgi; Demirci, Esra; et al.","Psychiatry and Clinical Psychopharmacology; Istanbul Vol. 29, Iss. 3,  (Sep 2019): 285-292."
ERP evidence of semantic processing in children with ASD,"DiStefano, Charlotte; Senturk, Damla; Jeste, Shafali Spurling.","Developmental Cognitive Neuroscience Vol. 36,  (Apr 2019)."
An event-related potential comparison of facial expression processing between cartoon and real faces,"Zhao, Jiayin; ⨯ Qi Meng; An, Licong; Wang, Yifang.","PLoS One; San Francisco Vol. 14, Iss. 1,  (Jan 2019): e0198868."
Mental workload of young and older adults gauged with ERPs and spectral power during N-back task performance,"Pergher, Valentina; Wittevrongel, Benjamin; Tournoy, Jos; Schoenmakers, Birgitte; Van Hulle, Marc M.","Biological Psychology Vol. 146,  (Sep 2019)."
The neurophysiology of schizophrenia: Current update and future directions,"Fisher, Derek J; Salisbury, Dean F.","International Journal of Psychophysiology Vol. 145,  (Nov 2019): 1-4."
"Cost-Efficient, Portable, and Custom Multi-Subject Electroencephalogram Recording System","Kai-Chiang Chuang; Yuan-Pin, Lin.","IEEE Access; Piscataway Vol. 7,  (2019): 56760-56769."
Towards a Pragmatic Approach to a Psychophysiological Unit of Analysis for Mental and Brain Disorders: An EEG-Copeia for Neurofeedback,"Jean-Arthur Micoulaud-Franchi; Batail, Jean-Marie; Fovet, Thomas; Pierre, Philip; Cermolacce, Michel; et al.","Applied Psychophysiology and Biofeedback; New York Vol. 44, Iss. 3,  (Sep 2019): 151-172."
Use of prosocial word enhances the processing of language: Frequency domain analysis of human EEG,"Tarai, Shashikanta; Mukherjee, Rupsha; Qurratul, Quais Ain; Singh, Bikesh Kumar; Bit, Arindam.","Journal of Psycholinguistic Research Vol. 48, Iss. 1,  (Feb 15, 2019): 145-161."
Disruption of volitional control in obsessive-compulsive disorder: Evidence from the Bereitschaftspotential,"Takashima, Shiro; Najman, Fernando Araujo; Ramos, Renato Teodoro.","Psychiatry Research: Neuroimaging Vol. 290,  (Aug 30, 2019): 30-37."
Mobile EEG in research on neurodevelopmental disorders: Opportunities and challenges,"Lau-Zhu, Alex; Lau, Michael P. H; McLoughlin, Gráinne.","Developmental Cognitive Neuroscience Vol. 36,  (Apr 2019)."
Visual working memory load disrupts the space‐based attentional guidance of target selection,"Berggren, Nick; Eimer, Martin.","British Journal of Psychology Vol. 110, Iss. 2,  (May 2019): 357-371."
Processing of affective words in adolescent PTSD—Attentional bias toward social threat,"Klein, Fabian; Schindler, Sebastian; Neuner, Frank; Rosner, Rita; Renneberg, Babette; et al.","Psychophysiology Vol. 56, Iss. 11,  (Nov 2019)."
The role of emotion arousal in the retrieval practice effect,"Jia, Xi; Gao, Chuanji; Cui, Lixia; Guo, Chunyan.","Experimental Brain Research Vol. 237, Iss. 12,  (Dec 2019): 3241-3252."
"EEG-based brain functional connectivity in first-episode schizophrenia patients, ultra-high-risk individuals, and healthy controls during P50 suppression","Chang, Qi; Liu, Meijun; Tian, Qing; Wang, Hua; Luo, Yu; et al.","Frontiers in Human Neuroscience Vol. 13,  (Nov 14, 2019)."
Lexical prediction in the aging brain: The effects of predictiveness and congruency on the N400 ERP component,"Cheimariou, Spyridoula; Farmer, Thomas A; Gordon, Jean K.","Aging, Neuropsychology, and Cognition Vol. 26, Iss. 5,  (Sep 2019): 781-806."
Attending to Eliza: Rapid brain responses reflect competence attribution in virtual social feedback processing,"Schindler, Sebastian; Miller, Gregory A; Kissler, Johanna.","Social Cognitive and Affective Neuroscience Vol. 14, Iss. 10,  (Oct 2019): 1073-1086."
Dataset of 24-subject EEG recordings during viewing of real-world objects and planar images of the same items,"Marini, Francesco; Breeding, Katherine A; Snow, Jacqueline C.","Data in Brief Vol. 24,  (Jun 2019)."
Effects of methylphenidate on the ERP amplitude in youth with ADHD: A double-blind placebo-controlled cross-over EEG study,"Rubinson, Mica; Horowitz, Itai; Naim-Feil, Jodie; Gothelf, Doron; Levit-Binnun, Nava; et al.","PLoS ONE Vol. 14, Iss. 5,  (May 31, 2019)."
Neural Processes of Proactive and Reactive Controls Modulated by Motor-Skill Experiences,"Yu, Qiuhua; Chau, Bolton K H; Lam, Bess Y H; Wong, Alex W K; Peng, Jiaxin; et al.","Frontiers in Human Neuroscience; Lausanne (Nov 14, 2019)."
Neurocognitive performance is enhanced during short periods of microgravity—Part 2,"Wollseiffen, Petra; Klein, Timo; Vogt, Tobias; Abeln, Vera; Strüder, Heiko K; et al.","Physiology & Behavior Vol. 207,  (Aug 1, 2019): 48-54."
Encoding pleasant and unpleasant expression of the architectural window shapes: An ERP study,"Naghibi Rad, Parastou; Shahroudi, Abbas Ali; Shabani, Hamed; Ajami, Sahar; Lashgari, Reza.","Frontiers in Behavioral Neuroscience Vol. 13,  (Aug 16, 2019)."
Breakthrough percepts of famous faces,"Alsufyani, Abdulmajeed; Hajilou, Omid; Zoumpoulaki, Alexia; Filetti, Marco; Alsufyani, Hamed; et al.","Psychophysiology Vol. 56, Iss. 1,  (Jan 2019): 20."
