Title,Authors,Journal
Dysfunctional gamma-band activity during face structural processing in schizophrenia patients,"Lee, Seung-Hwan; Kim, Do-Won; Kim, Eun-Young; Kim, Sangrae; Im, Chang-Hwan.","Schizophrenia Research Vol. 119, Iss. 1-3,  (Jun 2010): 191-197."
We remember the good things: Age differences in learning and memory,"Eppinger, Ben; Herbert, Michael; Kray, Jutta.","Neurobiology of Learning and Memory Vol. 93, Iss. 4,  (May 2010): 515-521."
Evidence for specificity of ERP abnormalities during response inhibition in ADHD children: A comparison with reading disorder children without ADHD,"Liotti, Mario; Pliszka, Steven R; Higgins, Kellie; Perez, Ricardo, III; Semrud-Clikeman, Margaret.","Brain and Cognition Vol. 72, Iss. 2,  (Mar 2010): 228-237."
"A high-density ERP study reveals latency, amplitude, and topographical differences in multiple sclerosis patients versus controls","Whelan, R; Lonergan, R; Kiiski, H; Nolan, H; Kinsella, K; et al.","Clinical Neurophysiology Vol. 121, Iss. 9,  (Sep 2010): 1420-1426."
Evidence for a new late positive ERP component in an attended novelty oddball task,"McDonald, Craig G; Gabbay, Frances H; Rietschel, Jeremy C; Duncan, Connie C.","Psychophysiology Vol. 47, Iss. 5,  (Sep 2010): 809-813."
Re-evaluating the time course of gender and phonological encoding during silent monitoring tasks estimated by ERP: Serial or parallel processing?,"Camen, Christian; Morand, Stéphanie; Laganaro, Marina.","Journal of Psycholinguistic Research Vol. 39, Iss. 1,  (Feb 2010): 35-49."
Individual differences in error monitoring in healthy adults: Psychological symptoms and antisocial personality characteristics,"Chang, Wen-Pin; Davies, Patricia L; Gavin, William J.","European Journal of Neuroscience Vol. 32, Iss. 8,  (Oct 2010): 1388-1396."
"Individual differences in face recognition memory: Comparison among habitual short, average, and long sleepers","Mograss, Melodee A; Guillem, Francois; Stickgold, Robert.","Behavioural Brain Research Vol. 208, Iss. 2,  (Apr 2, 2010): 576-583."
The effect of face inversion on intracranial and scalp recordings of event-related potentials,"Rosburg, Timm; Ludowig, Eva; Dümpelmann, Matthias; Alba-Ferrara, Lucia; Urbach, Horst; et al.","Psychophysiology Vol. 47, Iss. 1,  (Jan 2010): 147-157."
Modeling single-trial LRP waveforms using gamma functions,"Stahl, Jutta; Gibbons, Henning; Miller, Jeff.","Psychophysiology Vol. 47, Iss. 1,  (Jan 2010): 43-56."
Involuntary switching of attention mediates differences in event-related responses to complex tones between early and late Spanish–English bilinguals,"Ortiz-Mantilla, Silvia; Choudhury, Naseem; Alvarez, Barbara; Benasich, April A.","Brain Research Vol. 1362,  (Nov 29, 2010): 78-92."
Learning to use words: Event-related potentials index single-shot contextual word learning,"Borovsky, Arielle; Kutas, Marta; Elman, Jeff.","Cognition Vol. 116, Iss. 2,  (Aug 2010): 289-296."
Cognitive function and event-related potentials in children with type 1 diabetes mellitus,"Shehata, Ghaydaa; Eltayeb, Azza.","Journal of Child Neurology Vol. 25, Iss. 4,  (Apr 2010): 469-474."
Posterior N1 asymmetry to English and Welsh words in early and late English–Welsh bilinguals,"Grossi, Giordana; Savill, Nicola; Thomas, Enlli; Thierry, Guillaume.","Biological Psychology Vol. 85, Iss. 1,  (Sep 2010): 124-133."
An ERP investigation of task switching using a flanker paradigm,"Umebayashi, Kaoru; Okita, Tsunetaka.","Brain Research Vol. 1346,  (Jul 30, 2010): 165-173."
Semantic event-related potential components reflect severity of comprehension deficits in aphasia,"Kawohl, W; Bunse, S; Willmes, K; Hoffrogge, A; Buchner, H; et al.","Neurorehabilitation and Neural Repair Vol. 24, Iss. 3,  (Mar 2010 - Apr 2010): 282-289."
Electrophysiological correlates of emotional responding in schizophrenia,"Horan, William P; Wynn, Jonathan K; Kring, Ann M; Simons, Robert F; Green, Michael F.","Journal of Abnormal Psychology Vol. 119, Iss. 1,  (Feb 2010): 18-30."
Event-related potentials show online influence of lexical biases on prosodic processing,"Itzhak, Inbal; Pauker, Efrat; Drury, John E; Baum, Shari R; Steinhauer, Karsten.","NeuroReport: For Rapid Communication of Neuroscience Research Vol. 21, Iss. 1,  (Jan 6, 2010): 8-13."
Modality-specific control processes in verbal versus spatial working memory,"Watter, Scott; Heisz, Jennifer J; Karle, James W; Shedden, Judith M; Kiss, Ivan.","Brain Research Vol. 1347,  (Aug 6, 2010): 90-103."
Attentional focus during learning impacts N170 ERP responses to an artificial script,"Yoncheva, Yuliya N; Blau, Vera C; Maurer, Urs; McCandliss, Bruce D.","Developmental Neuropsychology Vol. 35, Iss. 4,  (Jul 2010): 423-445."
Reaction-time binning: A simple method for increasing the resolving power of ERP averages,"Poli, Riccardo; Cinel, Caterina; Citi, Luca; Sepulveda, Francisco.","Psychophysiology Vol. 47, Iss. 3,  (May 2010): 467-485."
An event-related brain potential study of schizotypal personality and associative semantic processing,"Kiang, Michael; Prugh, Jocelyn; Kutas, Marta.","International Journal of Psychophysiology Vol. 75, Iss. 2,  (Feb 2010): 119-126."
Electroencephalogram and event-related potentials in the selective attention paradigm as related to the levels of some metabolites in the prefrontal cortex,"Lebedeva, I. S; Semenova, N. A; Petryaikin, A. V; Agrafonov, A. Yu; Mitrofanov, A. A; et al.","Human Physiology Vol. 36, Iss. 6,  (Nov 2010): 638-644."
The influence of the diffusion of responsibility effect on outcome evaluations: Electrophysiological evidence from an ERP study,"Li, Peng; Jia, Shiwei; Feng, Tingyong; Liu, Qiang; Suo, Tao; et al.","NeuroImage Vol. 52, Iss. 4,  (Oct 1, 2010): 1727-1733."
Language suppression effects on the categorical perception of Colour as evidenced through ERPs,"Liu, Qiang; Li, Hong; Campos, Jennifer L; Teeter, Christopher; Tao, Weidong; et al.","Biological Psychology Vol. 85, Iss. 1,  (Sep 2010): 45-52."
Capture versus suppression of attention by salient singletons: Electrophysiological evidence for an automatic attend-to-me signal,"Sawaki, Risa; Luck, Steven J.","Attention, Perception, & Psychophysics Vol. 72, Iss. 6,  (Aug 2010): 1455-1470."
Attention to novel and target stimuli in trauma survivors.,"Kimble, Matthew O; Fleming, Kevin; Bandy, Carole; Zambetti, A; National Library of Medicine.","Psychiatry research Vol. 178, Iss. 3,  (August 15, 2010): 501-506."
A case study on the relation between electroencephalographic and electrocorticographic event-related potentials.,"Krusienski, Dean J; Shih, Jerry J; National Library of Medicine.","Annual International Conference of the IEEE Engineering in Medicine and Biology Society. IEEE Engineering in Medicine and Biology Society. Annual International Conference Vol. 2010,  (2010): 6019-6022."
Genetic feature selection to optimally detect P300 in brain computer interfaces.,"Atum, Yanina; Gareis, Iván; Gentiletti, Gerardo; Acevedo, Rubén; Rufiner, Leonardo; et al.","Annual International Conference of the IEEE Engineering in Medicine and Biology Society. IEEE Engineering in Medicine and Biology Society. Annual International Conference Vol. 2010,  (2010): 3289-3292."
"Activity of hippocampal, amygdala, and neocortex during the Rey auditory verbal learning test: An event-related potential study in epileptic patients","Babiloni, Claudio; Vecchio, Fabrizio; Mirabella, Giovanni; Sebastiano, Fabio; Di Gennaro, Giancarlo; et al.","Clinical Neurophysiology Vol. 121, Iss. 8,  (Aug 2010): 1351-1357."
Influence of coherence between multiple cortical columns on alpha rhythm: A computational modeling study,"Naruse, Yasushi; Matani, Ayumu; Miyawaki, Yoichi; Okada, Masato.","Human Brain Mapping Vol. 31, Iss. 5,  (May 2010): 703-715."
"Anxiety not only increases, but also alters early error-monitoring functions","Aarts, Kristien; Pourtois, Gilles.","Cognitive, Affective & Behavioral Neuroscience Vol. 10, Iss. 4,  (2010): 479-492."
Mismatch negativity and P300 to behaviorally perceptible and imperceptible temporal contrasts.,"White, Letitia; Stuart, Andrew; Najem, Fadi; National Library of Medicine.","Perceptual and motor skills Vol. 110, Iss. 3 Pt 2,  (June 2010): 1105-1118."
EEG findings in burnout patients,"van Luijtelaar, Gilles; Verbraak, Marc; van den Bunt, Martijn; Keijsers, Ger; Arns, Martijn.","The Journal of Neuropsychiatry and Clinical Neurosciences Vol. 22, Iss. 2,  (Apr 2010 - Jun 2010): 208-217."
Pain assessment by continuous EEG: Association between subjective perception of tonic pain and peak frequency of alpha oscillations during stimulation and at rest,"Nir, Rony-Reuven; Sinai, Alon; Raz, Einat; Sprecher, Elliot; Yarnitsky, David.","Brain Research Vol. 1344,  (Jul 16, 2010): 77-86."
Neural Correlates of Error Monitoring in an Adult With Klinefelter's Syndrome: a Case Report,"Chang, W-P.","Clinical EEG and Neuroscience Vol. 41, Iss. 3,  (Jul 2010): 155-158."
Removal of BCG artifacts from EEG recordings inside the MR scanner: A comparison of methodological and validation-related aspects,"Vanderperren, Katrien; De Vos, Maarten; Ramautar, Jennifer R; Novitskiy, Nikolay; Mennes, Maarten; et al.","NeuroImage Vol. 50, Iss. 3,  (Apr 15, 2010): 920-934."
"Responsiveness to distracting stimuli, though increased in Parkinson's disease, is decreased in asymptomatic PINK1 and Parkin mutation carriers","Verleger, Rolf; Hagenah, Johann; Weiss, Manuel; Ewers, Thomas; Heberlein, Ilse; et al.","Neuropsychologia Vol. 48, Iss. 2,  (Jan 2010): 467-476."
Predictive mechanisms in idiom comprehension,"Vespignani, Francesco; Canal, Paolo; Molinaro, Nicola; Fonda, Sergio; Cacciari, Cristina.","Journal of Cognitive Neuroscience Vol. 22, Iss. 8,  (Aug 2010): 1682-1700."
Implicit phonological and semantic processing in children with developmental dyslexia: Evidence from event-related potentials,"Jednoróg, K; Marchewka, A; Tacikowski, P; Grabowska, A.","Neuropsychologia Vol. 48, Iss. 9,  (Jul 2010): 2447-2457."
Light up and see: Enhancement of the visual mismatch negativity (vMMN) by nicotine,"Fisher, Derek J; Scott, Terri Lynne; Shah, Dhrasti K; Prise, Stephanie; Thompson, Mackenzie; et al.","Brain Research Vol. 1313,  (Feb 8, 2010): 162-171."
FRN and P300 ERP effect modulation in response to feedback sensitivity: The contribution of punishment-reward system (BIS/BAS) and behaviour identification of action,"Balconi, Michela; Crivelli, Davide.","Neuroscience Research Vol. 66, Iss. 2,  (Feb 2010): 162-172."
Cortical gamma-oscillations modulated by listening and overt repetition of phonemes,"Fukuda, Miho; Rothermel, Robert; Juhász, Csaba; Nishida, Masaaki; Sood, Sandeep; et al.","NeuroImage Vol. 49, Iss. 3,  (Feb 1, 2010): 2735-2745."
Association study of catechol-O-methyltransferase (COMT) gene Val158Met polymorphism with auditory P300 in Chinese Han patients with schizophrenia.,"Kang, ChuanYuan; Xu, XiuFeng; Liu, Hua; Yang, JianZhong; National Library of Medicine.","Psychiatry research Vol. 180, Iss. 2-3,  (December 30, 2010): 153-155."
The role of temporal predictability in the anticipatory biasing of sensory cortex during visuospatial shifts of attention,"Green, Jessica J; McDonald, John J.","Psychophysiology Vol. 47, Iss. 6,  (Nov 2010): 1057-1065."
Hemispheric differences in the recruitment of semantic processing mechanisms,"Kandhadai, Padmapriya; Federmeier, Kara D.","Neuropsychologia Vol. 48, Iss. 13,  (Nov 2010): 3772-3781."
The role of awareness in semantic and syntactic processing: An ERP attentional blink study,"Batterink, Laura; Karns, Christina M; Yamada, Yoshiko; Neville, Helen.","Journal of Cognitive Neuroscience Vol. 22, Iss. 11,  (Nov 2010): 2514-2529."
"Anxiety and outcome evaluation: The good, the bad and the ambiguous","Gu, Ruolei; Ge, Yue; Jiang, Yang; Luo, Yue-jia.","Biological Psychology Vol. 85, Iss. 2,  (Oct 2010): 200-206."
The own-sex effect in facial expression recognition,"Doi, Hirokazu; Amamoto, Takaaki; Okishige, Yuuka; Kato, Mikako; Shinohara, Kazuyuki.","NeuroReport: For Rapid Communication of Neuroscience Research Vol. 21, Iss. 8,  (Jun 2, 2010): 564-568."
Semantic integration during metaphor comprehension in Asperger syndrome,"Gold, Rinat; Faust, Miriam; Goldstein, Abraham.","Brain and Language Vol. 113, Iss. 3,  (Jun 2010): 124-134."
Cigarette cues capture smokers' attention: Evidence from event-related potentials,"Versace, Francesco; Robinson, Jason D; Lam, Cho Y; Minnix, Jennifer A; Brown, Victoria L; et al.","Psychophysiology Vol. 47, Iss. 3,  (May 2010): 435-441."
A New Auditory Multi-Class Brain-Computer Interface Paradigm: Spatial Hearing as an Informative Cue,"Schreuder, Martijn; Blankertz, Benjamin; Tangermann, Michael.","PLoS One; San Francisco Vol. 5, Iss. 4,  (Apr 2010): e9813."
Effects of symbol type and numerical distance on the human event-related potential,"Jiang, Ting; Qiao, Sibing; Li, Jin; Cao, Zhongyu; Gao, Xuefei; et al.","Neuropsychologia Vol. 48, Iss. 1,  (Jan 2010): 201-210."
Event-related potential measures of processing during an Implicit Association Test,"Coates, Mark A; Campbell, Kenneth B.","NeuroReport: For Rapid Communication of Neuroscience Research Vol. 21, Iss. 16,  (Nov 17, 2010): 1029-1033."
Task switching performance reveals heterogeneity amongst patients with mild cognitive impairment,"Sinai, Marco; Phillips, Natalie A; Chertkow, Howard; Kabani, Noor Jehan.","Neuropsychology Vol. 24, Iss. 6,  (Nov 2010): 757-774."
Selective attention modulates face-specific induced gamma oscillations recorded from ventral occipitotemporal cortex,"Engell, Andrew D; McCarthy, Gregory.","The Journal of Neuroscience Vol. 30, Iss. 26,  (Jun 30, 2010): 8780-8786."
The amount of retrieval support modulates age effects on episodic memory: Evidence from event-related potentials,"Angel, Lucie; Isingrini, Michel; Bouazzaoui, Badiâa; Taconnat, Laurence; Allan, Kevin; et al.","Brain Research Vol. 1335,  (Jun 4, 2010): 41-52."
ADHD children outperform normal children in an artificial grammar implicit learning task: ERP and RT evidence,"Rosas, Ricardo; Ceric, Francisco; Tenorio, Marcela; Mourgues, Catalina; Thibaut, Carolina; et al.","Consciousness and Cognition: An International Journal Vol. 19, Iss. 1,  (Mar 2010): 341-351."
"Relationship between the P3 event-related potential, its associated time-frequency components, and externalizing psychopathology","Gilmore, Casey S; Malone, Stephen M; Bernat, Edward M; Iacono, William G.","Psychophysiology Vol. 47, Iss. 1,  (Jan 2010): 123-132."
Individualized EEG source reconstruction of Stroop interference with masked color words,"Bruchmann, Maximilian; Herper, Kristin; Konrad, Carsten; Pantev, Christo; Huster, Rene J.","NeuroImage Vol. 49, Iss. 2,  (Jan 15, 2010): 1800-1809."
An ERP study of age-related differences in the central cost of interlimb coordination,"Fujiyama, Hakuei; Garry, Mike I; Martin, Frances H; Summers, Jeffery J.","Psychophysiology Vol. 47, Iss. 3,  (May 2010): 501-511."
The hybrid BCI,"Pfurtscheller, Gert; Allison, Brendan Z; Bauernfeind, Günther; Brunner, Clemens; Solis Escalante, Teodoro; et al.","Frontiers in Neuroscience; Lausanne (Apr 21, 2010)."
Separating distinct aspects of the voluntary selection between response alternatives: N2- and P3-related BOLD responses,"Karch, Susanne; Feuerecker, Regina; Leicht, Gregor; Meindl, Thomas; Hantschk, Irmgard; et al.","NeuroImage Vol. 51, Iss. 1,  (May 15, 2010): 356-364."
Event-related brain potentials to violations of arithmetic syntax represented by place value structure,"Szűcs, Dénes; Soltész, Fruzsina.","Biological Psychology Vol. 84, Iss. 2,  (May 2010): 354-367."
ERP evidence for distinct mechanisms of fast and slow visual perceptual learning,"Qu, Zhe; Song, Yan; Ding, Yulong.","Neuropsychologia Vol. 48, Iss. 6,  (May 2010): 1869-1874."
Current source density (CSD) old/new effects during recognition memory for words and faces in schizophrenia and in healthy adults,"Kayser, Jürgen; Tenke, Craig E; Kroppmann, Christopher J; Fekri, Shiva; Alschuler, Daniel M; et al.","International Journal of Psychophysiology Vol. 75, Iss. 2,  (Feb 2010): 194-210."
P300 Chinese input system based on Bayesian LDA.,"Jin, Jing; Allison, Brendan Z; Brunner, Clemens; Wang, Bei; Wang, Xingyu; et al.","Biomedizinische Technik. Biomedical engineering Vol. 55, Iss. 1,  (February 2010): 5-18."
Psychophysiology of spider phobia in 8- to 12-year-old girls,"Leutgeb, Verena; Schäfer, Axel; Köchel, Angelika; Scharmüller, Wilfried; Schienle, Anne.","Biological Psychology Vol. 85, Iss. 3,  (Dec 2010): 424-431."
When your errors make me lose or win: Event-related potentials to observed errors of cooperators and competitors,"Koban, Leonie; Pourtois, Gilles; Vocat, Roland; Vuilleumier, Patrik.","Social Neuroscience Vol. 5, Iss. 4,  (Aug 2010): 360-374."
To switch or not to switch: Brain potential indices of attentional control after task-relevant and task-irrelevant changes of stimulus features,"Hölig, Cordula; Berti, Stefan.","Brain Research Vol. 1345,  (Jul 23, 2010): 164-175."
Brain activity during emotion perception: The role of attachment representation,"Fraedrich, Eva M; Lakatos, Krisztina; Spangler, Gottfried.","Attachment & Human Development Vol. 12, Iss. 3,  (May 2010): 231-248."
Excessive sub-threshold motor preparation for non-target stimuli in normal aging,"Vallesi, Antonino; Stuss, Donald T.","NeuroImage Vol. 50, Iss. 3,  (Apr 15, 2010): 1251-1257."
"Anterior cingulum volumetry, auditory P300 in schizophrenia with negative symptoms.","Preuss, Ulrich W; Zetzsche, Thomas; Pogarell, Oliver; Mulert, Christoph; Frodl, Thomas; et al.","Psychiatry research Vol. 183, Iss. 2,  (August 30, 2010): 133-139."
A telepresence robotic system operated with a P300-based brain-computer interface: initial tests with ALS patients.,"Escolano, Carlos; Ramos Murguialday, Ander; Matuz, Tamara; Birbaumer, Niels; Minguez, Javier; et al.","Annual International Conference of the IEEE Engineering in Medicine and Biology Society. IEEE Engineering in Medicine and Biology Society. Annual International Conference Vol. 2010,  (2010): 4476-4480."
EEG sensor selection by sparse spatial filtering in P300 speller brain-computer interface.,"Rivet, Bertrand; Cecotti, Hubert; Phlypo, Ronald; Bertrand, Olivier; Maby, Emmanuel; et al.","Annual International Conference of the IEEE Engineering in Medicine and Biology Society. IEEE Engineering in Medicine and Biology Society. Annual International Conference Vol. 2010,  (2010): 5379-5382."
[The investigation of event-related brain potentials in malingered neurocognitive deficit].,"Guo, Lei; Cheng, Zao-Huo; Liu, Xin-Min; National Library of Medicine.","Fa yi xue za zhi Vol. 26, Iss. 5,  (October 2010): 364-6, 373."
Individual differences in nonverbal number discrimination correlate with event-related potentials and measures of probabilistic reasoning,"Paulsen, David J; Woldorff, Marty G; Brannon, Elizabeth M.","Neuropsychologia Vol. 48, Iss. 13,  (Nov 2010): 3687-3695."
An event-related potential paradigm for identifying (rare negative) attitude stimuli that people intentionally misreport,"Crites, Stephen L., Jr; Mojica, Andrew J; Corral, Guadalupe; Taylor, Jennifer H.","Psychophysiology Vol. 47, Iss. 5,  (Sep 2010): 984-988."
Emotion brain alterations in anorexia nervosa: A candidate biological marker and implications for treatment,"Hatch, Ainslie; Madden, Sloane; Kohn, Michael R; Clarke, Simon; Touyz, Stephen; et al.","Journal of Psychiatry & Neuroscience Vol. 35, Iss. 4,  (Jul 2010): 267-274."
Varying required effort during interference control in children with AD/HD: Task performance and ERPs,"Johnstone, Stuart J; Watt, Annele J; Dimoska, Aneta.","International Journal of Psychophysiology Vol. 76, Iss. 3,  (Jun 2010): 174-185."
Cognitive load reduces visual identity negative priming by disabling the retrieval of task-inappropriate prime information: An ERP study,"Gibbons, Henning; Stahl, Jutta.","Brain Research Vol. 1330,  (May 12, 2010): 101-113."
Electrophysiological correlates of figure-ground segregation directly reflect perceptual saliency,"Straube, Sirko; Grimsen, Cathleen; Fahle, Manfred.","Vision Research Vol. 50, Iss. 5,  (20100305): 509-521."
Electrical neuroimaging evidence that spatial frequency-based selective attention affects V1 activity as early as 40-60 ms in humans,"Proverbio, Alice M; Del Zotto, Marzia; Zani, Alberto.","BMC Neuroscience Vol. 11,  (May 6, 2010): 59-59."
"Spontaneous EEG Oscillations in Children, Adolescents, and Adults: Typical Development, and Pathological Aspects in Relation to AD/HD","Barry, Robert J; Clarke, Adam R.","Journal of Psychophysiology Vol. 23, Iss. 4,  (2010): 157-173."
Electrophysiological indices of abnormal error-processing in adolescents with attention deficit hyperactivity disorder (ADHD),"Groom, Madeleine J; Cahill, John D; Bates, Alan T; Jackson, Georgina M; Calton, Timothy G; et al.","Journal of Child Psychology and Psychiatry and Allied Disciplines Vol. 51, Iss. 1,  (Jan 2010): 66-76."
Reduced resource optimization in male alcoholics: N400 in a lexical decision paradigm,"Roopesh, Bangalore N; Rangaswamy, Madhavi; Kamarajan, Chella; Chorlian, David B; Pandey, Ashwini K; et al.","Alcoholism: Clinical and Experimental Research Vol. 34, Iss. 11,  (Nov 2010): 1905-1914."
ERPs on a continuous performance task and self-reported psychopathic traits: P3 and CNV augmentation are associated with Fearless Dominance,"Carlson, Scott R; Thái, Stephanie.","Biological Psychology Vol. 85, Iss. 2,  (Oct 2010): 318-330."
The interaction of anticipatory anxiety and emotional picture processing: An event-related brain potential study,"Bublatzky, Florian; Flaisch, Tobias; Stockburger, Jessica; Schmälzle, Ralf; Schupp, Harald T.","Psychophysiology Vol. 47, Iss. 4,  (Jul 2010): 687-696."
Pitch accent type affects the N400 during referential processing,"Schumacher, Petra B; Baumann, Stefan.","NeuroReport: For Rapid Communication of Neuroscience Research Vol. 21, Iss. 9,  (Jun 23, 2010): 618-622."
The interaction between pictures and words: evidence from positivity offset and negativity bias,"Liu, Baolin; Jin, Zhixing; Wang, Zhongning; Hu, Yu.","Experimental Brain Research; Heidelberg Vol. 201, Iss. 2,  (Mar 2010): 141-53."
Attentional control moderates relations between negative affect and neural correlates of action monitoring in adolescence,"Ladouceur, Cecile D; Conway, Anne; Dahl, Ronald E.","Developmental Neuropsychology Vol. 35, Iss. 2,  (Feb 2010): 194-211."
Emotional context modulates response inhibition: Neural and behavioral data,"Albert, Jacobo; López-Martín, Sara; Carretié, Luis.","NeuroImage Vol. 49, Iss. 1,  (Jan 1, 2010): 914-921."
Event-related potential responses to metric violations: rules versus meaning,"Rothermich, K; Schmidt-Kassow, M; Schwartze, M; Kotz, SA.","Neuroreport Vol. 21, Iss. 8,  (Jun 2, 2010): 580-584."
Electrophysiological changes during adolescence: A review,"Segalowitz, Sidney J; Santesso, Diane L; Jetha, Michelle K.","Brain and Cognition Vol. 72, Iss. 1,  (Feb 2010): 86-100."
On the temporal organization of facial identity and expression analysis: Inferences from event-related brain potentials,"Martens, Ulla; Leuthold, Hartmut; Schweinberger, Stefan R.","Cognitive, Affective & Behavioral Neuroscience Vol. 10, Iss. 4,  (Dec 2010): 505-522."
The influence of mood on the processing of syntactic anomalies: Evidence from P600,"Vissers, Constance Th. W. M; Virgillito, Daniele; Fitzgerald, Daniel A; Speckens, Anne E. M; Tendolkar, Indira; et al.","Neuropsychologia Vol. 48, Iss. 12,  (Oct 2010): 3521-3531."
A single high dose of escitalopram increases mismatch negativity without affecting processing negativity or P300 amplitude in healthy volunteers,"Wienberg, M; Glenthoj, B. Y; Jensen, K. S; Oranje, B.","Journal of Psychopharmacology Vol. 24, Iss. 8,  (Aug 2010): 1183-1192."
"Learning task affects ERP-correlates of the own-race bias, but not recognition memory performance","Stahl, Johanna; Wiese, Holger; Schweinberger, Stefan R.","Neuropsychologia Vol. 48, Iss. 7,  (Jun 2010): 2027-2040."
Experience-dependent neural specialization during infancy,"Scott, Lisa S; Monesson, Alexandra.","Neuropsychologia Vol. 48, Iss. 6,  (May 2010): 1857-1861."
Tracking lexical access in speech production: Electrophysiological correlates of word frequency and cognate effects,"Strijkers, Kristof; Costa, Albert; Thierry, Guillaume.","Cerebral Cortex Vol. 20, Iss. 4,  (Apr 2010): 912-928."
The effect of short-term training on cardinal and oblique orientation discrimination: An ERP study,"Song, Yan; Sun, Li; Wang, You; Zhang, Xuemin; Kang, Jing; et al.","International Journal of Psychophysiology Vol. 75, Iss. 3,  (Mar 2010): 241-248."
Coordinated Roles of Motivation and Perception in the Regulation of Intergroup Responses: Frontal Cortical Asymmetry Effects on the P2 Event-related Potential and Behavior,"Amodio, David M.","Journal of Cognitive Neuroscience Vol. 22, Iss. 11,  (Nov 2010): 2609-2617."
Feedback-related negativity is correlated with unplanned impulsivity,"Onoda, K; Abe, S; Yamaguchi, S.","Neuroreport Vol. 21, Iss. 10,  (Jul 14, 2010): 736-739."
Comparing ICA-based and Single-Trial Topographic ERP Analyses,"Lucia, Marzia; Michel, Christoph M; Murray, Micah M.","Brain Topography Vol. 23, Iss. 2,  (Jun 2010): 119-127."
Listening to the sound of silence: Disfluent silent pauses in speech have consequences for listeners,"MacGregor, Lucy J; Corley, Martin; Donaldson, David I.","Neuropsychologia Vol. 48, Iss. 14,  (Dec 2010): 3982-3992."
The N400-concreteness effect reflects the retrieval of semantic information during the preparation of meaningful actions,"van Elk, M; van Schie, H. T; Bekkering, H.","Biological Psychology Vol. 85, Iss. 1,  (Sep 2010): 134-142."
Effects of adolescent ethanol exposure on event-related oscillations (EROs) in the hippocampus of adult rats,"Criado, José R; Ehlers, Cindy L.","Behavioural Brain Research Vol. 210, Iss. 2,  (Jul 11, 2010): 164-170."
